id,author,body,score,comment_karma,created_utc,subreddit
mr6p6dd,technicolorsound,"If they do make a “splash” move, my bet would be that it will be more of a distressed asset. Zion would be the big one if NOP is ready to get off the ride.

I’d be interested in paying a pick to get off Mann’s contract if you could get Ayton’s expiring. Claxton also comes up a lot, but I don’t know if I could stomach that contract for that many years.",5,8727,1746674534.0,AtlantaHawks
mr6yxhf,Archlefirth,Lateral move that would give up valuable supporting players that Giannis would need.,2,30487,1746678831.0,AtlantaHawks
mr6ctxt,Zteam18,yes. all-star game proved trae needs another star badly. i've watched i don't know how many playoff series' of trae getting clamped down on and everybody else just standing and watching. unless rissacher develops into jimmy butler over night were in for more of the same. nobody wants this play-in limbo the hawks are stuck in.,4,775,1746669837.0,AtlantaHawks
mr6jawp,Zteam18,"they could have gotten siakam and bridges last off season. i do not like the forever play-in the hawks are stuck in. Feels like it's been the same result for a while, nobody is getting younger.",0,775,1746672201.0,AtlantaHawks
mr8prnj,TerrorizingThunder,"I personally see Sorber going in the 12-15 range, so late lottery. A lot of teams need a big man & I believe Maluach & Queen will for sure be off the board by the 12th pick. OO is great but I’m just high on Sorber. Obviously the first two years he would backup OO. And I wouldn’t be surprised if it’s longer than that.",3,250,1746710976.0,AtlantaHawks
mr6m9hf,Bamalawdawg,Isn’t Brooklyn the only team with $20m to offer?,3,2883,1746673351.0,AtlantaHawks
mr8pwhc,TerrorizingThunder,I have Toronto taking Maluach at 7 & I don’t believe they would take that deal.,3,250,1746711021.0,AtlantaHawks
mr92evw,TerrorizingThunder,"Yes, close to $41M under the tax, which is about $7.7M in cap space. You can’t sign a free agent with a trade exception. Two rookies at #13 & #22 take up that $7.7M with their salary. What player are you thinking about with the trade exception? I went with Obi Toppin here.",3,250,1746714916.0,AtlantaHawks
mr6tll3,TerrorizingThunder,"Honestly, I wouldn’t trade JJ to acquire Zion.",5,250,1746676398.0,AtlantaHawks
mr6e8k8,TerrorizingThunder,Sure I agree he needs to be paired with another star in order for the Hawks to be a non-mediocre team but do you know how much it will cost to acquire Giannis? The Hawks would have no other real pieces around those two except Daniels.,7,250,1746670333.0,AtlantaHawks
mr6ddpw,thestallion11,"If the hawks trade for Giannis it will cost Jalen, Zach, OO and more plus 3 picks minimum. They don’t have enough to get Giannis while keeping a good team around him and Trae. Trae and Giannis + scrubs isn’t good enough to be an actual contender",5,127303,1746670030.0,AtlantaHawks
mr6k3yz,amidon1130,"Our whole team got younger lol. We could not have paid the price for bridges and Siakam had no interest in resigning with us. Building off the success (yes, it was a success) of this season is way smarter than blowing it up right after we got back on track.",6,237620,1746672510.0,AtlantaHawks
mr6t1bf,PeasePorridge9dOld,"We can SnT him too.

Honestly, if it’s just a 1+1 then why not pay him? Not like we’re using it in this mock anyway",5,16687,1746676149.0,AtlantaHawks
mr9h1gz,Quad-G-Therapy,"But wouldn't it be cool if they did? 

![gif](giphy|eYgVBZKw2LG6Y)",2,12864,1746719196.0,AtlantaHawks
mraepa8,PeasePorridge9dOld,"Yeah, you can. Without researching, I’d bet that >> 80% of FA signings are either SnT or through an Exception. Unless you have Max level $$, cap space is generally worthless - even teams below the floor will sometimes act as an above the cap team if they aren’t chasing the top end of the market. Thing about SnTs is that you are generally trading for the cap space over the player and there are well worn prices for cap space. We have the additional advantage of not actually needing the other team to eat $$ to create the space which should drive down the cost.

I don’t care about the $$ for picks at 13 & 22. Those picks should be trade fodder if the right player is available. Auburn’s starting lineup was older than ours. We have enough youth. It’s time to get some adults in the room.

The combine is next week so that’s when the rumors should start leaking about what teams could be doing this offseason. Some of the rumors I’ll be tracking
- teams that are looking at tax / apron thresholds. Obviously these are the teams that will be most interested in jettisoning salary and would place the highest value on not taking players back. IND (Nembhard, Toppin, & Neismith), ORL (Anthony, KCP), CLE (Jerome, Hunter - lol), MIN (Reid, NAW). All of them will be traversing new territory and might be a bit cautious.
- Teams that are looking at massive philosophical shifts, typically those transitioning to new leadership. SAC (Malik Monk)is the one that I’m looking at directly but other trans such as DEN, PHI, NOP, MIL, CHAR, LAL, and PHX could try to pull off something massive that could involve several teams each with a small part. Those are always fun.
- Last is the FA market and SnTs. These are trickier since we can’t include our picks this year in a package for them without getting investigated. Looking if teams are having productive conversations with their FAs or are we seeing some with roving eyes. Specifically have eyes on Santi Aldama and Naz Reid. Will also track Kuminga. Other could come up here too.",1,16687,1746728953.0,AtlantaHawks
mr6zfj7,technicolorsound,"Yeah, I’m not saying it’s a great idea, just that I can see them exploring it.",4,8727,1746679071.0,AtlantaHawks
mr6fbh8,Zteam18,don't care. the hawks aren't going anywhere with current roster and east make-up. i'd rather my idea go up against boston/cleveland than yours.,-4,775,1746670722.0,AtlantaHawks
mr6e1qv,Zteam18,they got mann off the scrap pile and was a contributer. none of what you said we would lose has gotten us past the play-in in 4 years. the all-star game trae showed me he needs a star to play with. i think a line-up of trae-daniels-giannis-nang-gueye is better,-1,775,1746670265.0,AtlantaHawks
mr6la3g,Zteam18,"i meant like us fans watching the hawks lose in play-in or first round every year besides after rona aren't getting any younger, i'm getting old watching the same old hawks. i hear the hawks got a chance for a super star I get pumped. I saw the hawks play greek freak in person this year. and trae looked next level playing with other actually good players in the all star game. i'll be over 40 before rissacher's game develops.",1,775,1746672962.0,AtlantaHawks
mrb6h95,TerrorizingThunder,"A team can use their trade exception to acquire a FA via sign & trade yes. However they can’t sign a FA outright with money from a trade exception is what I’m saying. Monk would be a nice addition, but it would probably take #22 to acquire him. Also with LeVert likely to resign & ya’ll sending picks for Mann it’s probably better to keep #22, sign Tyus, & land  Toppin for three 2nds because he provides needed front court depth with Capela likely leaving. 

Aldama & Reid will resign with their respective teams in my opinion. No need for Kuminga when Johnson, who is better, is already there. That would just end up being a bad contract. I believe this plan of mine here is a realistic offseason plan.",2,250,1746737157.0,AtlantaHawks
mr6pusp,technicolorsound,You keep saying “all-star game” like it’s a real game,2,8727,1746674810.0,AtlantaHawks
mrbwuz0,PeasePorridge9dOld,"... and what I'm saying is that maybe 4-5 players out of dozens or even 100's of FAs are signed with pure cap space in an off-season so why does it matter. It doesn't have much impact on signing an FA so why even continue to bring it up? 

I'd do Monk for 22. You're wildly overrating 22, especially in this draft. Already said the roster is too youth heavy so having less picks would be a good thing in my book. If they kicked in Ellis, then I'd hand over 13 instead - assuming we can navigate the contract.

Iffy on Toppin. I wouldn't mind acquiring him but idk if I'd burn the burn entire DJ TPE on just him. If he came with Nesmith then I'm sure something could be worked out. Would prefer to not hand over multiple 2nds in future years; Landry left the cupboard bare there and we need to restock. Would consider dropping from 13 to 23 for the right package.  
  
I'm fine on Tyus, but he feels more like a final piece than a centerpiece of the off-season. idk if he can play alongside Trae ala someone like Monk. Monk has proven off ball ability, but Tyus has always been ball in hand. Think we could get more defensively out of Monk too (albeit a very low bar). 

I suspect Reid and Aldama will be returning as well but both of their teams are about to have to make some hard decisions in regards to salary. Would be worth it to force both teams to take out the checkbook and at least match on $25M. No agent worth his salt would let the team just deny the SnT for no one and still play hard ball.

Kuminga is basically the worst centerpiece I could see us getting and still thinking we had even a semi-successful off-season. Neither F position has a backup so there's plenty of minutes for the taking. The fact that we've got no creator after Trae means that we have a lot of opportunity to sell. Would he come in on a 2 + 1 if he can compete for the keys to the O for 10-15 minutes/night? I'm sure that answer would depend on the other bidders too...",1,16687,1746745876.0,AtlantaHawks
mr6yhgx,Zteam18," I don't see how trae playing with another superstar is a bad idea. The Hawks dumped hunter for nothing. They dumped Collins for nothing. Murray was a failed experiment, but the Hawks got Daniels out of it. Did you watch trae in the all star game?",1,775,1746678618.0,AtlantaHawks
mr4t473,Blumpkin_Party,5/125 is best case imo,65,71036,1746651304.0,AtlantaHawks
mr4s3a1,Mykal22,Jalen Suggs got 5 years $150 million so something similar to that.,38,2234,1746651016.0,AtlantaHawks
mr4tzo9,capelaMVP,"Derrick White got 4/118, I would aim at that being about the ceiling as Daniels has a way smaller track record than White had. It also heavily depends what Dyson values he had injury riddled first two seasons and might just wanna lock down generational wealth a little under market value or he bets on himself and looks what he can get in RFA next year.",30,12464,1746651542.0,AtlantaHawks
mr4xtai,Born-Spinach5235,115-125 for 5 years would be great for us. We cant offer him more than Jalen i dont think and this would be a really good deal for both sides. I want it to be a least 5 years though and i think if they gotta pay a little premium to lock him down for longer itll be worth it.,21,466,1746652648.0,AtlantaHawks
mr4r5pq,Sammcbucketts,I would offer 5/120 and I would agree to 5/130. I wouldn’t offer or agree to 5/150.,15,68570,1746650755.0,AtlantaHawks
mr4ywx3,SuperAverageGuy,I think 155/5 is probably the number Dyson signs for. Might be less. Basically the same Percentage of the Cap that suggs was given. I like to think of it as a percentage rather than a number when comparing contracts from years past.,9,5781,1746652977.0,AtlantaHawks
mr537c8,Bry_Mac,"Something team friendly, otherwise I'm going to RFA.",5,13034,1746654293.0,AtlantaHawks
mr5b7xu,Confident_Pear_8303,4/100 - 4/120 Neighbourhood...,6,9977,1746656901.0,AtlantaHawks
mr4rwxi,Josh378,Should he get Dre's contract? 80 million for 4 years?,9,12151,1746650967.0,AtlantaHawks
mr4pa5z,Patekchrono917,Not a penny more than Jalen’s. ,4,19332,1746650226.0,AtlantaHawks
mr58hxp,Joethetoolguy,5/125 thats less than vassell and around dejountes deal. Gotta pay him based on his potential.,1,17272,1746655990.0,AtlantaHawks
mr5d2c6,TheRider5342,"100 year contract, 100 billion. Is this enough money for the GOAT?",1,86711,1746657529.0,AtlantaHawks
mr5iy0u,Party_Fisherman9615,He’s getting about 30 a yr and worth it.,1,88,1746659546.0,AtlantaHawks
mr5n4um,cbreezy1010,4/125,1,1,1746660941.0,AtlantaHawks
mr9ghb2,bluevsu,Whatever it takes to lock him up for the next 10 years,1,4641,1746719035.0,AtlantaHawks
mr4u3uj,Falcons__Fury,"I'd offer him the same exact contract as Jalen. Maybe a tiny bit more to get the deal done, but he's restricted so I'm willing to wait. Winning teams are smart with their payroll, you want contracts that get better with age, not worse.",1,4730,1746651574.0,AtlantaHawks
mr5f8fz,jay_da_truth,4 85 million with last 2 years being team optional,1,5537,1746658270.0,AtlantaHawks
mr4q49e,MadMonkeh,4/64M is not unreasonable is it? I remember that being the offer THJ got,-10,3386,1746650460.0,AtlantaHawks
mr4xf0q,HD_GUITAR,"Don’t compare my man to Suggs. 

Dyson=Bron 2.0",17,2046,1746652529.0,AtlantaHawks
mr5xb0s,IveGotsTheRemedi,"I don't think I'd want to pay that much based on 1 year. There's no point in paying $30M/year a season early unless you see real potential of him getting a max the following year and as much as I like Dyson, I don't see that at all.",1,1075,1746664514.0,AtlantaHawks
mr5xy63,IveGotsTheRemedi,"White is also shooting well at an insanely high volume, which is a much more useful skill than Dyson's floater game.",4,1075,1746664739.0,AtlantaHawks
mr6wkp6,Blumpkin_Party,Dyson is a scary player to let hit RFA because every team needs players with his skill set.,7,71036,1746677737.0,AtlantaHawks
mr4xi6b,HD_GUITAR,"Idk much about this stuff, but that was before the cap had changed right?",2,2046,1746652555.0,AtlantaHawks
mr5e8pd,dillpickles007,That's also why it's sometimes smarter to get a deal done early.  Bet the Mavs wish they'd locked Brunson up a season before they tried to.,5,215735,1746657929.0,AtlantaHawks
mr4qh41,Patekchrono917,What in the world. ,18,19333,1746650561.0,AtlantaHawks
mr4v5kg,tvcneverdie,Dyson should climb on the negotiation table and take a dump if that's the offer,10,178763,1746651870.0,AtlantaHawks
mr4sm57,amidon1130,Try 5/125 and we’ll see if he even takes it lol. Cap has blown up and elite role players come at a premium,3,237620,1746651164.0,AtlantaHawks
mr4x1tz,Bighead_1k,Never compare dyson to thj again.,2,7297,1746652421.0,AtlantaHawks
mr52d69,SortaFire,dyson is mj 2.0 jalen is bron 2.0 trae is steph 2.0,21,3033,1746654035.0,AtlantaHawks
mr6w0td,PeasePorridge9dOld,"We gave Jalen $30M / year for 1 season. Suggs wasn’t looking too hot going into his 3rd year too.

If we use Suggs as the basis then I would be fine with that. Especially if we can get Dyson on a declining deal like Suggs’.",3,16687,1746677484.0,AtlantaHawks
mr992or,Bry_Mac,"You match anything offered. Done.

Had Jalen not signed his team friendly deal, I would have done the same.",2,13034,1746716880.0,AtlantaHawks
mr4xt6k,Josh378,Yep. I just don't think he's worth 25 to 30 million a year right now. That would put him on the borderline all-star pay grade.,5,12151,1746652647.0,AtlantaHawks
mr4qrh1,MadMonkeh,I’ve been behind the times in terms of contract negs,10,3386,1746650642.0,AtlantaHawks
mr53eom,Quad-G-Therapy,Subscribe,8,12864,1746654355.0,AtlantaHawks
mr8o7yf,IveGotsTheRemedi,Jalen has a much more complete offensive game than Dyson. Dyson is still a 60% FT shooter which raises a lot of questions on his shooting.,1,1075,1746710453.0,AtlantaHawks
mr6n6qs,_QazzaQ,You‘re really underestimating the cap increase. 25 million is not close to all star money. There are 75 players are projected to make 25M or more next season and Dyson’s contract will not start for another season,3,3432,1746673723.0,AtlantaHawks
mr5moxs,GoBlueAndOrange,That sounds about right tbh.,2,15712,1746660792.0,AtlantaHawks
mr4rnmn,Patekchrono917,The full non tax payer MLE is 14 million this year. The cap has increased a bunch the last few years. Even more than it has been. ,8,19334,1746650894.0,AtlantaHawks
mrbxfdy,PeasePorridge9dOld,"Don't disagree, but let's not move the goalposts. Jalen is simply an example of a player we gave $30M after 1 season of production. So that hasn't stopped us before, why should it stop us now?

Suggs is still the comp for Dyson in terms of the deal. Suggs is/was the better shooter in his 1 successful year before his extension, but it isn't like he didn't turn back into a pumpkin when he was on the court this year. Meanwhile, Dyson had more rebounds, assists, points, steals, and blocks.",1,16687,1746746076.0,AtlantaHawks
mr4tdvg,MadMonkeh,Ah gotcha. It’s been hard to keep up with contracts and whatnot and cap increases with *looks around America* everything else going on,5,3386,1746651377.0,AtlantaHawks
