id,author,body,score,comment_karma,created_utc,subreddit
mr7mxhb,SleazyFanatic,"I liked him on the Pelicans, and he would be a good pick-up to come off the bench at that price. He shot 38% on threes on about 5 attempts a game.",30,20091,1746692654.0,AtlantaHawks
mr7xe13,CompEconomist,Would love this! Anyone have reason to believe there is mutual interest? Would be a perfect match to our needs.,16,2965,1746699153.0,AtlantaHawks
mr88beq,PeasePorridge9dOld,"He’s definitely an upgrade although idk if he’s an answer. He doesn’t create as much as finish. 

Definitely wouldn’t mind paying him regardless.",11,16687,1746704430.0,AtlantaHawks
mr7nj2d,dwayneomosley,Oh and he played 82 games this season!,22,798,1746693046.0,AtlantaHawks
mr94qia,Josh378,Who would he replace on the roster tho?,1,12151,1746715603.0,AtlantaHawks
mra4aq2,Doc_Mechagodzilla,Could be a replacement for LeVert if he leaves by basically occupying that salary slot.  I think I like LeVert better due to his ability to create his own shot with is essential in non-Trae minutes but NAW would be a defensive upgrade.  Still would have the Murray TPE to get a back-up center (our biggest need).,1,2263,1746725962.0,AtlantaHawks
mr99t6b,HoxTalks,"Vit? Mann? I guess. Just generally a bench 2/small 3 that you can rely to knock down 3s and play good defense. Good enough of a player that he could start in Dyson's spot if Dyson got hurt too. I would say that NAW positionally is more like Caris (and ofc with both being UFAs) but NAW isn't really a guy who gets his own shot like Caris

NAW is certainly a better player than Vit/Mann/Bufkin though",10,340,1746717096.0,AtlantaHawks
mrbjgtq,dwayneomosley,"I definitely see him as a replacement to Mann, who either goes third string or we try to find a trade for... he could play alongside LeVert pretty well I reckon.",3,798,1746741219.0,AtlantaHawks
mrcgqbg,NecessaryClassroom92,So we'd have to trade Mann right? Mann's contract kinda sucks so idk how doable that is. ,1,231,1746753167.0,AtlantaHawks
mr5zutl,PaleChubSissy2,I see it hehehe :),8,37,1746665404.0,AtlantaHawks
mr5yoii,realgangstuff, Needs less hair,6,28890,1746664996.0,AtlantaHawks
mr5xbsm,Valuable_Ad4343,Trade him,-23,1473,1746664521.0,AtlantaHawks
mr5yemg,Truth-Seeker916,For the normal reddit guy?,14,17245,1746664901.0,AtlantaHawks
mr71s3m,WzrdKelly10,I’m still interested in seeing him play. His preseason was impressive. Injury was unfortunate but now he has 2 years of pretty much working on his body and learning the speed of the game with NBA coaches and trainers.,45,16051,1746680240.0,AtlantaHawks
mr725my,CapelaDPOY,"Think he’s got this next season to prove himself otherwise he’s done imo. I’m an advocate for signing Tyus Jones in the off season so he’d be 3rd string at best, maybe some time in the Skyhawks for development",38,12383,1746680433.0,AtlantaHawks
mr72fjh,dangheckinpupperino,"If he can stay healthy I think he’s got a real future in the league 

Does all the little things, and is crafty. Can’t see him not being quality rotation guy at least if he stays healthy over the next 3 years",20,138815,1746680576.0,AtlantaHawks
mr71lul,DownTheHall4,">Do you reckon with a full preseason

That’s the problem here - he can’t stay on the court. In the limited times he’s played, been good not great. 


Defensive first guard, smart player, ok not great shooter. Fits a lot of what we need in a pg2 to cover non-Trae minutes. 


The problem is singular - bro can’t stay healthy. Part of that’s luck, but there’s a saying that “luck is a skill”… and availability is too",21,11808,1746680152.0,AtlantaHawks
mr72sqz,No_Internal404,"Wouldn’t let him hold up any trade obviously but I’m still a big fan, his preseason was solid in terms of seeing what this kid have .. defensive minded combo guard would be huge for our depth . Would love for at any given time we have Dyson or Kobe on the floor next to Trae to take those matchups. Obviously the health has been a problem but I can’t blame the kid for that , what could he have possibly done lol ? If a team comes calling for him and it’s real value , I mean of course , If not let’s see what we have with him. We do need security at the backup position & I thought going into this season with him as the main backup was a mistake in itself but I’m still a fan man. I see the appeal with him. I really do",9,22046,1746680769.0,AtlantaHawks
mr75s8a,Patekchrono917,"Even in the games he played I’m just eh on him. I did like how his defense looked vs HOU his rookie year but that’s a long time ago. And this team needs a lot more than just a defense only guy now. His shooting is still below average and he can get to the hoop some but maybe not with his shoulder issues. I’m way more interested in how Dyson and Zacc start the season next year. I’m not even sure what his role on the team would be if he’s healthy to start the year. And I’m assuming the hawks actually learn from their mistakes and go after a real backup point guard. If he’s your backup point to start the year, then that’s some risky ass planning. ",7,19332,1746682362.0,AtlantaHawks
mr76055,JKking15,I really like the defensive upside and on ball ability to create rim pressure but he’s still raw and we just haven’t really gotten a fair sample to make a judgement of him.  I’d love to see him play just like 20 games a row so we can make SOME type of assessment,5,50234,1746682481.0,AtlantaHawks
mr8z59g,Jbots,"Kobe bufkin is a small, one-handed, injury prone player with poor shooting. 

He has a quick first step and can get to the rim but it isn't on an elite level. 

For those of you that like this kid, whatis his elite skill? What is his swing skill? Those are easy questions for most NBA level players.

Also, go back and watch him. Everything is with the left. Even if he plays a full season, this kid is gonna get figured out.",4,44136,1746713939.0,AtlantaHawks
mr72uhq,Horror_Measurement94,Keaton Wallace clears Bufkin.,12,53,1746680795.0,AtlantaHawks
mr8cbxm,Atl-Fan_FTS,Who?,4,170665,1746706087.0,AtlantaHawks
mr745m8,lilyahweh,"Aside from the obvious defensive upside, I love that he’s shown flashes of shot making but we def need someone who can stay healthy",6,1981,1746681486.0,AtlantaHawks
mr7uujz,CompEconomist,"He seems to have very little trade value and potential upside. I’m not sure if we can get a better player at the end of our bench, so why not take a flyer on a guy who could become a top 8/9 rotational piece. Shoot, let him develop in the G league a year if that’s possible.

EDIT: Would t let him hold up a trade but still intrigued at his potential.",5,2965,1746697673.0,AtlantaHawks
mr750z2,Blumpkin_Party,I still find him to be a very interesting prospect just has to stay healthy. If he can’t do it this year I think they will probs move on.,2,71036,1746681952.0,AtlantaHawks
mr7al35,childishgames,"I don't think he's shown much to inspire confidence and is coming off an injury going into year 3. I'm basically just operating under the assumption that we can't depend on him being a quality NBA rotation player and we should continue to look for guards. If he proves otherwise this year, which is still possible, it'll just be a pleasant bonus.",2,37999,1746685053.0,AtlantaHawks
mr86xp4,Wavegod-1,"His value is low, due to health so, he'll pretty much be here for a minute.",2,4485,1746703840.0,AtlantaHawks
mr9rcnv,Pesmond_Diddler,Kris Dunn was a quality starter on a good playoff team this year. Bufkin is the same age as when Kris entered the draft process and he spent his second contract here on IR then years in the G League. I think he got the time to heal and give him some run and see what he can do. ,2,9052,1746722226.0,AtlantaHawks
mrc5knn,Graffiti_Soul,I like Kobe. I think he can shoot better then he's shown. He's pretty skilled and a defensive guy. I think he has a future here but if his name comes up in a trade for a better player I'd move him,2,15190,1746749011.0,AtlantaHawks
mr775aj,IceTraeDaGang,"I’m tired of injury prone hawks, so I’d trade him if he has any value. If not I guess we see if third seasons the charm.",2,39317,1746683107.0,AtlantaHawks
mr7nccg,CoachKillerTrae,Yeah he was a stupid pick and it’s showing. Keaton clears him. I wanted to root for him but he’s just never healthy and isn’t a solid enough shooter or playmaker to be a good offensive point guard in this league,2,26148,1746692923.0,AtlantaHawks
mr76tdo,jimisl8,He is definitely injury prone. I doubt he would ever have a complete season. Trade him when he's healthy.,2,663,1746682926.0,AtlantaHawks
mr78e29,Historical_Main5261,"I haven’t had a problem with his play because he hasn’t been given a chance to really acclimate to the nba fully yet, although he really needs to learn to shoot the 3 ball


Biggest problem is that he has to stay healthy this upcoming season, this is his “prove it” year",1,33926,1746683800.0,AtlantaHawks
mr7yimb,MiserableSoft2344,I’m excited for him. I thought he was finally turning the corner just before the shoulder injury.,1,69982,1746699774.0,AtlantaHawks
mr8alyb,PhilosophyFair9062,"I need at least a season before we ship him off. If we trade him now while looking for a big, he's going to turn into SGA with our luck",1,17254,1746705384.0,AtlantaHawks
mr8pl2m,_mdz,"His value is so low right now we just have to wait and see. If he is good when healthy then awesome that solves a lot of problems needing a backup for Trae. If he sucks then we take the L on the draft pick. If he has another injury setback you just wait it out again and then resign him for a super low contract when the time comes. During all that if someone sends you an offer you can't refuse, peace out Kobe. All I know if we can't depend on the dude, if he turns out well then it's a bonus.",1,95561,1746710915.0,AtlantaHawks
mr8q0wn,ATLfinra,GET RID OF HIM.  Best ability is availability,1,19357,1746711062.0,AtlantaHawks
mr8usut,Bry_Mac,"He's 100% available for trade this off season, but I'm not sure what his value is given his injury history. Otherwise, stay healthy and play at the end of the bench. Right now, injuries have made him a bust, and I can't say otherwise until he actually plays.",1,13034,1746712601.0,AtlantaHawks
mr91noe,MasterOfKittens3K,"He’s still fairly young, but at this point he’s also still all about potential. I don’t think he has much trade value, because he hasn’t shown that he’s capable of playing in the NBA yet. And at some point soon, he’ll have to prove that, or he’s going to be replaced by someone else who has shown that - or someone younger with potential. I think this is the last year that “potential” can get him on the roster.",1,234641,1746714690.0,AtlantaHawks
mr923y5,AcademicMedicine5847,"Honestly, i say let's trade him if we get the chance. Sadly, I would say he was a bad pick when Cam whitmore went after him. He could've had a good career, but with him never playing cause he's always injured, it's kinda our loss. I hope he proves me wrong, tho",1,831,1746714824.0,AtlantaHawks
mr95dc7,jay_da_truth,I like the kid but man he is getting beat up. This most likely will be his make or cut year if he can actually stay healthy. Also wouldn't be surprised if he gets traded for picks and cash,1,5537,1746715787.0,AtlantaHawks
mr9rqnf,MrWetPoopz,"Can’t develop in the offseason if you’re having to rehab. Cant develop during the season if you can’t get in-game minutes due to health. 

I won’t be sad if we trade him, but I do hope he gets to have a healthy season.",1,28253,1746722343.0,AtlantaHawks
mrcby7n,linnykenny,I forgot he was on this team lol,1,171392,1746751403.0,AtlantaHawks
mrekkg3,_GloryKing_,I expect him to last one more season at most. New regime won't have the draft ties to keep around an oft-injured combo guard who can't shoot.,1,760,1746791416.0,AtlantaHawks
mrfetsx,ThaCasual,It’s prove it time. He has shown flashes and has a 30 pt game under his belt in limited action so there something there. With a consistent 3 and he figures out how to avoid getting blocked at the rim he would be a good backup pg. has good length and plays d. Has a fearless mentality. I like confidence in players.,1,20,1746802098.0,AtlantaHawks
mr7m8ka,Arcanus124,"Bufkin is a black box to me honestly. He could be SGA and he could be a g-league guy for all I know. 

I think one thing for me is that I am not eager to move off of him right away for nothing. If the right deal is there, then cool, if not then his archetype is theoretically great for us and I'm cool to wait until the trade deadline to see what we got. If another org is willing to give real value for him at a position of need for us, that's fine too.",1,13786,1746692201.0,AtlantaHawks
mr7ygq9,BroDoc22,He’s very talented and has potential. He deserves a real shot healthy to see what his ceiling can be,0,15926,1746699746.0,AtlantaHawks
mr8v5gg,Bry_Mac,"Agreed. Given his history, even if it's not Tyus, a 2nd Unit PG is something we should sign. We can't rely on him to stay healthy and he hasn't played enough NBA minutes either.",11,13034,1746712711.0,AtlantaHawks
mr75r2z,Hooligan8,This is exactly right. He hasn’t even played half of a full season worth of NBA games so far. He can’t be depended on for serious NBA minutes as our #2 PG,19,77979,1746682344.0,AtlantaHawks
mra4rp9,LocksRKool,Injuries are random. There is no predictor if their medicals are clean,3,3401,1746726096.0,AtlantaHawks
mr9fdpx,stu21,You're not wrong.  At this point he has not proven himself as more than a trade piece even when he is healthy.  Not a point guard and too small to play shooting (he is not so great at that either) guard.,3,16201,1746718719.0,AtlantaHawks
mrbaq33,Josh378,The guy who will be sent to the Raptors or Houston with two picks for Khaman....,2,12151,1746738428.0,AtlantaHawks
mrbq9ko,Atl-Fan_FTS,I like your style,2,170665,1746743545.0,AtlantaHawks
mr69xuf,gatorhater1104,Honestly don’t think Sorber is a bad player at all but I feel him and Onyeka are very similar and we need a bit more versatility at center,20,38,1746668838.0,AtlantaHawks
mr68w47,thestallion11,"This isn’t the sexiest off season but it’s a hell of a lot better than a lot of people in here propose. I’d say the hawks probably need a better back up C than Sims, Kornet seems to be a popular option who would fit well. They should definitely use the mid level to see if they can get another veteran wing. 

Tyus would be a dream",33,127303,1746668475.0,AtlantaHawks
mr6i73q,amidon1130,Caris is worth a lot more than people on this sub think he is,20,237620,1746671782.0,AtlantaHawks
mr6b3q5,SepsDaddyVroom,I wouldn’t be surprised if the front office traded two frp’s for maluach,9,201,1746669237.0,AtlantaHawks
mr6at42,Atl-Fan_FTS,If our Center rotation next year is Okongwu / Sorber / Sims we are right back in the playin.,6,170666,1746669136.0,AtlantaHawks
mr75y11,Radimov79,"Gonzalez is very good in fact he's Spanish and I'm quite a fan of his game, but he's very similar to Djurisic (although better) I'm not sure he's what we need. I wouldn't pick Sorber with a pick 13 really.",3,4130,1746682449.0,AtlantaHawks
mr80k7r,Cautious_Hornet_9607,"Getting Toppin would be a great move, mostly because I'm tired of him killing us every time we face him",3,64668,1746700861.0,AtlantaHawks
mr87un5,Wavegod-1,"We'll draft a center and another wing as the depth there is severely lacking as we saw this season with JJ being injured, OO being injured for a bit of time and Clint's impending exit. Still also need a quality backup PG, which, I think they will go after in FA.  The assets they have available are lacking to make a big splash for a superstar, unfortunately and I think the DJM trade and the Sadiqq trade (more than anything) has made them hesitant because of the assets lost there.",3,4485,1746704233.0,AtlantaHawks
mr9ge51,Quad-G-Therapy,"Hi OKC fan! Pulling for yall to win the chip this year.

  
I like your plan. However I am hoping we get Asa Newell and Maluach or some variation.",3,12864,1746719010.0,AtlantaHawks
mr87uqv,CoachKillerTrae,Krejci absolutely needs to get minutes over Mann. Krejci does everything Mann does and more,2,26148,1746704234.0,AtlantaHawks
mral7ax,alexgt2030,Anyone who takes Hugo Gonzalez at 22 should be fired.,2,5323,1746730867.0,AtlantaHawks
mr6u21c,PeasePorridge9dOld,"Could just be me, but I’d be underwhelmed. We enter the offseason with the 3rd highest spending power of any NBA team. Walk out with the biggest moves being a Caris LeVert resigning (for at least $5M less than what he’d take) and a 15 min/night Trae backup. And somehow the C position got worse as OO has played > 60 games twice in his career and his backups would be a rookie and a mini.

Meh.",3,16687,1746676600.0,AtlantaHawks
mr6qsr6,WzrdKelly10,"Great outline honestly. I see Sorber as a Jarret Allen prototype. Exactly what we need. I haven’t looked much into Hugo yet. Another couple other names I would look at for the Lakers pick is Noah Penda and Nique Clifford. Just guys you know that can come in and contribute immediately. 

Also would look into maybe doing something with Niang’s expiring contract if we’re able to get Obi. Great shooter but the defensive issues are a problem and we would already have the depth.",2,16051,1746675202.0,AtlantaHawks
mr6bwtj,Archlefirth,Spend nothing win nothing. Perfectly mid. 😌🪷🧘🦅,2,30487,1746669516.0,AtlantaHawks
mr66ipc,Zteam18,Please no. We are at trade everybody besides young for Greek freak or trade trae and start over.,-11,775,1746667683.0,AtlantaHawks
mr6c0t1,TerrorizingThunder,"Sorber has potential to be better than OO, & by a good margin. I’m very on Sorber. Last year my favorite center was Missi. This year it’s Sorber.",-2,250,1746669555.0,AtlantaHawks
mr6bool,TerrorizingThunder,Yes I think it’s very realistic. Indiana will need to save money with a deal like this in order to resign Turner & stay under the first apron. Kornet is another option but I think he’ll demand closer to $5-6M than take a minimum with a different team.,8,250,1746669436.0,AtlantaHawks
mr878p7,Wavegod-1,It's the most realistic and better one in a while for the franchise,5,4485,1746703971.0,AtlantaHawks
mr6kssx,Bamalawdawg,I think he gets MLE offers. So it’s probably 2/$30m+ to even get in the conversation,12,2883,1746672775.0,AtlantaHawks
mr6ch8f,TerrorizingThunder,Like two 1sts on top of #13 to trade up? I don’t think the Hawks consider that.,4,250,1746669714.0,AtlantaHawks
mr6cei5,TerrorizingThunder,"Y’all don’t have enough cap space to sign a legitimate center in free agency. I’m high on Sorber, like I was on Lively, Ware, & Missi. He’s one of those guys in my opinion. And don’t forget about the Tyus & Obi additions.",14,250,1746669687.0,AtlantaHawks
mr6f7zy,Hooligan8,JJ erasure,4,77979,1746670688.0,AtlantaHawks
mr9grk7,Quad-G-Therapy,"Thats ignoring the impact of Dyson growth, Rizzy 2nd year, JJ coming back, and Sorber or Sims taking a big step as well.",0,12864,1746719117.0,AtlantaHawks
mr8qm8y,TerrorizingThunder,Yes I really like him at 22. And I personally like Sorber to any team in the 12-15 range.,1,250,1746711260.0,AtlantaHawks
mr8qmpl,TerrorizingThunder,Agree,1,250,1746711264.0,AtlantaHawks
mr8qvxe,TerrorizingThunder,"Yes I agree. Sorber here is that center & Hugo adds wing depth. Tyus would be the perfect backup PG. I also addressed the backup PF position with Toppin, who can also be a small ball 5.",2,250,1746711348.0,AtlantaHawks
mr9yqzv,TerrorizingThunder,Thank You 🙏,1,250,1746724360.0,AtlantaHawks
mr8qxjw,TerrorizingThunder,Then why did the Hawks trade Bogdan & three 2nds for him?,1,250,1746711363.0,AtlantaHawks
mrb6ows,TerrorizingThunder,Hugo is projected to go in the early to mid 20’s.,1,250,1746737220.0,AtlantaHawks
mr8q6oh,TerrorizingThunder,$7.69M in cap space & that goes down with the rookie signings. The Hawks can’t make a big signing. They’ll have bird rights on LeVert along with the full MLE to use on talent. And they also have a large trade exception via Dejounte which I have them using on Toppin. I think the squad in this plan is very deep & gives the Hawks a chance to be the 6th seed if healthy & a few guys make jumps.,1,250,1746711115.0,AtlantaHawks
mr6trko,TerrorizingThunder,Damn I forgot Niang existed 😂,1,250,1746676471.0,AtlantaHawks
mr6dtt3,TerrorizingThunder,Would you consider a trade for Giannis? And what would you be willing to give up? Milwaukee would need a ton & I don’t think Atlanta would be able to go far with no depth.,1,250,1746670186.0,AtlantaHawks
mr6bfqw,TerrorizingThunder,You really want to do that? Depth is important as well & the Hawks would have none.,5,250,1746669351.0,AtlantaHawks
mr6irod,amidon1130,"We made a big move and it bit us in the ass, we should keep building slowly and on the margins. We shouldn't be aiming to compete for a title next season, we should be aiming to win 45+ games and comfortably making the playoffs. Then when we have real pieces we can make a bigger trade. Getting trae a siakam level player and keeping our depth would make us better than getting a giannis level player and having the shittiest of shit rotation level dudes around him and trae.",3,237620,1746671997.0,AtlantaHawks
mr6upaj,childishgames,"That seems weird to me that Sorber's potential is significantly higher than OO given that OO was the #6 pick in the NBA draft and Sorber is being projected as a mid first rounder. Maybe OO was a bad draft class idk, but OO at 6 has solidly panned out and he averaged 15 and 10 with a 65% TS% since becoming a starter in January and has generally been good in his career before that.

I'm cool with sorber and I think the board is relatively open for us but I feel like he's someone i'd more prefer to pick if he falls to 22. I've seen sorber ranked as high as like 12 and as low as like 23. I don't have a particularly strong opinion on the guys ranked like 12-25ish but recently i've been liking Danny Wolf. I was really surprised by his skillset when watching film and think he could compliment OO in the rotation.",9,37999,1746676885.0,AtlantaHawks
mr6lj3d,amidon1130,Brad Rowland reported he heard 2 for 40 as a starter. I just think some team with more money will try and pick him up.,5,237620,1746673061.0,AtlantaHawks
mr802ko,Cautious_Hornet_9607,"I think he means both of our picks in this draft, so 13/14 and 22",7,64668,1746700609.0,AtlantaHawks
mr9hubb,Atl-Fan_FTS,"You can say that about every single team in the league. You think we are the only team trying to develop our core or something?

For example: You’re ignoring the Paolo and Franz growth and their draft picks taking a step 

You’re ignoring Herro and Wares development and whoever they draft taking a step.

You’re ignoring Cade, THJ and Harris improvements and their draft picks taking a step

… you keep this same core, expect the same results. We aren’t the only ones who were missing a key player and damn sure aren’t the only ones trying to  improve the roster skill set.",1,170666,1746719427.0,AtlantaHawks
mrc0xlf,CoachKillerTrae,"Because they thought veteran leadership would be the answer, and the biggest issue was getting off Bogi’s contract. It was horrible trade either way though",3,26148,1746747337.0,AtlantaHawks
mrcdu72,alexgt2030,"I can’t see him impacting any NBA team within his first two years, much less a team with aspire of getting a top 6 seed like the hawks. He barely got playing time at Madrid, and even in those minutes, he wasn't an effective offensive player. Sure, the shooting potential is there as his form looks good and he shot over 70% from the line, but going 20-76 from three in Spain will not magically turn into a league average floor spacer within two years. Sure, he has a decent feel for the game and decent athleticism, but he plays too fast to maximize his positive attributes. He’s more athletic vertically than laterally, so ideally he’d be the third guy on a capable defense, which the hawks do not currently have. He hasn't displayed any creation upside, for others or for himself, apart from a few cuts to the basket and some pnr flashes on very low volume. If the Hawks take him he’s spending at least 1 year in College Park, maybe more. At 22 there’s a plethora of other names than can fill roster holes and contribute for <15 mpg. Fleming, Clifford, Wolf,  Walter Clayton, Carter Bryant, and Beringer are all more NBA ready than Hugo with profiles that the Hawks need but don't have. Sorber at 13 is a bit of a reach but still a nice pick, but shooting would have to be a priority at 22 if he’s the pick.",2,5323,1746752099.0,AtlantaHawks
mr8vxdq,PeasePorridge9dOld,"Complete cop out here. 

ATL is $40M under the tax with a $25M TPE. That’s easily high end 6th man $$. Absolutely no reason not to be walking out of the off-season with a splashy trade or FA signing for that $$. Depending on how much of that is used, there is still room for an MLE signing and filling out the roster too.",1,16687,1746712953.0,AtlantaHawks
mr6v3xu,WzrdKelly10,Understandable lmao but I can see a team take a chance at his 8.5 mil expiring,2,16051,1746677066.0,AtlantaHawks
mr6n58u,Bamalawdawg,"ATL doesn’t have to depth to do that AND be any better than a 5-6 seed for quite a while. They’d have to give up Jalen Johnson and at least one of Zacc and Dyson, probably both, plus picks. So no future picks. No bench. Not even a young team to grow into at that point.",9,2883,1746673707.0,AtlantaHawks
