id,author,body,score,comment_karma,created_utc,subreddit
mpxci46,WallStreetDoesntBet,"The first and only other player to win the MIP award for the Atlanta Hawks was Alan Henderson in the 1997-98 season.

https://preview.redd.it/5g8oui8tz1ye1.jpeg?width=400&format=pjpg&auto=webp&s=806d2483378df6eaa757f62968e5456561966427",195,205866,1746054280.0,AtlantaHawks
mpxcybx,Anthony00_,"![gif](giphy|dijK6WYRdSoJEikGPS)

WE DID IT",147,2921,1746054428.0,AtlantaHawks
mpxcie6,ahend1999,LETS FCKN GOOO DYS,87,198244,1746054282.0,AtlantaHawks
mpxct1n,kj114,They actually voted the award correctly for once instead of giving it to an already-good player like Cade,167,23087,1746054380.0,AtlantaHawks
mpxcwe1,Aardvark-0001,lol not Shaq calling him a role player vs Kenny saying he plays winning basketball on a team that doesn’t win… lmao tnt,75,19939,1746054410.0,AtlantaHawks
mpxcqgm,Aardvark-0001,Let’s go Dyson!,21,19939,1746054356.0,AtlantaHawks
mpxcjbv,No-Statement2374,Fuck yea!,18,6753,1746054290.0,AtlantaHawks
mpxcyf1,TheTalkingBucket,We got a good one ladies and gents,13,10460,1746054429.0,AtlantaHawks
mpxd9hc,ahend1999,hes on tnt rn!,13,198244,1746054534.0,AtlantaHawks
mpxcpgp,ocuvw,There it is!!!!,12,4468,1746054347.0,AtlantaHawks
mpxcvir,telungoku,Easily deserved. Great win for DD,12,19879,1746054403.0,AtlantaHawks
mpxdych,WestCoastHawks,Dysonsexuals we won!!!,12,12814,1746054767.0,AtlantaHawks
mpxdlik,No_Wolf1795,![gif](giphy|aiuIzxPrFbOMgbNgei),9,3799,1746054647.0,AtlantaHawks
mpxcsxb,staatsclaas,BOOM,7,98677,1746054378.0,AtlantaHawks
mpxctmn,JasonIsKewl,That’s my goat,7,28187,1746054385.0,AtlantaHawks
mpxeato,Ecstatic-Traffic476,"We fuxkin made it omg.

![gif](giphy|l378giAZgxPw3eO52)",7,3023,1746054883.0,AtlantaHawks
mpxcxy6,lolimdivine,brb ordering some vouseti,6,138284,1746054424.0,AtlantaHawks
mpxdav7,PossessionDue9381,LFG my Australian goat,5,27440,1746054547.0,AtlantaHawks
mpxd3z8,ExceptionalGlove,Well deserved.,6,8883,1746054482.0,AtlantaHawks
mpxcs1d,tvcneverdie,That's right.,3,178763,1746054370.0,AtlantaHawks
mpxcxyy,bonafide89,Hahaaaaaaaaaaaaaaaaaaaaaaaaaaaaayea,4,14594,1746054425.0,AtlantaHawks
mpxcy81,SomeonesOG_,They gotta give bruh a deal.,5,19,1746054427.0,AtlantaHawks
mpxdg76,KobeBufkinBestKobe,Hell yeah we got one of them at least. Salvaged the Murray trade life a motherfuck,3,43600,1746054597.0,AtlantaHawks
mpxe5dx,jamp0g,glad your guys got one!,4,7187,1746054832.0,AtlantaHawks
mpxdw4e,thessalylarissa,Dyson!!!! I am a proud parent this evening. 🥹,3,16898,1746054746.0,AtlantaHawks
mpxekz5,blingera,"🗣️DYSON MF DANIELS

fate robbed us of Jalen winning this award, made up for it with Dyson",3,97434,1746054977.0,AtlantaHawks
mpxelvj,Tuckerguy77,Congrats to the Great barrier thief! He will continue to improve.,3,933,1746054986.0,AtlantaHawks
mpxg6qx,phoenixsuperman,"man I'm a clippers fan too and after last night I needed some good news. zu was deserving too but I watched both players all year. Dyson will be an all star. he has grown SO MUCH. Zu is better than last year but it's been a long arc for him. dyson just went wild this year.

for all the dooming about the hawks (which is understandable and warranted), we should be excited to have this future mega star right at the beginning of his rise.",3,76240,1746055522.0,AtlantaHawks
mpxd4uy,CapableRequirement15,"Congrats, from a Spurs fan",4,30891,1746054491.0,AtlantaHawks
mpxcyw9,RoughAcanthaceae369,well deserved... but work on jump shots in the off-season,2,3,1746054433.0,AtlantaHawks
mpxdqwb,Spirited-Research405,Who is cutting onions?,2,11542,1746054697.0,AtlantaHawks
mpxdstc,justonekaye87,LETS GO DYS!!!,2,16019,1746054715.0,AtlantaHawks
mpxe23a,cmjoker,"Well we got one.  Was disappointed about DPoY and RotY because we had legit candidates, but happy Dyson got one this one.  ",2,29040,1746054801.0,AtlantaHawks
mpxe8zn,Ice2jc,WHOO LFG GREAT BARRIER THIEF ,2,64838,1746054866.0,AtlantaHawks
mpxebvf,DorkandPoon,Hell yeah baby!!,2,37611,1746054893.0,AtlantaHawks
mpxeec4,Wildvalor,HELLLLL YEEEAAAHHHH BABY,2,26106,1746054915.0,AtlantaHawks
mpxenxq,X-rayTaint,"Thank you Dyson, YOU FUCKING BEAUTY!!",2,2919,1746055005.0,AtlantaHawks
mpxfk8i,aurelianson,hes right too. he could realistically win it again next season as well.,2,17300,1746055308.0,AtlantaHawks
mpxfrqv,MegaMatrix08,LFGGG DYSON SPHERE HAD THAT ON LOCK,2,65360,1746055379.0,AtlantaHawks
mpxfxv1,Zteam18,Went from who to household name faster than anyone in recent memory. Maybe Victor cruz?,2,775,1746055437.0,AtlantaHawks
mpxgv3q,Competitive_Net_2779,Yessssir congrats my boy!,2,5870,1746055748.0,AtlantaHawks
mpxi5de,Born-Tank-180,What a trade!,2,3918,1746056178.0,AtlantaHawks
mpxivl7,002_timmy,"Ok, not winning DPOY hurts a little less now",2,30358,1746056421.0,AtlantaHawks
mpxj3en,BrandonDavidTattooer,And defensive player of the year.,2,8428,1746056493.0,AtlantaHawks
mpxjbfu,ReferenceThat8377,"He also should’ve been DPOY, but atleast he has this. Well deserved",2,1055,1746056569.0,AtlantaHawks
mpxp9fo,lurchcrawlz,Amazing!!!,2,3968,1746058592.0,AtlantaHawks
mpxpv26,rockhoward,What stat line must Dyson get next season to do the incredible feat of winning MIP again?,2,15745,1746058800.0,AtlantaHawks
mpxsteb,kj114,"He was also worthy, but I’ve always thought he was good and underrated. Really broke out late in the season.",2,23087,1746059832.0,AtlantaHawks
mpy8q22,BlitzBlake,"Good, we got this one out the way…. DPOY next year 😎",2,1471,1746065364.0,AtlantaHawks
mpygn31,Quad-G-Therapy,"Bro I cant believe this is our lives we got MIP/DPOY and picks for a guy that was literally bringing down the team. 

  
RIP Landry.",2,12864,1746068247.0,AtlantaHawks
mpzhy0u,CamPaine,"Deserved. He's going to be something special very, very soon.",2,201194,1746087390.0,AtlantaHawks
mq01u3s,TheRider5342,GREAT BARRIER THIEF🔥🇦🇺,2,86711,1746098947.0,AtlantaHawks
mpxexbd,Conscious-Squash712,Way to go Dyson!,1,1297,1746055093.0,AtlantaHawks
mpxf0nw,QuickThinkWrink,YESSS,1,13351,1746055125.0,AtlantaHawks
mpxfl6h,ForsakenAd593,Definately 😌 really glad for once they gave it to someone deserving,1,0,1746055317.0,AtlantaHawks
mpxgdbi,e_abes,He deserves this so much.,1,62510,1746055583.0,AtlantaHawks
mpxgdvo,imrosskemp,Im so glad the Hawks gave him an opportunity to be who he is.,1,130970,1746055589.0,AtlantaHawks
mpxgyn8,Adminscantkeepmedown,# LETS GOOOOO,1,68643,1746055781.0,AtlantaHawks
mpxka9o,duckbob45,"Glad we can get him ready for a big market team, the usual way it goes around here 😩",1,590,1746056895.0,AtlantaHawks
mpxm6mh,crimedawgla,"Next year 1st Team, in 2 years MVP, and then GOAT convo. Easy day.",1,15214,1746057533.0,AtlantaHawks
mpxnvcf,GeorgiaOregonTexas,HELL YEAH!!!!,1,4116,1746058111.0,AtlantaHawks
mpxnvum,Atl-Fan_FTS,YEEEAAAAHHHH!!! Give that man his respect!!!,1,170661,1746058116.0,AtlantaHawks
mpxspx9,Joethetoolguy,Double Ds are awesome!,1,17272,1746059798.0,AtlantaHawks
mpy0355,lilraidin2D,Hell yea!!! Much deserved,1,77,1746062349.0,AtlantaHawks
mpy0930,5pliff_Tannen,Fleeced.,1,15554,1746062407.0,AtlantaHawks
mpy0z9z,JKking15,"Well deserved, now go out and win it again next year 💪",1,50234,1746062663.0,AtlantaHawks
mpy4iav,rnguyen1,"What a great trade, well deserved award. And he’s only 21!",1,1349,1746063906.0,AtlantaHawks
mpybksd,ParticularQuick7104,Deserved DPOY. A more prestigious title,1,2235,1746066374.0,AtlantaHawks
mpyx83b,Sally_Bond,Yeah,1,-5,1746075318.0,AtlantaHawks
mq4t4hc,Kindly_Effort_9891,"![gif](giphy|2GudwQ8pOPw2SKXxDK)

Let’s give it up for 1 of the 10 players that made to the nba from the ignite league!!!!",1,8725,1746154143.0,AtlantaHawks
mq4ue6h,Qertemont,I still think he should’ve won dpoy but this is also great,1,252,1746154636.0,AtlantaHawks
mq4wkqo,AnusButter2000,Absolutely deserved ,1,12899,1746155502.0,AtlantaHawks
mpzxc9x,Character-Total4410,"Dude I understand the argument for dyson daniels but you do realize cade cunninham pistons's were so bad last year and he carried that team to the playoffs. Hes averaging 3 more assists, 2 more rebounds, 4 more points, +2 on fg%. He basically led that trash team to the playoffs, cade cunningham deserves mip over dyson daniels.",0,0,1746096785.0,AtlantaHawks
mqcfnqn,extraproe,Should've been Zu,-1,10090,1746264742.0,AtlantaHawks
mpxetl1,Real2KInsider,"What skill did he improve?  He just played 12 more MPG.  
  
Worst to win the award since Ryan Anderson in 2012 (who also just played 12 more MPG).",-14,5953,1746055058.0,AtlantaHawks
mpxctth,kj114,Loved Hendu,41,23087,1746054387.0,AtlantaHawks
mpxfoz6,Real2KInsider,"Perhaps not coincidentally, Henderson was also one of the worst MIP's in league history and fell off again quickly.  A reason not to equate PT with ""improvement"".",15,5953,1746055353.0,AtlantaHawks
mpxe1as,ATLevator,"“Jason Tatum is literally everybody BUT Jason Tatum.”  

I saw someone comment this on r/nba when he copied everybody’s celebrations and it’s been attached to Tatum in my mind ever since.",30,56609,1746054794.0,AtlantaHawks
mpxeru9,PurposelyIrrelephant,Cade is much improved this year tho. Dyson deserved it more but Cade looks way less frustrated mentally and physically this year.,29,137198,1746055042.0,AtlantaHawks
mpxrkao,AbaloneLoose4909,Zubac,2,293,1746059396.0,AtlantaHawks
mpxjf27,phoenixsuperman,"I don't watch those knuckleheads much but when I have, my impression has been that they don't watch a lot of basketball. shaq especislly. if you put a gun to that mans head and made him tell you what teams are in the playoffs he couldn't do it.",29,76240,1746056604.0,AtlantaHawks
mpxtu1r,kylekorverburner,"Shaq doesn’t watch the current product but he talks like he does, I’ve started to not like him as much as I’ve gotten older. Certified hater",12,4897,1746060180.0,AtlantaHawks
mpzhn1b,jumbokevin,"A few weeks ago, when Kenny was announcing the finalists for DPOY, Kenny said ""wow, Dyson Daniels is our first candidate"" even though he's been in contention for DPOY for the entire season. And then when Chuck was announcing the ROTY nominees, he didn't know how to pronounce Risacher's name. 

You can tell none of them have watched a single game of the Atlanta Hawks",3,7891,1746087187.0,AtlantaHawks
mpxeifv,bluevsu,Frfr lock him up. Perfect mate for Trae....can't wait for this core to gel and add more pieces,12,4641,1746054953.0,AtlantaHawks
mpxqyz5,lurchcrawlz,5/170 coming soon,1,3968,1746059187.0,AtlantaHawks
mq7cukt,Aggressive-Ad1964,Needs to average 20,1,4,1746196799.0,AtlantaHawks
mpxe6gy,Glum_Fudge3404,"Agreed , dude was  all heart and hustle . Great rebounder and sneaky athletic .",12,962,1746054843.0,AtlantaHawks
mpyydmn,SportsBurner01,Celtics headed to the 2nd round again when y'all are sitting on your couch at home tho lol,-19,14,1746075850.0,AtlantaHawks
mpxizfl,No_Tr4geD1es,Because he has a compotent team around him.,46,23488,1746056456.0,AtlantaHawks
mpxmedd,kj114,"True, and I think Cade is awesome. But he was supposed to be and you could predict it. Feels like the spirit of this award should be directed towards players who broke out unexpectedly.",13,23087,1746057606.0,AtlantaHawks
mpy0qam,Various_Tomorrow_835,He's a number one pick he is expected to be great not just good.,4,413,1746062575.0,AtlantaHawks
mpylxna,glittertrashfairy,"I’m relatively new to basketball (this is my third season of paying attention), and I think it’s both wild and hilarious that a number one draft pick could be considered for MIP—especially years later. Like… he was the number one pick. He’s already really good, supposedly?

I know logically that’s not how it works, I just find it really funny conceptually",1,19086,1746070337.0,AtlantaHawks
mpxsz6c,kj114,"Also worthy, but I’ve always thought he was good and underrated. Really broke out late in the season though.",7,23087,1746059887.0,AtlantaHawks
mpxl5w0,Fit_Minute_2632,"They aren't paid to watch games. They are paid to be entertaining first and talk basketball second. Since three are former nba players, they can talk basketball in their sleep.",21,18374,1746057192.0,AtlantaHawks
mpyfnog,EuroStepJam,"Yeah, I never understood the popularity of that show.",2,12338,1746067874.0,AtlantaHawks
mpy70uv,bsinbsinbs,He’s always been a jackass bully. At least Chuck knows how to laugh at himself,9,30968,1746064774.0,AtlantaHawks
mpyn1th,Aardvark-0001,I feel like that’s the progression of bball fans .. when I started watching I was like this is the best pre game show and then you start to understand and listen as you watch games and realize they really do not watch what happens on the court at all.,4,19939,1746070809.0,AtlantaHawks
mq1p18y,w_a_w,"> You can tell none of them have watched a single game of the Atlanta Hawks

The craziest part is they're all in ATL, too. They film the show at the Turner Techwood Dr campus in ATL.",5,131108,1746118414.0,AtlantaHawks
mpxnj74,saltslugs,He also kind of sucked.,0,1637,1746057995.0,AtlantaHawks
mpz2pen,wayward_prince,"Wouldn’t be if Jalen was healthy, but in Jason Tatum’s completely unique and original words “I guess we’ll never know.”",16,26497,1746078122.0,AtlantaHawks
mpzs125,ATLevator,Corny and irrelevant to my point.,8,56609,1746093860.0,AtlantaHawks
mpxk1p6,PurposelyIrrelephant,I agree. But two things can be true at once. I think they both play into each other substantially but the Cade last year looked like a whipped dog compared to now.,9,137198,1746056815.0,AtlantaHawks
mpy80fi,Outside-Way-3924,The fact Jokic never got the award despite being drafted as a second rounder is insane.,14,8532,1746065113.0,AtlantaHawks
mpxleou,phoenixsuperman,im pretty sure shaq is indeed asleep most episodes,13,76240,1746057273.0,AtlantaHawks
mq06zh6,ahend1999,i think thats why the amazon and new nbc era of coverage is going to be a win in my opinion. i would love to hear them debate the actual facts not their opinions. tired of tnt and espn seeing who can yell the loudest to get their point across.,1,198244,1746101156.0,AtlantaHawks
mpyujn6,sirentropy42,"For me at least, it’s partially a lack of Stephen A. Smith.

Like I’m not the biggest fan of *Glee*, but it doesn’t have Stephen A. Smith in it so that’s something right?",6,2169,1746074108.0,AtlantaHawks
mq1tnj9,Fit_Minute_2632,"I want the to talk about the game, show replays, what adjustments were made, what plays worked and what didn't. I don't think that's gonna happen",1,18374,1746119741.0,AtlantaHawks
mr95bac,False_Trip_9035,K’Von is that you?,59,1155,1746715771.0,AtlantaHawks
mr95fem,Ice2jc,"I'm tired of our backup PG situation.  This kid projects as a potential PG in the NBA, although he was utilized all over court in Europe.  He has a great feel for the game, isn't the fastest but can change direction quickly.  He shot 35% from 3 last season, although he will have to speed up his shot in the NBA.  Is a hound on defense. 

  
Let's give Kobe another go battling a vet PG in training camp and stash this kid in the G league for a little bit.  Bring him in to the NBA roster next spring and he should be a difference maker.  He's definitely the type of player we've been gravitating to lately.",37,64838,1746715804.0,AtlantaHawks
mr9h6wu,Quad-G-Therapy,"Euro big that can create his own shot? Yes, yes, yes",16,12864,1746719239.0,AtlantaHawks
mr993ia,dangheckinpupperino,"Yes, I’d swing on him. Big, do it all guards are what will bring us to contention 

We need like 2 more Jalen Johnson level versatile threats on the roster if we ever want to sniff a ECF again",9,138815,1746716886.0,AtlantaHawks
mr9ci3j,EScforlyfe,Yo was that Brandon Goodwin at 0:20 lmao,8,199968,1746717884.0,AtlantaHawks
mr9m33t,airodell13,never been more sold after a highlight tape 😂 Baby Luka vibes,7,23798,1746720663.0,AtlantaHawks
mrae11q,Big-Landscape-937,"I can confirm that a scout of Hawks saw this performance of Neo [https://www.youtube.com/watch?v=W2tco2SzF7Q](https://www.youtube.com/watch?v=W2tco2SzF7Q) in Peristeri Venue.  Onsi Saleh also saw live this game of Avdalas https://www.youtube.com/watch?v=dH6\_OqVUL\_8. So, the front office definitely  knows what  player he is.",7,23,1746728755.0,AtlantaHawks
mr9nydh,7ruly,No way he can move like this and has absolutely no one talking about him. What's the catch?? Streaky shooter? Defensive liability? If he just somehow fell through the cracks of American scouting then we should absolutely take him,6,12795,1746721221.0,AtlantaHawks
mr99tzr,Josh378,Rather just get Noa at #13 and get Kalkbrenner at #22,7,12151,1746717103.0,AtlantaHawks
mradgqq,PhilosophyFair9062,Every prospects highlight video makes me believe that they're the next Jordan 😔,3,17254,1746728592.0,AtlantaHawks
mrbt33g,sondiame,Gotta hide bro so he don't get giannis-d,3,13124,1746744540.0,AtlantaHawks
mrcnqqp,Dapper-Investigator1,I like this dudes game,1,7423,1746755766.0,AtlantaHawks
mrd282q,KingdomOfDragonflies,Looks good. Never can go by just highlights but he has athleticism and seems to have a defensive dog mindset. Also wouldn't mind having a Neo on the team.,1,4811,1746761531.0,AtlantaHawks
mrd8kqu,Live_Region_8232,"I saw his highlight reel a while back and I immediately thought he was a complete steal. But he does have some glaring flaws. He’s not the greatest defender, he does a lot of iso work and forces shots. Plus he is allergic to making a pass if it’s not a highlight reel. Averages something like 1 assist a game",1,30396,1746764430.0,AtlantaHawks
mr9myzl,AdLegitimate7176,What happened to the guy we had just like this Nikola Đurišić ?,0,1542,1746720927.0,AtlantaHawks
mr9nifv,Dajackyl,Shhhhhhh!!!!!,0,830,1746721091.0,AtlantaHawks
mra0fs8,Ashewhite,Yes please,0,6904,1746724855.0,AtlantaHawks
mraabjc,Cool_Internal1171,Pls as a Hawks fan they would dare make that smart decision if he was still on the board 😆,0,48,1746727677.0,AtlantaHawks
mraca53,ExtensionDue3726,Why not?,0,1418,1746728246.0,AtlantaHawks
mraoz2p,dc2410,Just take Demin.,0,1236,1746731990.0,AtlantaHawks
mrbjwq6,Boraismybae,Wait what the hell? This kid is intriguing,0,53500,1746741364.0,AtlantaHawks
mr9d42p,oballistikz,Kevin playing like K’Von all the time would have been so nice. Never seen a player have such bad imposter syndrome.,26,67901,1746718060.0,AtlantaHawks
mr98y2o,Josh378,"Dude, get out of my head. That was my exact thoughts when I saw the recap video.",3,12151,1746716842.0,AtlantaHawks
mr96ynr,Ithinkso85,"I agree with you. Let Bufkin get healthy, then battle it out with Tyus Jones. Don't get me wrong, I like Daniels, I do. But your can see when he's forced into the role, he's not fully developed into a natural pg yet",15,31860,1746716261.0,AtlantaHawks
mr9a2kj,DeAndreHunterMIP,"On an sort of related but unrelated note, what happened to Djurisic? I mightve completely butchered his name but the Serbian guard we drafted last year",4,71107,1746717172.0,AtlantaHawks
mrcz8ap,Atl-Fan_FTS,Where did you see to confirm? Not doubting just intrigued,2,170662,1746760257.0,AtlantaHawks
mraaxfm,Sammcbucketts,"Kalkbrenner at 22 is a big reach, Noa at 13 would be a home run",5,68570,1746727855.0,AtlantaHawks
mr9v8m7,dangheckinpupperino,"Played meh in the G-league for us. They are very similar prospects though. This guy seems to me a more adept shooter, though Niko is capable. Niko weirdly enough is much more efficient off the dribble than he is off the catch. This guy looks the same way",1,138815,1746723353.0,AtlantaHawks
mrbk30k,Boraismybae,I actually want Demin as well lol but this guy looks more athletic in his highlights. Wouldnt mind taking a flier on him at 22,1,53500,1746741422.0,AtlantaHawks
mrclidn,False_Trip_9035,😂,2,1155,1746754942.0,AtlantaHawks
mr9av8g,stu21,He wasn't so great in the G-League.,17,16201,1746717407.0,AtlantaHawks
mrfcppg,thatguythereintex2,People forget he was injured for most of the season. Let's see what he can do fully healthy.,1,424,1746801445.0,AtlantaHawks
mrdpsy7,Big-Landscape-937,"I saw Onsi Saleh live in court. However,  it was reported as well in the greek media. See for example https://www.gazzetta.gr/basketball/basket-league/2384947/neoklis-abdalas-skaoyter-ton-hoks-sto-peristeri-layrio-mazi-me. Tho it does mean a lot because all the nba teams scout all the top international talents.  However they sent twice a scout.",4,23,1746773709.0,AtlantaHawks
mrabv68,Josh378,"I agree, but we traded our 2nd round pick to get rid of Bogi, so either we trade down for multiple picks or we reach for a 7fter guy. 

Unless there is a talent there that we can't say no to at #22 or we already drafted a center, trade down or big reach might be the only option.",1,12151,1746728125.0,AtlantaHawks
mrbyxac,dc2410,That’s fair.  I personally want CMB at 13 and Wolf at 22.  I just need to know if CMB can slide to the 3.  Demin is my guy though. Him at 13 and Beringer/Wolf at 22 would make me happy.,0,1236,1746746608.0,AtlantaHawks
mr9c31d,coolairpods,So great is also being kinda nice. He was horrendous.,10,10553,1746717763.0,AtlantaHawks
mrapg2w,fireglz,"The best thing you can say is that he did show steady improvement in his time down there. 

The worst thing that you can see is even during his peak performances he still didn't measure out to being an NBA player. 

I wouldn't give up on him yet, but I certainly don't expect to see him on the main squad anytime soon.",3,314929,1746732132.0,AtlantaHawks
mrafe5p,Sammcbucketts,If sorber and Berringer are gone by 22 then I would trade down or draft a wing like Riley or Clifford,1,68570,1746729158.0,AtlantaHawks
mr9dp3s,stu21,"Yeah, I was hoping he maybe could be Walmart Vit but he is not even Temu.  Too bad.",8,16201,1746718229.0,AtlantaHawks
mrag5r2,Josh378,"If we pick up Noa, we should be good on Wings since we will have Mo covering the 4 spot. If we trade down, I would want to get a PG1 to stash in the G league and then go get Kalkbrenner in the 2nd round.",1,12151,1746729386.0,AtlantaHawks
mr9ved0,Steezywild12,"He had some solid scoring nights, defensive hustle was there but he was still mid",6,21328,1746723398.0,AtlantaHawks
mrex8fe,coolairpods,"Still possible. I dont know how comparable G league is to Euro league skill wise, but it’s definantly a different game and played a different way. Could have just needed an adjustment period plus coming back off a broken foot (been there it’s a rough recovery).",2,10553,1746796326.0,AtlantaHawks
mrahp3r,Sammcbucketts,"I think there are some interesting PG’s in the back end of the first round as well, Clayton Jr is old but is a name and Philon is a guy who is a project but could be solid",1,68570,1746729836.0,AtlantaHawks
mrcq4pf,Old_Letter_5668,It's only for hawks games. Social club and players club are inclusive. Harrahs is not.,6,2478,1746756665.0,AtlantaHawks
mrctw0t,vanomania,I’ve been in Harrah’s Club section seats for non Hawks games such as concerts and they’re never all-inclusive.,3,371,1746758095.0,AtlantaHawks
mrg89g6,AxlBear7,Social and concert club only all inclusive for non-Hawks,1,801,1746811051.0,AtlantaHawks
mrcs1dl,PianoPsychological77,Are you sure?,-1,62,1746757379.0,AtlantaHawks
mrcu01v,PianoPsychological77,Danggggg,0,62,1746758139.0,AtlantaHawks
mre3ww2,Old_Letter_5668,99%,1,2478,1746782733.0,AtlantaHawks
mr91w9t,_mdz,Agreed. Dude has never had another all-star on his team or and most of our key starters right now would not start on the top 8 playoff teams. Jalen is the only one that would and possibly Dyson. OO is playing great but he'd be the 3rd center on the Knicks Cavs or Celtics.,10,95561,1746714762.0,AtlantaHawks
mr9trco,AssociateJealous8662,"Well, these teams are freer-spending and have better front offices with more capable and experienced management. So far we’ve been relying on the equivalent of non skilled union labor for our construction project.",9,4993,1746722929.0,AtlantaHawks
mrascqw,red2play,"The league has changed.  Trae is going to have to be able to hold his opponents down for a split second on defense to make any real runs into the playoffs.  They targeted Max Straus when they had Okoro on the bench.  We need more playmakers and so I hope we take Egor Demin, if he's there.  He's a SF/PG that can compliment Trae and take over if he's on the bench and he can play defense.  He gives an extra wing and a defender and a playmaker at 6'9"".

I don't agree with trading for a star, I think that we should continue to construct a team around Trae and if we prove that we can win, we can get stars without giving up the farm.  Fox to the Spurs, Jimmy Butler to GSW, 70% of the players on the Celtics, all prove that if a star wants to play with you, you can have the stars on the cheap.  

Forcing a trade, trying to get stars with picks and players always leaves you gimped while other teams can easily pick up stars.  Just start winning and they will come and be patient.

If Trae decides to leave next year, which I doubt will happen, we just need to continue to improve the roster just like OKC, Rockets, Magic, etc.

Before anyone brings up the Nuggets, they would have easily had a star but they vastly overpaid MPJ.  They in the tax even before any FA would come there and they let KPJ and Bruce Brown Jr because of said contract.

  
Show and prove and then you'll see results.  The stars will beg to join a team on the cusp.",1,47214,1746732999.0,AtlantaHawks
mr8n2qn,coolairpods,"Bro I love the hawks and Trae young. He is not as good as Brunson. 

Edit: jfc I didn’t say Trae was bad. He’s fucking cold. Top 5 PGs in the NBA.",-10,10553,1746710061.0,AtlantaHawks
mreh883,ATLfinra,Brunson is > Trae,0,19357,1746789936.0,AtlantaHawks
mr90crs,extraacc10,I actually think we should try and get Mathurin off the pacers. What yah think it would take? And do you think he can create his own shot and high enough of a level to be worth it?,-1,-1,1746714299.0,AtlantaHawks
