id,author,body,score,comment_karma,created_utc,subreddit
mrb7mk3,Free_Independence157,Is this a serious post 😭 Trae is nowhere near as good as Haliburton or Brunson. Especially haliburton,-5,5223,1746737496.0,AtlantaHawks
mrab3ym,Patekchrono917,"Trae is one of the hardest players in the league to build around. Everyone now conveniently wants to say he has never played with an All Star, funny how that works, but ask yourself why that is. The team has without a doubt failed him, but some of this is on Trae. A lot of fans were over the Murray experiment after one year. And that’s because it was ugly when Trae and Murray had to play iso ball. Trae needs to work on expanding his game. This team has only shown it can play one way. ",-2,19332,1746727907.0,AtlantaHawks
mrabim7,Patekchrono917,"Wait, so the best defensive player in the league this year, according to this sub, MIGHT start for the 8 teams right now? ",11,19332,1746728024.0,AtlantaHawks
mrg6wrq,Bushwick123,"Other stars do not want to play with Trae IMO. He is a ball dominant player who cannot play without the basketball and has no interest in playing defense. I think players around the league generally respect Trae but to play with him I believe is a different story. 

We always talk about how Trae doesn't have the help and there is some truth to that but we have been saying this for several years now. And yes, the FO is partly to blame but I think Trae can truly help by doing some different things on the court. Trae is lazy player especially on defense so I don't anticipate that ever happening. This notion that Trae doesn't have any help is bullshit. For the past three years and I am being generous Trae has been the common denominator but the Hawks fanbase would rather be mediocre than to take a chance on the Hawks going in a different direction organization-wise by resetting the configuration of the FO and by extension the roster. 

I know and understand how emotional (one way or the other) Hawks fans are when it comes to Trae but it is not going to happen for the Hawks and Trae in Atlanta and the longer the Hawks play this out the longer the process of becoming a serious organization is going to take.",1,2206,1746810644.0,AtlantaHawks
mr8sn96,OurHorrifyingPlanet,Hard to say he's been significantly better than Haliburton either these past 2 years. Trae got more volume but he's also less efficient and more turnover prone. I'd say they're about equal,15,16018,1746711916.0,AtlantaHawks
mr99k3x,Adorable_Abalone4097,"Brunson is a better scorer at this point, but if he’s not scoring he’s not affecting the game at all. If Brunson iso ball isn’t working it’s horrible offense to watch. If Trae isn’t scoring chances are he has 10+ assists and the offense rarely gets stagnant.

Brunson on the hawks would make us worse imo",5,2829,1746717022.0,AtlantaHawks
mr95zik,Josh378,"Brun put up 17 pts in game 2. If Trae did that, ppl here would crucify him.

Same thing with Haliburton and his 19 points and 4 assists.

Brunson and Haliburton can do that because he has teammates who can score consistently around him without having to take over the game.

Ppl here just look at one player and then say ""Well they won their playoff game, Brunson and Hali are better"", and then ignore the team that shot 48 FG% and 36% 3pt FG%. Or that the team's defensive rating was above average.

Do you know what our FG% was vs Miami? 42% FG% and 31% 3pt FG%. Trae put up 29 and 11 in that game and was clutch in getting us into OT, even with the bad shooting on the team.

Trae is one man. The NBA is a team sport. If the four other players can't put points on the board and always missing, that's not a ""Trae"" issue, that's a ""Hawks"" issue.",4,12151,1746715969.0,AtlantaHawks
mr8sz8k,CompEconomist,"It’s all opinions, but I think he is far greater than Brunson. Put Brunson in a market that isn’t NY and he’s above average with little publicity. NY helps build up Brunson bc it’s a market that sells.",3,2965,1746712022.0,AtlantaHawks
mrbgpmb,LeJalenJohnsonMVP,Especially Halliburton? Brunson is better than Hali,4,48411,1746740321.0,AtlantaHawks
mrcgbvt,NecessaryClassroom92,Brunson is way better than Haliburton. What in the world?,1,231,1746753017.0,AtlantaHawks
mrcg6yl,NecessaryClassroom92,"Trae has only played for one team, one owner who has proven to not know what he's doing. If Trae had played for all these other teams and they couldn't build around him, then you could say that. Until we traded for Caris we had no other people on this team who can dribble and create their own shot. Everyone on the Knicks, Bridges, Brunson, Hart, OG, and even KAT can do that to a degree. ""Ask yourself"" why we haven't been able to get a serviceable backup point guard in years. Is that also on Trae? Is it on Trae that our best Center is 6'7? Is it really on Trae that he's one of only two 3-time Allstars in the last 30+ years to never play with another Allstar?",1,231,1746752966.0,AtlantaHawks
mravuu1,_mdz,"Yes, as much as I love Dyson, look at the starting guards in the teams still alive in the east. These are at least discussions.

Celtics: Derrick White and Jrue Holiday. White is strong defensively and can shoot 3s, Jrue is basically an older and more experienced Dyson.

Cavs: Donovan Mitchell and Darius Garland. Two all-stars. 

Knicks: Brunson and Mikal Bridges. Bridges is the 3-and-D guy they just mortgaged their future for.

Pacers: Haliburton and Nembhard. This is really where Dyson could fit in. Nembhard has solid D and is a better shooter… in the playoffs.",6,95561,1746734030.0,AtlantaHawks
mr9ppe7,ATL_Hasher,"Saying Jalen Brunson would be “above average” if he didn’t play in New York is an insane statement. It’s all opinions; but that’s an extremely uneducated one. The man is averaging 26 and 7 in his 3 years on the Knicks. 2.3 turnovers per game. You don’t have to tear down Brunson to say how great Trae is. This is wild man.

Edit: I’m expecting downvotes, but I’m not expecting anyone to actually debate this. Jalen Brunson would be above average if not in NY? Are we actually here to talk ball? Or are we just pumping cotton candy and sunshine and throwing shade at any non-Atlanta point guard?",1,14344,1746721738.0,AtlantaHawks
mra9lup,Patekchrono917,"Holy hyperbole. First, Jaylen Brown was a Deandre Hunter type and this. I mean did you watch the NBA when Brunson was on this team called the Mavs? And he played 85% of what you are seeing while Luka was hurt. ",0,19332,1746727473.0,AtlantaHawks
mrbj38d,Free_Independence157,Brunson not better hali at anything other than attacking the basket nd even then their %s are similar. Hali has one of the greatest assist/turnover ratios nd is a borderline 50/40/90 player. Brunson nice as shit but as a true pg they not even comparable nd hali in his own class,-4,5223,1746741095.0,AtlantaHawks
mrciokd,Free_Independence157,"At what besides scoring more pts with higher shot attempts. Hali is already 1 of the most efficient pgs ever with 1 of the best assist/turnover ratios. Brunson is such a liability on defense that they put in mcbride for def possessions 

Scoring 25 a night do not make brunson better",1,5223,1746753887.0,AtlantaHawks
mrcghlu,Patekchrono917,Stop. You act like the Knicks are some great organization. Name #1s that are harder to build around than Trae? I’ll wait. Just because an owner sucks doesn’t mean Trae isn’t hard to build around. ,1,19332,1746753077.0,AtlantaHawks
mrcexlb,NecessaryClassroom92,I think the Hawks would be worse with Brunson instead of Trae. Trae is a better playmaker. Second best in the league according to some stats. But Brunson is just so clutch and seems to get hot more often than Trae. Brunson has a better pure scoring bag and Trae shot terribly this year. Brunson is amazing. ,2,231,1746752501.0,AtlantaHawks
mr9ssui,CompEconomist,"Should I say not the superstar he’s being made to be? He’s good but not a superstar; use the appropriate terminology of your choice. Not trying to tear him down, but I can recognize that he gets more credit due to his market than his play warrants. Once again, good… but not a superstar outside of NY",1,2965,1746722652.0,AtlantaHawks
mrbj7z4,LeJalenJohnsonMVP,No one is talking about “as a true PG” other than you,1,48411,1746741138.0,AtlantaHawks
mrd9zni,NecessaryClassroom92,"You missed my point. Even a historically shittily managed team like the Knicks can put multiple shot creators on a team. Yet the Hawks can't. Trae has to do everything. There aren't many teams in the league with no backup PG, only one shot creator, a starting Center who is 6'7"". I could go on. ",1,231,1746765122.0,AtlantaHawks
mr9yejp,ATL_Hasher,Yes. That’s a completely different statement and one I would tend to agree with,0,14344,1746724261.0,AtlantaHawks
mrbk4xq,Free_Independence157,The post is literally comparing them niggas as PGs nd regardless Hali got brunson beat in everything but scoring which hali do just as good but got lower shot attempts cause he pass 1st. If getting a bucket make you better than someone in your eyes then coo but that aint the whole story ina game of basketball especially on defense where brunson a liability,0,5223,1746741439.0,AtlantaHawks
mrdbmmh,Patekchrono917,They brought in a shot creator and secondary ball handler. The hawks and fans knew it wasn’t going to work after one year. Trae is fucking hard to build around. It’s ok to admit that. ,1,19332,1746765930.0,AtlantaHawks
mrbm9di,LeJalenJohnsonMVP,Hali isn’t a liability defensively? You’re high,3,48411,1746742160.0,AtlantaHawks
mr6ph7b,ttttyttt678,"He’s not getting moved. Al Horford probably retiring, then they will look to move off Jrue Holiday as his age is showing and Porzingis as he’s proven he can’t stay healthy. Move 3/6 and keeping Tatum, Brown, White to build around.",107,112710,1746674655.0,AtlantaHawks
mr6ovwb,thestallion11,In theory he’s perfect but they’d have no flexibility to build anything around him and Trae with that insane contract,98,127303,1746674414.0,AtlantaHawks
mr6ofik,Fire_Demon-215,His contract reeks man I’m good,34,115563,1746674231.0,AtlantaHawks
mr6ohj6,Both_Funny4896,"I’m personally completely against this because it would 100% cost us Risacher+++, and I don’t believe Brown is anywhere near good enough to be on that horrendous contract.",20,320093,1746674252.0,AtlantaHawks
mr6ohdy,notaredditeryet,No way in hell. Brad Stevens isn't gonna get fleeced,15,50740,1746674251.0,AtlantaHawks
mr8mori,SignificantHawk3163,How about we get the actual team on the floor before we jump all over these unrealistic players. So many injuries last year have no idea what the team actually looks like healthy. Lots of young talent let it grow together instead of blowing it up for a chance.,3,10208,1746709929.0,AtlantaHawks
mr7ygcz,chopitup1000,"Atlanta is a world class city and the Hawks need to make these kinds of investments. A lot of the people on this thread would probably shut up and be happy with Brown, if we get him, no matter the cost. Too many empty seats at home games when we need butts in seats to cheer our team on in between the bigger ticket games. Management should pull strings to make this work and keep Risacher, Young etc.",3,3,1746699740.0,AtlantaHawks
mr6op8d,lutherbl1sset,"hard pass... horrible contract, reeks of boston",7,4273,1746674338.0,AtlantaHawks
mr6ob62,Fun-Winner2450,No,4,1644,1746674181.0,AtlantaHawks
mr6s70w,No_Internal404,"3 years ago I was a huge fan of this .. now? HELL NO .. good player , absolutely, would probably have some hometown juice but the contract is just too egregious to take seriously. I mean the guy is making more than giannis & it’s only going up lol. Him & Trae isn’t enough to get out the east yet alone actually win.",2,22046,1746675789.0,AtlantaHawks
mr6xkn6,Ok-Negotiation3897,Should we gauge the Porzingis market if they plan on moving him?,3,10815,1746678194.0,AtlantaHawks
mr7ivo0,jamp0g,you guys have such a good vibe so i don’t know why ruin it with him. even the olympic team chose not to get him.,4,7187,1746690075.0,AtlantaHawks
mr6q3o0,Patekchrono917,"LOL that you guys think Jaylen would be available. Guys like KP, Jrue, and Al would be the first ones to go. And suddenly Jaylen isn’t worth his contract? You guys sound exactly like you did when he signed his first extension way back and said he wasn’t worth it. How did that turn out exactly? ",2,19332,1746674911.0,AtlantaHawks
mr73q73,darkwingduck9,"The Hawks aren't ready to add one player to make them a truly good team.  Jaylen Brown would be that player to put a team over the top?  Unlikely.  His 3PT% has varied.  Could be important that it is down this season.  Brown is 28 and very reliant upon his physical tools which could start degrading a bit sooner than other players with his playstyle, though he doesn't play as extreme as Ja Morant.

What would the trade package look like?  There is an opportunity cost as he wouldn't be free.  The Hawks would improve the most by giving up as little NBA talent as possible and giving up draft picks instead but then the Hawks would have difficulties improving in the future.

Dyson just had a good year.  Let's say the Hawks trade him plus 2 or 3 FRP.  You essentially have Jaylen Brown instead of Murray.  Maybe the team is improved but you are still asking for a lot of progression from JJ and Risacher and then you have little draft capital to work with.  It would be foolish to think that the Hawks with Brown would be better than the Celtics or Cavs and you can even make the case that teams like the Pacers are looking better.  It would be a hard pass for me on Brown and any move of this type whether it be for Giannis, Zion, or another star.",2,23194,1746681256.0,AtlantaHawks
mr6oqr5,BrettSchirley22,Nah that contract is insane,2,136505,1746674355.0,AtlantaHawks
mr6p23e,SomeonesOG_,Naaaaah,1,19,1746674486.0,AtlantaHawks
mr6wkeu,MahanOrion,MARIETTA,1,320,1746677733.0,AtlantaHawks
mr7w6z3,ninatlanta,Hard pass. Let someone else pay him.,1,20022,1746698467.0,AtlantaHawks
mr875b0,Wavegod-1,"I would do it but it would require a hefty haul and the Hawks don't really have that so, this is a moot point.",1,4485,1746703931.0,AtlantaHawks
mr8jpva,parkoffstreet,Please don’t do this to us,1,7573,1746708881.0,AtlantaHawks
mr8wk21,Bry_Mac,"I haven't looked through our salaries yet, but he is expensive and it would take a lot of contract value to get him. Probably Jalen and Okongwu to start because Dyson and Risacher don't hold as much contractual value for matching his $50m+/yr deal, and ideally, you would want to move those guys for a like position so you aren't creating multiple holes.

Before Dyson and Risacher were rostered last year, I would have been all in, but I think if we're throwing it all at one player right now, Giannis is the better fit because he fills the Jalen's spot immediately and we're only creating a center hole, which we already have.",1,13034,1746713152.0,AtlantaHawks
mr9msa8,wtw369,let’s use our upcoming first round picks to get a star! oh wait….,1,168,1746720873.0,AtlantaHawks
mra23ol,matthuntermathis,NO. We need an Allstar caliber Center.,1,7066,1746725337.0,AtlantaHawks
mray344,fireglz,"We don't have the financial flexibility to take on his contract where it's currently at. It would be different if it was further into his deal, but we would probably wind up jettisoning Trae soon after with Ressler's miserly nature factored in.",1,314929,1746734688.0,AtlantaHawks
mrctf4m,Smasherelli,Lol. Besides he still too decent to come back home and play. I'd take the Birds healthy on 2K with JB7 & DH12 added to the roster and have Clint come off the bench. Lol. Even crazier to see if Giannis came to play with Trae. You telling me that NO NBA star wants to come play with the leading assist leader? Lol. Talking bout the ratings are down. Lol. I luh da game doh. 😁,1,938,1746757912.0,AtlantaHawks
mrex72h,Ice2jc,I’d rather have Jrue to backup Trae but he’s making too much money.  That entire roster is making too much money.,1,64838,1746796312.0,AtlantaHawks
mrf9jt9,happybetterthansad,"Not sure how we would make the salary match required with the new rules. Trae would almost ceratinly have to a part of the trade. Trading Trae for Jayleen makes no sense to me. If the Hawks FO can figure out a way to keep Trae, then I'm all in.",1,2,1746800454.0,AtlantaHawks
mrfwtz5,Breakthecyclist,"Like the player, hate the contract.

I got one for y’all that I don’t think I have seen talked about: what if Luka comes home and laces em up for the Hawks?  He does seem to genuinely like Trae.

I know this is beyond batshite crazy, but with the Lakers only able to offer him the same amount as everybody else it really might get interesting.
Especially as he would be a free agent so no having to decimate your roster.

I shudder to think of the defensive numbers a lineup of Trae, Luka, Dyson, Jalen, and O would result in, but damn would it be fun.  
A small ball 5 of Trae, Luka, Dyson, Risacher, and Jalen would be cool too.  Kinda lean into the defensive shortcomings..",1,5514,1746807579.0,AtlantaHawks
mr6p60l,jordpie,No thanks,1,3107,1746674531.0,AtlantaHawks
mr6wrin,dc2410,The same dude that got his cookies snatched ? We don’t need his weird energy on the team.,1,1236,1746677823.0,AtlantaHawks
mr8eyer,Smooth_Associate_838,Pass on that contract,1,1291,1746707107.0,AtlantaHawks
mr8miv4,Square-Ad-2385,"Nah we’re good, our jalen’s gonna be all nba next year",1,87,1746709872.0,AtlantaHawks
mr6ywow,NewFocus3-5,No one from Cobb County gives af about playing in Atlanta,0,3619,1746678820.0,AtlantaHawks
mr6pzeh,Time-Combination4710,"I think you guys over estimate how much people want to come back to Atlanta lol 

The city ain't that special even if you're from here",-7,1172,1746674862.0,AtlantaHawks
mr6sh1c,hollow-ataraxia,"Horrible contract + he's not good, I'd rather have Tatum",-3,94275,1746675906.0,AtlantaHawks
mr6ptqu,Both_Annual4317,why do I want a playoff choker?,-4,3324,1746674798.0,AtlantaHawks
mr7ydco,BroDoc22,We aren’t one player away and that one player sure as hell ain’t jaylen brown,-2,15926,1746699695.0,AtlantaHawks
mr9eaqq,Quad-G-Therapy,this is it... they're gonna keep Brown/Tatum/White at all costs... everyone else is disposable,19,12864,1746718406.0,AtlantaHawks
mr6qldn,Both_Funny4896,"I’m not saying he’s getting moved, but I’m saying it’s gonna be explored by their front-office if the right deal presents itself.",3,320093,1746675114.0,AtlantaHawks
mr8xp9y,Bushwick123,"Thank you! I don't think fans factor in things like that. Quite frankly, I'm not sure Jaylen could play with Trae. You need specific players to play with Trae because he can't play without the ball.",6,2206,1746713504.0,AtlantaHawks
mr6phzy,Both_Funny4896,The Celtics system makes him look a lot better than he actually is. He’d probably be like a better version of Deandre Hunter for us.,-55,320093,1746674664.0,AtlantaHawks
mr7o2wi,iheartblackcoochie,You can be a finals mvp and redditors will still say you get paid too much. Clowns.,19,6225,1746693406.0,AtlantaHawks
mr6pae2,pascaleon,"Jaylen brown is much much much better than Rissacher, if there’s a path to keep Trae and JJ you easily do it",11,59901,1746674580.0,AtlantaHawks
mr6ouu1,Both_Funny4896,"He won’t be getting fleeced, but he sure is gonna be doing a lot of fleecing this offseason. He knows 90% of their roster is at peak value, and he’s gonna flip a bunch of those nasty contracts for young players and picks.",16,320093,1746674402.0,AtlantaHawks
mr87x6f,Own_Brilliant9653,Are we not tired of injuries after this year?,7,5029,1746704263.0,AtlantaHawks
mr6wl4s,MahanOrion,Finals MVP,3,320,1746677743.0,AtlantaHawks
mr6rg2p,thestallion11,"He was the best player in their team when they won the finals. A feat no Atlanta Hawk has ever accomplished. He’d be great in Atlanta , his contract is too bad to even consider it though",1,127303,1746675474.0,AtlantaHawks
mr6s2lr,ttttyttt678,"It’s probably not, it’s new owners, they’ve seen the outrage from recent trades that cause massive decline in revenue. Even if it’s the right deal, people are gonna say it’s cause the owners are being stingy. Can’t see Tatum/Brown/White being moved this summer.",9,112710,1746675738.0,AtlantaHawks
mr6qnh5,GangGreen7729,Thats just insane on so many levels holy shit,65,59023,1746675139.0,AtlantaHawks
mr6pryx,Patekchrono917,Holy hyperbole. ,51,19332,1746674777.0,AtlantaHawks
mr7xx1h,crimedawgla,"You’re the OP, why did you make the post if you don’t like him here?",11,15214,1746699447.0,AtlantaHawks
mr6qx56,thestallion11,"He’s way way better than Hunter, the only thing Hunter may have over him is shooting open catch and shoot 3’s. He’s a better defender, passer and ball handler",18,127303,1746675253.0,AtlantaHawks
mr88xoe,Bobgoulet,This take is so absurd I had to put my phone down and stare at the ceiling for a full minute,4,209694,1746704691.0,AtlantaHawks
mr6y3ga,Free_Independence157,Do u watch basketball,6,5223,1746678437.0,AtlantaHawks
mr6sefr,Shinnobiwan,"Bro, this is disrespectfully out of pocket.",7,21703,1746675875.0,AtlantaHawks
mrg6pv1,JohnAndertonOntheRun,"Ohhhh no. No, no, no…

I told everyone when he was picked at #3 that he was not being overrated, and I can’t believe after a Finals MVP I am still doing it.

You are severely underestimating how athletic Jaylen Brown is.",1,33959,1746810586.0,AtlantaHawks
mr9u816,jvaz521,"Of course, you can be overpaid at pretty much every level except MVP. He’s not even the best player on his team. He’s getting paid significantly more as his contract progresses. What are we doing here",8,5351,1746723063.0,AtlantaHawks
mr8c2cj,RelevantGur23,You can be a 65 million dollar a season player and idiots like you would fall in love with them,10,10,1746705979.0,AtlantaHawks
mr6pqsa,Both_Funny4896,"Obviously, but it would also cost a bucketload of draft picks… and like I said, he’s sitting on one of the ugliest contracts in the league.",11,320093,1746674764.0,AtlantaHawks
mrawamk,ViperStrikes123,He’s much much better than JJ too who this sub thinks is a god an untouchable. Will he stay on the court? Who knows,3,8836,1746734158.0,AtlantaHawks
mr7snvt,tburtner,Where would that get them?,2,13670,1746696328.0,AtlantaHawks
mr6ql7u,WhiteHeterosexualGuy,Doubt,5,290129,1746675113.0,AtlantaHawks
mr6qzuh,Both_Funny4896,"I’m being so deadass, he’s obviously wayy better than Hunter but he would just become a “stand in corner” type of player in our system. We are not like Boston who allows every player to get equal touches.",-41,320093,1746675284.0,AtlantaHawks
mr885er,reddershadeofneck,Gotta get that karma!,7,53123,1746704360.0,AtlantaHawks
mracrg2,iheartblackcoochie,Clearly these players arent overpaid if the gms are willing to take these contracts on lil bro. Brown is a finals mvp. Ask celtics fans if they regret paying him after he was the best player onna finals win. All of them with a brain will say yes.,-1,6225,1746728386.0,AtlantaHawks
mr6qd8z,pascaleon,"You can call it a bad contract but that’s literally what the league will be paying guys over the next few years. Bam, PG, and Jamal Murray are making just a bit less than him per year. New tv deal will be balancing those contracts out",2,59901,1746675022.0,AtlantaHawks
mrb6jt8,pascaleon,"Yeah JJ is far from untouchable, it’s crazy cause people will say he’s untouchable for dudes like Giannis or DBook. Itd be great to keep him but he’s not someone I’d refuse to trade for a t15 player",1,59901,1746737178.0,AtlantaHawks
mr93z6l,pascaleon,Healthy? They can go to the ECF or further. The only team that’s holding up the eastern conference is Boston and without JB and then the other guys getting old they’re beatable. If Hali and siakam can be this great I don’t see why Trae and JB can’t be as good as,1,59901,1746715379.0,AtlantaHawks
mr6w1gz,chillin_krillin,Interesting. So you don't think our team who was 2nd in the league with team assists and along with the 2024 assist leader in Trae allows every player to get equal touches?,34,8163,1746677493.0,AtlantaHawks
mrdbgfy,Certain_Investment70,You’re not being objective. To match the contract you gotta match salaries or at least get close to it and give up picks. That means OO/JJ minimum. If I’m Boston I’m asking for them and at least Risacher or Dyson. Trae gets his big deal in a year. Trae and Jaylen not winning you a 🏆. It’s not wise,2,62,1746765843.0,AtlantaHawks
mr6rcam,Both_Funny4896,"with the new CBA you can only pay about 2 guys big contracts, before it handicaps you. Would you really waste all that money on a duo of Trae Young and Jaylen Brown? That’s like a first rd exit type of team.",8,320093,1746675429.0,AtlantaHawks
mr71xmt,Both_Funny4896,"No. Trae Young initiates everything for us, he’s not an off-ball guard like Jrue or Derrick White or Marcus Smart.  If Brown was on the Hawks he would rarely self-initiate possessions the way he does in Boston.",-2,320093,1746680318.0,AtlantaHawks
mrekftv,SaintsNick94,What move will win the Hawks a title?,1,78278,1746791362.0,AtlantaHawks
mr6s43j,pascaleon,He wouldn’t be my first choice personally but I’m just going off the scenario you presented. We need to make a move soon anyways or might as well trade Trae. You also can’t go wrong with trading for a FMVP we made a ECF with JC/Bogi as our #2 on a given night so imagine we actually bring Trae an all nba player,1,59901,1746675755.0,AtlantaHawks
mr7ryys,joselakichan,"Bro I mean if Luka, Lebron and Reaves can somewhat successfully share one ball, so can Trae and JB.",15,27901,1746695890.0,AtlantaHawks
