id,author,body,score,comment_karma,created_utc,subreddit
mqh0i3d,Nyeteka,"Incredible that people are giving Kawhi a pass for 22pts and 2 assists off 13 shots in G7. Who else is going to take those shots? We sacrificed the future and waited six seasons for this shit? They all played badly - Harden was an atrocity as a second star - but Kawhi is the head of the snake and the leader. When will we ever turn the page on this guy and his army of stans. He is healthy, as I understand it he can be traded. He went off in G2, some team that wants to contend right now might want him as a second star",2,4161.0,1746324918.0,LAClippers
mqh1rfc,tvztvz,"Thanks G 🥹

Go Clips",10,75707.0,1746325432.0,LAClippers
mqh7r3y,lolwtferic,appreciate you dawg 🙏🏽,7,318500.0,1746327891.0,LAClippers
mqh65vi,Kenny_Powers1124,He just not the guy. He STINKS,4,5452.0,1746327221.0,LAClippers
mqhszka,JonGOATJones,Wasn’t game of the year last game though? Did he choke there?,5,18072.0,1746338248.0,LAClippers
mqgylie,kobeee,them being soft and playing with no effort is exactly the thing you can blame Ty Lue for,2,33434.0,1746324163.0,LAClippers
mqgzrns,musy101,The captain of the ship is to blame for the team not being tough and not motivated. It has happened for years. It starts from the top,1,42314.0,1746324621.0,LAClippers
mqh60wv,Kenny_Powers1124,Fat free throw merchant who doesn't play defense at any point got tired? Wonder why he hasn't won anything..,1,5452.0,1746327164.0,LAClippers
mqhs5uw,maxamillion17,Ive known that for years lol,2,6300.0,1746337789.0,LAClippers
mqh0y90,AlmightyPenguin88,"Kawhi's expectations are kinda insane when averaging 25 PPG on good efficiency isn't good enough to be a first option anymore, imo. There's only 4 guys left who are doing at least that (Tatum, Brunson, Ant, and SGA) and all of them are all-star/MVP level. Not aggressive enough is a critique I can get behind, but his 1st option days aren't over just yet, imo.",8,1374.0,1746325102.0,LAClippers
mqgywrd,ayeno,Harden had some terrible decision making in this game,4,349256.0,1746324285.0,LAClippers
mqgzhtg,musy101,Yep I can't believe people are defending him. This isn't an isolated incident. It happens year after year after year,9,42314.0,1746324512.0,LAClippers
mqi6uaa,dherps,powell is not a performer - period,1,11731.0,1746346499.0,LAClippers
mqljrc8,foxcnnmsnbc,"This isn’t rocket science.  Adelman just ran the exact same game plan Malone ran.  Give the ball to Jokic and have him and Murray run 2 on 2.  Have AG play the dunker and MPJ and Braun catch and shoot.  

What could Ty have done?  Signed Tim Duncan and Gary Payton to stop it?",0,11005.0,1746391875.0,LAClippers
mqgxph9,JaiKB,It literally doesn’t matter. You gotta beat the best to be the best and we clearly are not. End of story.,63,2916.0,1746323817.0,LAClippers
mqgy503,Sushi2k,"Nah, L take. 

West was absolutely stacked and us making 5th seed was a great accomplishment in itself. Anyone thinking we were going to make a deep run was huffing grade A copium. 

This team is old and would have struggled vs any of the teams.",13,255170.0,1746323984.0,LAClippers
mqgxw03,Shoobedowop,doesn't matter. still would need wheelchairs in the first round.,7,75335.0,1746323887.0,LAClippers
mqgyjs2,ohmeohmy78,"Nah, you don’t tank because you never want to purposefully force yourself into the playing extra games, because anything can happen in a do—or-die scenario, risking injury, etc. What if Memphis got hot, then you’re fighting for the 8-spot in Rd 1.

The Clips were right to win in GSW, they just weren’t good enough to beat the Nuggets on the margins, and lost a close series. It is what it is…",3,131501.0,1746324143.0,LAClippers
mqgyf7s,vb90,"It wouldn't have mattered. We would've done some very stupid tactic  mistakes against Houston too and Harden and Powell would've had an all-time flop going every night against those defenders they have.

This series showed that this team has a lot of flaws, not just roster flaws but flaws in their mentality on the court and serious flaws in the coaching staff..",2,64927.0,1746324094.0,LAClippers
mqgymwo,musy101,"Lol Denver isn't good, probably the weakest team in the PO next to the lakers. Watch them get smoked by okc. We just suck and play to our competition",1,42314.0,1746324178.0,LAClippers
mqh0k26,ReggieWaynne,"Exactly, we love to make things harder on ourselves for no reason lol",1,1112.0,1746324941.0,LAClippers
mqh8hzm,Niceguydan8,"I don't think starting Batum would have made any difference.

I know the folks that like to make takes with the benefit of hindsight like to dwell on that stuff, but Batum starting probably doesn't change anything given how everyone played.",1,483300.0,1746328214.0,LAClippers
mqtt03q,Nyeteka,I think you are right 😭,1,4161.0,1746502629.0,LAClippers
mqtkbq4,Halfgridd,Okc is a hell of a team.,1,3315.0,1746499151.0,LAClippers
mqhd48v,Ubermensch2745,Cuck chair take ngl,3,14351.0,1746330272.0,LAClippers
mqgz4wb,Supreme_God_Bunny,"https://preview.redd.it/0yxil0w0boye1.png?width=1080&format=png&auto=webp&s=af7aa7d1c57e464030b1028c6942b681af4f548b

Scored 9 before",1,162172.0,1746324372.0,LAClippers
mqgyfnz,jchavez9723,Lane Kiffin Taliban Lue,1,29943.0,1746324099.0,LAClippers
mqgz7hq,Nyeteka,😂 we really are down bad,3,4161.0,1746324401.0,LAClippers
mqgyut2,musy101,I want to see Kawhi era once without doc or ty. Please man,2,42314.0,1746324264.0,LAClippers
mqh0b0u,Niceguydan8,"I don't think Kawhi would fetch a whole lot on his contract, honestly. 100m over the next 2 years for a guy that missed over half of the season and didn't look like a clear #1 option in the playoffs while being fully healthy doesn't instill a lot of confidence in a trade.

Harden has a player option, so that limits his value since he could just opt-out.

Norm just had an absolute disasterclass playoff run, not sure what value you think is there.",1,483300.0,1746324840.0,LAClippers
mqhgpo5,icewill36,There is such a thin line  between winning and losing a series. Even some series where a team sweeps or wins 4-1 there was a couple plays that could changed it completely.,2,30381.0,1746331936.0,LAClippers
mqgyezh,vb32v,"The players still go home to a rich house and check, this just a job for them. The fans are the ones that are truly hurt 🥲",20,2470.0,1746324092.0,LAClippers
mqgynng,AlmightyPenguin88,"I mean, series is over. These guys are friends that have competed against and with each other, no need to be perma-grumpy. It sucks to lose but it *is* just basketball at the end of the day.",9,1374.0,1746324186.0,LAClippers
mqh08qk,SaltyPopsicle117,Zubac deserves absolutely no blame for this. He played incredible defense on Jokic all series and stepped up all across the board.,4,1519.0,1746324813.0,LAClippers
mqhaiim,Vantonage,"Yup I have Ime as the best coach in the NBA since before he got horny and got fired from Boston. Unlike Ty Lue where he lets the team completely blow a 15 point lead, he calls the timeout after a quick 8-0 run and then if they let up another 5-0 run to cut it to a 2 point lead he calls another timeout and yells at the team. At least he will try something unlike Lue where he crosses his arms and shakes his head.",4,744.0,1746329102.0,LAClippers
mqh3luo,Niceguydan8,"> Soft mentality starts with Ty Lue. Took way too long to start Batum and give him significant minutes.

Batum didn't work today either, though. He was nowhere near as impactful today as he was in game 6.",1,483300.0,1746326183.0,LAClippers
mqh5wdf,Puzzleheaded_Key4900,"It’s time to blow this group up. Get whatever you can get for klaw, harden, zu and norm and rebuild",0,81.0,1746327113.0,LAClippers
mqgzagb,Niceguydan8,"> If you watched harden play defense tonight you now understand why the nets

The Nets didn't want him gone.

> He is insanely talented but will always lose in must win situations because he is scared

Game 6 isn't a thing.",2,483300.0,1746324432.0,LAClippers
mqgyubn,BeerWithDonuts,"I can think of a lot of men in human history who fall under the categories, “father, brother, and christian” who shouldn’t be exempt from criticism.",5,233.0,1746324258.0,LAClippers
mqgypgs,frozteh,ahh yes a Christian. Now immune to any criticism coming his way.,8,89650.0,1746324206.0,LAClippers
mqgyloi,sagedrummer,Dude just can’t show up for big games.,2,680.0,1746324165.0,LAClippers
mqgymvu,ank1t70,He’s making millions of dollars. All that money to choke in the playoffs year after year. He can take some hate comments.,2,28458.0,1746324177.0,LAClippers
mqgz5nc,musy101,What is this post? No one is above criticism no matter what the fuck they are. So if he was a single atheist it's okay to attack him? Stupid ass post,2,42314.0,1746324380.0,LAClippers
mqgy8z6,mvpmvh,Too late. I've already sent plenty of hate towards James Harden. Will be sending more after this as well,2,27295.0,1746324027.0,LAClippers
mqgylks,PM_ME_UR_ANTS,"He’s literally the last one to blamed. Showed up 5 out of 7 games this season. One of his best modern series I can remember. 

It was just him and Whi, no one else showed up to play.",1,14301.0,1746324163.0,LAClippers
mqh06ce,XanZibR,"Could a mother, sister and Satanist at least throw a little shade?",1,22005.0,1746324786.0,LAClippers
mqh130h,Vantonage,Nobody here is getting the Draymond reference LMAO,1,744.0,1746325155.0,LAClippers
mqhf0kz,Niceguydan8,"Can Thomas, lmfao",1,483300.0,1746331143.0,LAClippers
mqgz3az,Niceguydan8,"> Every year feels like Hardens and Kawhis last chance. I really hope this isn’t that year though

The reality is that both of these players probably won't have another deep run as large contributors to the team.  They are too old and Kawhi specifically makes a shitload of money for what is basically less than 1/2 of the regular season of availability and playoff stats that are not indicative of a first option-level player.",1,483300.0,1746324355.0,LAClippers
mqh0qcv,Function_Fighter,"There's good pieces, team just needs size and energy and maybe more athleticism. Probably new coach.",1,22638.0,1746325012.0,LAClippers
mqh6mmy,Kenny_Powers1124,"Team is dead. Build around kawhi and Norman powell!? LMAOOO 
Have you looked at the rest of the west?",3,5452.0,1746327416.0,LAClippers
mqhev67,Niceguydan8,"The front office has been very clear that they will likely ride out this core until 26-27 where they likely reset. 

We've known this since free agency",3,483300.0,1746331073.0,LAClippers
mqh4mfn,vb90,"And we had  those two games.

1. Game at Intuit against OKC: Ty Lue doesn't call a timeout in the last 2 minutes of the game and OKC gets two big buckets. Then calls it late and we end up  shooting garbage, contested shots the whole way through.

2. Game at Cleveland: Ty chooses to rest Kawhi because we have another game with Magic in 40 hours after it. We narrowly lose that one, would've easily won it with how trashy the Cavs were at that point..

And so many more..",1,64927.0,1746326597.0,LAClippers
mqh3jtz,Niceguydan8,"> But in classic Clipper fashion, they have to go the hard way. 

My guy they played over half of the season with their 49 million dollar best player not participating at all.

Dwelling on not taking 1 or 2 games ""seriously enough"" is just dumb",0,483300.0,1746326160.0,LAClippers
mqh4fav,Niceguydan8,"The game basically started spiraling out of control when Dunn subbed back in for the beginning of the 2nd quarter.

Absolutely atrocious couple of minutes from that lineup.",3,483300.0,1746326514.0,LAClippers
mqibfuz,icewill36,you probably don't understand what you're looking at when you watch a game. do you see how he was being defended ? with that type of scheme it is REQUIRED for the others to step to give him space. it was the nugget role players that stepped up instead. that was the difference in the ball game.,1,30381.0,1746349389.0,LAClippers
mqhuoi0,FlyingBearSquid,FOH dude,2,11973.0,1746339212.0,LAClippers
mqh060o,None,[deleted],0,,1746324783.0,LAClippers
mqi6r8l,Nyeteka,I want some of what you are having that sounds legit,1,4161.0,1746346446.0,LAClippers
mqi9cqp,getzumm,lmaoooo,1,89612.0,1746348089.0,LAClippers
mqh2rlr,vb90,Just from a basketball perspective  those guys really deserve it. They  really molded their game as a team on Jokic's basketball approach and it's working...,1,64927.0,1746325842.0,LAClippers
mqh01g1,Niceguydan8,That doesn't guarantee anything better.  No idea why people keep parroting this dogshit take.,6,483300.0,1746324730.0,LAClippers
mqh2qrr,Niceguydan8,"I live in Minnesota so I want them to get to the Finals just so that I can go to the game.

I don't like their roster a whole lot though.  Ant is a great player but seems kinda like a POS, can't stand Randle's game, and don't like Gobert.

But would be cool to go to a Finals game regardless.",0,483300.0,1746325833.0,LAClippers
mqgzixh,Niceguydan8,"> This team is never going to get over the hump if we continue to build around hero ball players. 

The likely-MVP of the league on a historically great regular season team is a hero ball player, FYI.",22,483300.0,1746324524.0,LAClippers
mqh2faf,AmuseDeath,I made this post as long time ago and some genius told me isoball is the best offense we have. Team ball wins games not just one dude.,2,44831.0,1746325701.0,LAClippers
mqh0ooa,Back_at_it_agains,Bingo. It’s the same story with the Lakers as well. Hero ball with Luka and LeBron. ,1,550.0,1746324993.0,LAClippers
mqh454j,icewill36,It has nothing to do with hero ball. Did you even watch the series? They won because their others better.,0,30381.0,1746326397.0,LAClippers
mqh0ol2,ohmeohmy78,"There is a certain comfort in finishing the season healthy, because the “what if” scnerarios due to injuries always linger and feel worse.

The Clips lost a close series esp with some tough plays on the margins, but DEN simply played better when it mattered and they earned it rather than the Clips losing it. That’s easier to live with imo, and offers more clarity on what the team needs to do to get better.",16,131501.0,1746324992.0,LAClippers
mqh35ld,icewill36,It's exactly this. You cant win a series when you give up 2 games like that. Its just too much to overcome.,5,30381.0,1746325997.0,LAClippers
mqh0vgo,ChrisPaulGeorgeKarl,"I agree they lost it there long ago, but I think this ranks up there easily with 2020 as the worst finishes ever. It’s as good a finals shot as we’ve ever had, everyone healthy, other team in chaos with an interim coach, and they just couldn’t even win the easiest series in the bunch. Could’ve easily swept this team if they played just to their average.",6,7399.0,1746325071.0,LAClippers
mqij8cp,lesarbreschantent,"Kings fan here: honestly I think you guys have a very good team! It's just a matter of there being about 4 very good teams in the West (plus a great Thunder). Hard to be mad about the ending, it's just parity in action.",1,45098.0,1746354256.0,LAClippers
mqh1qbu,MannyDanning,"This is the right take, I'm early 40s Clipper fan for life and I can count all our play-off series since the early 90s on one hand before the Lob City/Ballmer era. We're now a threat every year and with our new stadium and Ballmers deep pockets players will want to come here. Sucks doing our usual shit and collapsing in the play-offs but as a franchise we're absolutely going in the right direction.",9,27004.0,1746325420.0,LAClippers
mqh5mk1,Nyeteka,"It is preferable to not being in the playoffs for no reason but i would prefer to be aiming to make an actual push even if it means being uncompetitive for years. 

It’s been clear since at least 2022 that this era was not going to win anything chip due to Kawhi injury history and his lack of leadership. The best teams in the West either tanked (OKC, Minny, Denver) or built a new roster via trading where their stars were flawed (Minny, LAL). 

If we don’t have our picks we should at least have been trying to do the latter instead of hitching our wagon to a player with an unbelievably bad injury history and try to build at the margins around him as though he will ever be what he once was. IMO the insistence on running things back with Kawhi ad infinitum was and is unconscionable",1,4161.0,1746327003.0,LAClippers
mqgynmz,Aggressive_Fail_9681,"Not having Kawhi for half a season, no one expected them to even make the playoffs",8,4195.0,1746324185.0,LAClippers
mqgzpp2,Niceguydan8,I think first round exit on a 50 win squad is almost certainly over-achieving,0,483300.0,1746324599.0,LAClippers
mqhjw29,mrhashbrown,"Yeah unfortunately the 5th seed kind of hurt the Clippers after all. I feel like if they happened to fall to the 6th or 7th seed, they would've had a better chance to take out the Lakers or Rockets.

With this series though, home court was a big advantage for the Nuggets. The Clips almost set themselves up to host an elimination game at home and avoid this Game 7 in Denver, but losing Game 4 at the last second changed the path to winning the series and pivoted to favor the Nuggets.

But whatever, we could talk about hypothetical differences all we want. Ultimately they had a very solid chance to win this series, but they fell short.

Edit: Fixed seeding",6,153144.0,1746333445.0,LAClippers
mqh0dvh,Swingman23,"Bro I was thinking the exact same thing re MJ. How did that mother fucker do it haha. He was scoring damn near 40 a game and felt like he could just do it at will. After watching the playoffs so closely, it’s crazy that he was able to execute so consistently under 1) extreme fatigue and 2) with that much pressure on his shoulder. I kept hoping Kawhi would channel his inner raptor days but it’s clearly hard to do when entire defensive schemes are focused on you",1,9071.0,1746324872.0,LAClippers
mqhk5wv,KrabS1,"I doubt another year of age on Kawhi and Harden is going to be helping us. This kinda felt like the last gasp imo. I may be wrong - I didn't expect us to be this good this year. But unless we can pull a rabbit out of our hat, I'm not expecting to improve next year.",2,179587.0,1746333578.0,LAClippers
mqgyhb4,mvpmvh,I actually laughed out loud at this. Thanks for cheering my mood,13,27295.0,1746324117.0,LAClippers
mqgyzom,mvpmvh,"Yea, I was really saying at the beginning of the year to raise a banner if we made the playoffs this season. I didn't think we'd get this far at all.",8,27295.0,1746324316.0,LAClippers
mqgzekb,mvpmvh,"I mean, I can think of 1 way doomers can lose lol",9,27295.0,1746324478.0,LAClippers
mqtshc9,Nyeteka,😢,1,4161.0,1746502409.0,LAClippers
mqh9gys,ayeno,I am one of those that can’t stop watching till the end. Even that Mavericks game we got smacked by 50. I will to watch till the final buzzer.,4,349256.0,1746328639.0,LAClippers
mqgzgzs,smooveasbutteryadig,Suns fan lurking... imagine how I felt when these clowns missed the play in. I have never felt more stress free lmao,11,8131.0,1746324504.0,LAClippers
mqh1x5w,TheBeyonder11-6,"Damn bro is finally free at last 😭 

I get it tho, maybe I or all of us had high expectations for this team, it did look legit, although at times it felt like we had the right ingredientes but the wrong recipe was being cooked, so yeah, I’m looking at you chef Tyronn Jamar Lue, and yeah, at the end of the day, mindset and mentality is what wins games in the end. 

With that being said, I would really like for our young guys to hit the floor and develop into their potential, even if we had SGA, he wouldn’t have been able to develop under Ty's coaching masterclass.

I wish to see younger and deserving legs in the floor, looking right at you Jordan Miller, I can also see a lot of potential with Christie so only time will tell IF those guys get to ever see the court and not just only in tr4sh time.

Peace and love to ya'll Clipper Nation 🧭⬆️🔥",1,283.0,1746325496.0,LAClippers
mqgymaw,tvztvz,😔,17,75707.0,1746324171.0,LAClippers
mqhf5w9,hornyjaildotorg,"That’s every sports sub I’ve ever been part of, it’s honestly have the reason I don’t use r/padres much until after all star break lol",1,45066.0,1746331211.0,LAClippers
mqj0c3o,Nyeteka,Why are you here then,-2,4161.0,1746362728.0,LAClippers
mqi2bdw,Few-Time-3303,-posted the man on social media,0,10456.0,1746343726.0,LAClippers
mqgziuy,Clipgang1629,Nah this sub gets what it deserves. It is not a fun place for anyone with love for this team,9,65366.0,1746324523.0,LAClippers
mqgyj57,tvztvz,"He played like 2 quarters and when he passed out of a double team no one else wanted to make a play. What excuses are being made? Be mad if you want, I’m not gonna be",19,75707.0,1746324137.0,LAClippers
mqi7lfv,tvztvz,Ya? Why do you think so? Doomers can always find a scapegoat lmao now the scapegoat is me?,1,75707.0,1746346973.0,LAClippers
mqgzjkn,marvolonewt,"Yeah, everyone was gassed by the looks. Normally, they give at least two days between Game 6 and 7. Oh well",8,28169.0,1746324531.0,LAClippers
mqh0aya,marvolonewt,"Honestly, I've given up trying to argue with folks. When he plays well, they don't care anyways. People are also gonna cherry pick and act like Kawhi showed up today and Harden didn't, when, in reality, no one did.",14,28169.0,1746324839.0,LAClippers
mqgz90y,marvolonewt,"Yeah, I mean, even if he had delivered the same or better offensive game as Kawhi, the entire team's effort was just not there today. Completely gassed",9,28169.0,1746324417.0,LAClippers
mqh23np,marvolonewt,"Denver did not double Harden in the previous games as much as they did today. They clearly adjusted after Game 6. As someone who has watched Harden throughout his career, when teams throw double-teams at him in the playoffs, he always turns into a facilitator. I guess he could've tried shooting more, but that would just lead to worse shot selection. I do wonder why we didn't try to run more Zu PnR to get him or Zu looks at the basket.",3,28169.0,1746325570.0,LAClippers
mqh5d5y,paulloween,You’re team won and you’re commenting in the other teams sub. That’s crazy,5,1624.0,1746326898.0,LAClippers
mqh7alq,Clipgang1629,Embarrassing. Get a life brother,4,65366.0,1746327695.0,LAClippers
mqh2svr,Greedy_Ear_Mike,"Kawhi is not a good leader, it seems. He was the best player on that Raptors team, but big booty Lowry and other vocal guys on that team set the tone.",5,12778.0,1746325856.0,LAClippers
mqgyu9s,MetalGearSolid108,He unfortunately can't make them play with more effort. These are grown ass men. Are we not the oldest team in the league? Lol,3,6231.0,1746324258.0,LAClippers
mqh00ap,MetalGearSolid108,"If you want to blame the coach for these grown ass men that know it's a game 7 for playing with no energy, do you. Lol.",-2,6231.0,1746324718.0,LAClippers
mqhfr1b,teokun123,Damn doomers in here.,1,69810.0,1746331487.0,LAClippers
mqh1gln,Niceguydan8,I think averaging an efficient 22.5 for the games outside of game 2 frankly just isn't enough for pretty much a score-only max player offensively,-1,483300.0,1746325308.0,LAClippers
mqgz581,Niceguydan8,"He had a couple of poor decisions, absolutely. His decisions weren't like disasterclass bad though.  Norm is an example of that.",1,483300.0,1746324376.0,LAClippers
mqh0tsa,ReggieWaynne,"Thank you, this sub loves defending a man who’s career was saved by Kyrie multiple times in the same damn series. Tali Ty is ass",5,1112.0,1746325051.0,LAClippers
mqh0g5n,MothershipConnection,"We have a good team but a low margin of error pretty much all season, we didn't have a ton of easy points or easy victories in general. At least they had an honest healthy shot in the playoffs this time",1,279435.0,1746324897.0,LAClippers
mqh0jrx,Clipgang1629,"The writing was always on the wall, there just isn’t much shooting on this team. Coffey and Powell were the only players shooting above league average for most of our season. 

It really isn’t surprising that our poor shooting caught up with us and I don’t really think things would’ve gone much differently regardless of seed. Although I don’t think anyone besides OKC, DEN, and maybe HOU and MIN were bouncing us first round.",1,65366.0,1746324938.0,LAClippers
mqgzf6m,InTheMorning_Nightss,Harden and Norm couldn’t punish Braun and Murray. Brooks and Amen would have fucking kept them in god damn jail.,1,343283.0,1746324484.0,LAClippers
mqgzm9l,Subject-Lab6998,You think OKC can beat Denver?,1,1592.0,1746324561.0,LAClippers
mqh15cm,ReggieWaynne,"That part, but who will we get that will actually play to Kawhi’s strengths? Idk if I trust Mike Brown, but maybe Malone? No clue lol",2,1112.0,1746325181.0,LAClippers
mqh0lhy,SaltyPopsicle117,There are definitely teams out there that would take Kawhi in return for a good package. Teams like Detroit that are on the verge of being great and only need one more star.,2,1519.0,1746324957.0,LAClippers
mqgzsc3,gothNclowngrlsPMpics,this made me tear up a little,3,9360.0,1746324629.0,LAClippers
mqgzzyl,vb32v,"Facts but it is true tho, just unfortunate for us die hard fans",2,2470.0,1746324714.0,LAClippers
mqgzdb5,Shoobedowop,agree. this isn't tomorrow. this is moments after getting blown out on national tv in a game 7. lol,0,75335.0,1746324464.0,LAClippers
mqh0hnq,Putrid-Impact8999,"I'm just talking about game 7, today he was not good enough.  Started the game excellently rebounding a lot I think he had 10 in the first quarter.  Offensively wasn't dominant and wasn't at his usual level.  He's been great overall in the season but today was when it really mattered and unfortunately he didn't deliver along with many others.",3,48115.0,1746324913.0,LAClippers
mqi1i1m,RUSInteriorDecorator,"He was terrible in game 7. Soft. Other than that he a good series. Harden was bad bad, Kawhi only had one Kawhi game and needed two of them.",1,2123.0,1746343229.0,LAClippers
