id,author,body,score,comment_karma,created_utc,subreddit
mqh66oa,Niceguydan8,"> Historically great?? They had a great season for their franchise. Historic NBA though? Not really.

There are six teams the last 55 years that have won 68 or more games.  That's historically great no matter how you slice it.

> And Joker should be the runaway MVP. Voters fatigue is BS and it'll rob him of another MVP just like when it went to Joel.

I do not give a fuck what ""should"" happen. Jokic likely won't win MVP.  Shai likely will. That's all that I said.

Therefore, my statement makes perfect sense unless you want to dive into this delusion of what should or shouldn't be happening.  I'm talking about what is or isn't.",2,483300.0,1746327231.0,LAClippers
mqi1h19,Few-Time-3303,"They have the best net rating ever. So yeah historically great. You really just don’t know the NBA very well. 

And if that’s too analytical for you, it’s a top five season by wins, too.",0,10456.0,1746343213.0,LAClippers
mqh5ejc,Niceguydan8,"EDIT: Oh, I see. Yeah you didn't say anything about a hump.

But you thought I was talking about Jokic when I was clearly talking about SGA.",3,483300.0,1746326914.0,LAClippers
mqhgcd2,Niceguydan8,"> Russ knows how to max a guy like zubac and wanted to play well in la.

Zu literally just had his best season playing alongside Harden tho.",3,483300.0,1746331764.0,LAClippers
mqh6vwt,Realfan555,"Yeah if SGA fits the mold, I’ve never heard it outside of this thread. You?

Let me google “sga hero ball” and see what comes up",3,3077.0,1746327525.0,LAClippers
mqieu05,Zyborgg,"SGA has less touches per game in the play offs than other “hero ball” players like Josh Hart, Davion Mitchell, and his own teammate Jalen Williams.",2,8191.0,1746351550.0,LAClippers
mqwim7r,Zauberer-IMDB,"That's why historically teams have two stars, double or triple, kick out to the other star and he does something. Harden was just too old to do any of that.",1,406789.0,1746546546.0,LAClippers
mqi1pud,Few-Time-3303,"There’s no point in debating with somebody like this. He knows so little about ball that he’ll just invent any hot take he requires to move the goal post. Deep down he knows he’s wrong but his ego won’t let him accede.

(To be clear I mean the dude you’re schooling, not you. The guy who thinks the thunder didn’t have a historically great year.)",3,10456.0,1746343358.0,LAClippers
mqm0ugj,LACIRCA2044,Maybe be more clear when you comment bud,1,48284.0,1746397455.0,LAClippers
mqh788u,Niceguydan8,"Watch him play lol.  He isolates second most in the league and while being a good playmaker, he's not an elite one.

If that's not hero ball, what is it?",-2,483300.0,1746327668.0,LAClippers
mqyniqb,Ineedpalmtreeliving,"Regardless of age, he played resigned and scared",1,4767.0,1746568589.0,LAClippers
mqi278n,Niceguydan8,Appreciate you!,1,483300.0,1746343656.0,LAClippers
mqm116q,Niceguydan8,"It was very clear from the start that I was referring to Shai and OKC.

Only a person with very poor reading comprehension would not understand that.",1,483300.0,1746397522.0,LAClippers
mqh7myt,Realfan555,"Like I said, I’ve never heard SGA being described as playing hero ball outside of this thread.

You?

I’ve heard Kobe and Harden before, just never SGA.

You? ",2,3077.0,1746327842.0,LAClippers
mqh898o,Realfan555,"“If that's not hero ball, what is it?”

Hero ball isn’t about isolations. It’s about forcing things, taking bad shots.

All post players play isolation basketball. Shaq, Kareem, Olajuwon. It’s all isolation. 

But as long as something is working, and u get good looks/shots everytime, then it’s not hero ball.

Hero ball = forcing things that arent there. Trying to be a hero",2,3077.0,1746328108.0,LAClippers
mqh80j6,Niceguydan8,I don't give a fuck what people say. I watch him play.  He plays isolation hero ball.  He's fucking amazing at it.  He plays more like Kobe than Harden does.,1,483300.0,1746328004.0,LAClippers
mqiex2y,Zyborgg,"SGA touches per game in the playoffs less than Josh Hart, Davion Mitchell, and his own teammate Jalen Williams. Definitely not a hero ball team.",1,8191.0,1746351603.0,LAClippers
mqh9ett,Realfan555,"Everybody’s entitled to their opinion.

All I asked was if you’ve heard anyone else say it before?

It’s a simple question. Sounds like you haven’t.

Neither have I.",2,3077.0,1746328613.0,LAClippers
mqwieqi,Zauberer-IMDB,That's a pretty definitive objective truth if his touches are less than even another player on his own team.,1,406789.0,1746546487.0,LAClippers
mreqpq3,nonezer0,![gif](giphy|ASd0Ukj0y3qMM),6,23598.0,1746793917.0,LAClippers
mrg742n,CliffP,"Tonight should really show what this season’s Clips were. 

OKC gave the nuggets an even bigger smack down than LAC did Game 3 and the Nuggets didn’t let it phase them too much and were blowing the Clippers out in Game 4 for a bit of the second half. 

If OKC rolls them again then yeah, there was probably no beating OKC with the perfect defenders they have for Harden and Kawhi. Zu might’ve did damage though.",1,58444.0,1746810706.0,LAClippers
mrg4um1,POTATOKING10000,24 savage! This is the type of high quality post I like to see!,3,10967.0,1746810018.0,LAClippers
mrg4bil,BrimBeatz,Please guys let's make this the most upvoted thing on this subreddit,3,993.0,1746809858.0,LAClippers
mrgd09z,mrmctommy,this post saved my broke ass life,2,57677.0,1746812474.0,LAClippers
mrgr1d6,supernormalnorm,Clippers fans doing Clippers fans things,2,39639.0,1746816711.0,LAClippers
mrgvi4o,musy101,Amazing stuff!,1,42314.0,1746818083.0,LAClippers
mrggyo1,POTATOKING10000,"Look at Celtics, they’ve dominated the first 3 quarters vs Knicks, but still lost both games. Basketball involves luck, and how hard you’re willing to fight to the end. Nuggets took the fight with harden personally, our guys folded.",4,10967.0,1746813647.0,LAClippers
mrghexq,whenwillthisend2,We also got fucked and had to play them 3 times in Denver and didn’t get the fair situation of splitting it even,4,1288.0,1746813783.0,LAClippers
mrghj5x,Early_Specific1433,"i mean.. the first two games of their series has played out almost identical to ours and they actually stole home court now. 

But yeah, spurs and warriors dynasties teams were always crushing the ones they should and winning the ones they should. Until the culture aligns with that, we’ll be just too far out",2,1274.0,1746813819.0,LAClippers
mrgt9q7,bucketGetter89,"Yup a bit of luck goes a long way in the playoffs. Same with Cavs and pacers. Cavs fans will be shocked to be down 2 where they easily could’ve been up 2. It’s not even a knock on their squad or that they aren’t good enough, sometimes you really just need the ball to bounce your way a couple more times",2,11855.0,1746817396.0,LAClippers
mrgozc3,arebeewhy,"Absolutely FOLDED. Harden in game 7 in particular, but his history of doing just that in the playoffs is well documented. It’s also due largely to his system which relies heavily on his ability to be a fairly efficient high volume scoring threat. Kobe said it best when analyzing Harden and why he won’t win in the playoffs unless he adapts to a different play style. 

Also OKC lost their home court advantage. Series is tied 1-1. Why exaggerate what is happening there? 

I just can’t get behind coulda, woulda, shoulda takes to push a narrative that a veteran heavy team is on the brink. It could just as easily be used to prove that a team gave it everything and still wasn’t able to get over the hump. 

Here are the facts. Nobody outside of maybe Westbrook is driven to cement their legacy by winning in the Playoffs more than Harden. Nobody outside of maybe Steph is as feared of a performer in the playoffs when the game is on the line as Kawhi. Neither of those guys were able to push this roster enough to get out of the first round. 

Those reasons make it tough to view simply running it back as anything but a failure. It’s OK, 90+% of the league fails to some degree in a given year. Most of them spend resources improving either their immediate roster or upgrading future resources in the off season.  
Unfortunately unless the Clippers make some trades, they aren’t really in position to do either thing.",1,5287.0,1746816085.0,LAClippers
mrgsxcg,bucketGetter89,Yeah just another example of how luck is a factor each year. Obviously not the only factors but a necessary one that needs to go in your favour,2,11855.0,1746817289.0,LAClippers
mrg6bua,Tw0XXs,That was a fun team.,3,5669.0,1746810468.0,LAClippers
mrgfiom,erniesdaddy2003,"Yup, have the play diagram on my coffee mug",3,763.0,1746813219.0,LAClippers
mrgk0b2,lm2lm,How come that number 2 guy disappeared from existence a couple years ago? Has anyone ever checked up on that?,1,70399.0,1746814570.0,LAClippers
mrb3dqq,wolferan_maximus,Fun guy really loves the game period.,68,3647.0,1746736250.0,LAClippers
mrb4s8m,Asleep-Eggplant-6337,He finally has a healthy offseason. I hope he bounces back next season.,58,11231.0,1746736660.0,LAClippers
mrb3zgh,_Tpriest_,🖐🏾,25,3049.0,1746736424.0,LAClippers
mrb349s,remuslupon,He got that dawg in him.,47,3252.0,1746736176.0,LAClippers
mrbl0u1,VegasWorldwide,"this is the part nobody is talking about with the clippers.  first time in how long where kawhi actually gets an off-season?  no surgery.  no rehab.  no mental obstacles.  just time off to practice, reset, train and prepare.  now, I still hope he takes oct/nov off but instead of coming back jan 4, maybe return dec 15, which is another 10 games or so and will help us get over that 50 win hump to 55.  

we are so back",34,2727.0,1746741737.0,LAClippers
mrb4j5y,BlitzBalla32,What hs is that?,4,88.0,1746736586.0,LAClippers
mrbhy2l,dvnbtn,TRUE TO IT.,5,1236.0,1746740721.0,LAClippers
mrbn486,Function_Fighter,this is right now? damn love to see it. just wondering what their plan is next season. is he gonna play the whole season??,4,22638.0,1746742454.0,LAClippers
mrbsuv7,Evening_Influence794,2025/2026 Kawhi is gonna 🔥🔥🔥,4,5775.0,1746744459.0,LAClippers
mrbzj6e,Silly-Drummer1830,At this point im just happy he grts to play. He can still win a ring but to see him play without injuries is enough. He’s proven his game already,4,162.0,1746746829.0,LAClippers
mrb7581,Jaden_Smith_3rdEye,Harden in the Bahamas,11,159.0,1746737354.0,LAClippers
mrcpko4,Icy_Inflation24,We are seeing the NBA doesn’t have a dominate team and if we can string together another good year to follow up from this year we will have a lot of chemistry and continuity to at least give us a chance to,3,780.0,1746756456.0,LAClippers
mrd2kgi,Temetzcoatl,I see he got the bionic leg installed,3,9735.0,1746761681.0,LAClippers
mrc1iyw,dope_ass_user_name,New coach yet?,6,9056.0,1746747548.0,LAClippers
mrc3fc1,CalvDaGr8,My goat,2,5645.0,1746748229.0,LAClippers
mrc97k1,Tricky_Structure_504,Reg season mvp incoming,2,7218.0,1746750378.0,LAClippers
mrcdssh,RyverFisher,"Not one comment about the full leg sleeve, that's Interesting.",1,7026.0,1746752085.0,LAClippers
mrfoa90,go0sebumpz,who captured this? wheres he at,1,2988.0,1746804975.0,LAClippers
mrgedlc,OdyPop,I think a lot of Kawhis gravity is due to the fact that he’s one of few players in the league that I’m sure scares the other team.,1,18.0,1746812883.0,LAClippers
mrctirn,PoundinPavement,Knee sleeve...yikes,-1,36.0,1746757951.0,LAClippers
mrd20ds,Nby333,"Aww so cute

When Ben Simmons does it: Hello, HR?",0,14699.0,1746761435.0,LAClippers
mrbj53a,Meoh916,Cant wait till this terrorist is off my team ... he really forced us to get rid of Shai ... smh ... that trade set us back another 10 to 20 years,-14,-8.0,1746741112.0,LAClippers
mrb55rr,FloatDH2,"Hell yeah! Get it Kawhi. Gotta make sure we’re healthy for that first round exit next April.

Edit:Feasting off these downvotes for speaking the truth. Keep em coming yall",-34,145425.0,1746736769.0,LAClippers
mregbz7,FreeHat1234,Trying his hardest to “accidentally” get injured so he can take an additional 6 months off. See ya in March Kawhi !,-2,367.0,1746789524.0,LAClippers
mrb4rna,bdf2018_298,He’s got to be happy he doesn’t have to rehab this offseason and just can ball.  First time since 2020?,45,175568.0,1746736655.0,LAClippers
mrbx9ak,renhaoasuka,I dont think he ever had an injury free offseason with us. Even after his ring with the raptors he was injured all off season. I get why people want to blow it up but screw it I'm down to run it back.,11,1350.0,1746746017.0,LAClippers
mrbox0b,bucketGetter89,This 100%,10,11855.0,1746743073.0,LAClippers
mrdmnns,Nyeteka,"😂

I can’t even hate it. Okay mate we are back 💪",2,4161.0,1746771845.0,LAClippers
mre2f80,arebeewhy,"He’s also soon to be 34 and has a lengthy history of lower body injuries with several slower than average rehabs. Nobody talks about it because they either don’t want to jinx it or don’t trust his health will remain intact. 

Your point is well made and it could certainly be a boost but I absolutely won’t be talking about it like it guarantees any improvement for next season because of what I wrote in the above paragraph.",2,5287.0,1746781780.0,LAClippers
mrdd2p3,IgnorantGenius,Either that or he injures himself.,1,73158.0,1746766654.0,LAClippers
mrddof6,ObitoUchiha10f,Clippers fans are so hopeful! I can already see what would happen next summer,1,20340.0,1746766960.0,LAClippers
mrcc3t8,kezmicdust,MiraCosta College in Oceanside,2,11139.0,1746751461.0,LAClippers
mrbt09q,AcademicClub5196,Are you fr? I don't have any other social media..,0,2.0,1746744512.0,LAClippers
mrcrzpu,mateohhhh,It’s interesting that he never wears any lower body compression during games.,2,8965.0,1746757362.0,LAClippers
mrdtdqw,bucketGetter89,Yeah I noticed that straight away but must just be a precautionary thing while putting in offseason work. Makes no sense why he’d be out there otherwise,2,11855.0,1746775945.0,LAClippers
mrdqrue,maxamillion17,Why yikes,4,6300.0,1746774298.0,LAClippers
mrdtaii,bucketGetter89,"Gotta be safe, can’t be taking risks in the offseason",4,11855.0,1746775887.0,LAClippers
mrc0qoo,BooomTaratTarat,Shai hasn't proved anything yet.,2,1158.0,1746747268.0,LAClippers
mrb6r9h,Penguindrummer_2,I'd be so embarassed if I realised that I was worse at coping with a defeat than the players on the court who are responsible for it,13,46964.0,1746737239.0,LAClippers
mrbjhdz,Meoh916,We are perenial 1st round exits for the foreseeable future. We aint doing shit next season. As a franchise we are HOPING to land free agents come summer 2026 ... HOPING ... Clippers hoping for free agents? We're so cooked lol all cause this terroist Kawhi wanted PG so we traded away all our picks and SGA lol there went any hope for winning,-3,-8.0,1746741224.0,LAClippers
mrcena7,VegasWorldwide,It’s really the only option ,0,2727.0,1746752397.0,LAClippers
mrffm4k,VegasWorldwide,"yeah I definitely get the gloom around Leonard and hey, it's valid but also, you can't argue this is the longest time he's been on the team, without injury.  it's may 9 and he's already in the gym shooting around.  I don't think I've ever seen that in 6 years.  I just hope they don't rush him back and stick with the only approach that has worked.",2,2727.0,1746802338.0,LAClippers
mrff7gl,VegasWorldwide,well he didn't injure himself last year.  actually been a while since his last injury,1,2727.0,1746802215.0,LAClippers
mrbue6d,Ok-Coyote2643,"He’s just trolling, I saw Harden at a bar Monday night in Boulder. Cool dude, got a few pictures and he signed my sons Murray jersey",13,667.0,1746745001.0,LAClippers
mrcxt6t,RyverFisher,"Exactly... and i wonder after what was his big game, 3? If he got inflammation which is why he wasn't the same after.",-3,7026.0,1746759665.0,LAClippers
mrdmb1k,Nyeteka,Er 🤔 I think this says more about the players than OP,1,4161.0,1746771643.0,LAClippers
mrbjo1f,Meoh916,Speaking truth is coping? Oooooook,-4,-8.0,1746741285.0,LAClippers
mrbuq65,AcademicClub5196,"Ahh, thanks..at least he took time out to sign the jersey. That's a moment!",2,2.0,1746745119.0,LAClippers
mrefah8,Function_Fighter,Really? Didn’t seem like he was showing any discomfort,2,22638.0,1746789037.0,LAClippers
mrdfe73,Bananaman556,I saw harden in Miami on Monday,1,33.0,1746767848.0,LAClippers
mrcqq6n,E2A6S,"I swear this has been said the last 2 years and hasn’t happened, and outside the clippers I’m a complete nba casual and have no idea how this would happen or how good he is",70,37633.0,1746756886.0,LAClippers
mrcs013,penguinoo401,Isn’t he always injured,40,8222.0,1746757365.0,LAClippers
mrcrbti,Ancient_Design_1332,"Yeah good fit, but wouldn’t be a needle mover IMO ",19,7872.0,1746757112.0,LAClippers
mrctku7,dkdoki,Old and injury prone. We really doing this sht again. Smh,12,198866.0,1746757974.0,LAClippers
mrcs9yp,poppertheplenguin,Old. Methinks some new YOUTH would be nice,14,4912.0,1746757472.0,LAClippers
mrcrv34,Longjumping-Use-6050,This won’t do shit for the Clippers,11,-16.0,1746757313.0,LAClippers
mrcteys,PoundinPavement,Oldest team in history,4,36.0,1746757910.0,LAClippers
mrd2ht7,teh_scarecrow,We need to stop going after old and washed players that don't move the needle for us.,4,38312.0,1746761648.0,LAClippers
mrct1qy,erniesdaddy2003,Reminds me of how we longed for The Truth and Serge Ibaka and by the time each can over they were washed,7,763.0,1746757768.0,LAClippers
mrcsfcu,farmerpeach,"I mean it’s not a “bad” move, but how does this materially help things?",3,14295.0,1746757530.0,LAClippers
mrcsr7u,ttttyttt678,"He’s a vet min player, so sure why not.",3,112712.0,1746757656.0,LAClippers
mrct3kq,nonezer0,![gif](giphy|T16BgUW4X3MNw8tQJe),3,23598.0,1746757787.0,LAClippers
mrctaqx,TonyKartRacer,This would’ve been great 5 years ago…,3,149.0,1746757864.0,LAClippers
mrcv273,mccgriffin,Another player on the wrong side of 30,3,22043.0,1746758556.0,LAClippers
mrcwu7v,jgroove_LA,"He’d take some pressure off harden. Not
Mad at it, although he’s injured A LOT.",3,340479.0,1746759270.0,LAClippers
mrcrbf3,Frequent_Mouse_3783,I’ve wanted this to happen since he got traded to Portland or whatever and always get downvoted. How young is he now?,2,2255.0,1746757107.0,LAClippers
mrcrsfy,LLUrDadsFave,Why he don't play games?,2,226785.0,1746757287.0,LAClippers
mrcwoih,lomo-saltado,I feel like they’ve been targeting him for a few seasons now.,2,3230.0,1746759207.0,LAClippers
mrd17q8,arebeewhy,"I like Brogdon but this doesn’t excite me. We already have plenty of bench level talent guards on the roster. Adding him wouod only force someone else out of the rotation thus wasting their contract/roster spot or give Lue even more reason to go 3 guard lineup which I can’t stand unless it’s for specific matchups. 

Would much rather spend the money on size and physicality unless we unload Dunn or Bogey for a player like that.",2,5287.0,1746761091.0,LAClippers
mrd3dcz,Canoli5000,Another old injury prone player? We are not a serious franchise,2,9082.0,1746762042.0,LAClippers
mrda53v,patents4life,Brogdon Brogdonovic maybe,2,4726.0,1746765196.0,LAClippers
mrdby0k,Skilled626,Who?,2,27596.0,1746766087.0,LAClippers
mrdgq8d,Blantz3232,No thanks not another injury prone 30 something year old,2,121.0,1746768530.0,LAClippers
mrdn8vk,Gloomy_Company_9848,This is kinda 4 years too late for him to make a impact,2,1035.0,1746772187.0,LAClippers
mre36n6,Prudent-Result-7173,Adding another old guy,2,49.0,1746782267.0,LAClippers
mrefimm,RUSInteriorDecorator,"He’s old and injured but he brings what they need in terms of a backup guard (Norm is only a scorer, Bogdon proved he can’t play in playoffs, Dunn can’t shoot consistent). They need to get younger. Bring in a young big that can play next Zubac so they don’t get abused on the glass. Would love to see a clippers lineup with a PF that can hit an open 3 and rebound defend.",2,2123.0,1746789142.0,LAClippers
mrepq7i,TaskChance1404,I think he’s washed. Let’s look at some younger options and start building for the future,2,186.0,1746793530.0,LAClippers
mrcr85n,BoozeGetsMeThrough,"Washington's GM used to be part of the Clippers FO, so he may offer a sweet heart deal.",2,150620.0,1746757073.0,LAClippers
mrd01wp,Local_Marsupial5752,"Horrible. Go young, holy shit Lawrence I hope you are fired the day OKC wins it all and Shai gets his MVP",2,2522.0,1746760603.0,LAClippers
mrcucud,Nick4942,Speedrun to collect all the players named bogdon,1,472.0,1746758280.0,LAClippers
mrcvor2,Function_Fighter,nah,1,22638.0,1746758806.0,LAClippers
mrcwfsy,ChrisPaulGeorgeKarl,"Harden Dunn Powell Bogi is a solid rotation, he’s fine but don’t see how he’s at all changing anything. And always injured anyway. Weird story",1,7399.0,1746759109.0,LAClippers
mrdgect,blackakainu, Offensive kris dunn naw im cool,1,20621.0,1746768359.0,LAClippers
mrfj13d,Puzzleheaded_King19,No,1,282.0,1746803374.0,LAClippers
mrg0bzc,Musicfan637,"Too small, too old, too weak and not good enough.",1,19674.0,1746808653.0,LAClippers
mrgvap4,wowzersmanz,what is potential size? grower v shower?,1,353.0,1746818019.0,LAClippers
mrct71q,Mattyj925,Well it did happen once. But then it didn’t,31,14135.0,1746757824.0,LAClippers
mrcypbk,JimmyKanine,This is the first time he’s been a free agent in that time period and the team is in desperate need of a backup ball handler so it’s even more likely.,16,49135.0,1746760035.0,LAClippers
mrdiz3j,Wonderful_Tutor_3455,We got Simmons instead,3,3839.0,1746769751.0,LAClippers
mrct9t1,FloatDH2,Perfect fit for our squad,72,145425.0,1746757853.0,LAClippers
mrcyujx,JimmyKanine,He was hurt last year but I also think the Wizards shut him down to finish off the season to help his free agency.,5,49135.0,1746760097.0,LAClippers
mrcu08n,coachketchup,"He’s kinda redundant with Norman, Bogi, and Dunn. More than anything we need a starting power forward. How many years do we have to watch our team play small and get killed by rebounds.",25,64913.0,1746758141.0,LAClippers
mrd3k67,Canoli5000,I don't know if they're serious or trolling us. Probably serious.. smh,2,9082.0,1746762126.0,LAClippers
mrd6nad,InTheMorning_Nightss,I’m not sure what young guys you think will be available for MLE.  People are gonna be real upset this offseason when LAC gets older win now guys in an already terrible pool of FAs lol.,2,343283.0,1746763526.0,LAClippers
mrcx0xw,DCoop53,"Shit he'll be 33 in december, I thought he was younger. His ROTY season feels like yesterday, sigh...",4,25143.0,1746759347.0,LAClippers
mrd6heg,InTheMorning_Nightss,No worthwhile young prospects will really be available for MLE.  That’s really what the slot is gunning for.,2,343283.0,1746763450.0,LAClippers
mrdfcoh,Cfcla,Youth would come at the cost of significant assets,2,23316.0,1746767825.0,LAClippers
mrcy3hp,justanotherfknloser,Team needs Giannis without giving up anyone important to be a true contender lol,2,19404.0,1746759782.0,LAClippers
mrctx4k,unpopular-dave,Nothing will. This team is in rebuild mode. We should take bad contracts with draft compensation,-3,60890.0,1746758107.0,LAClippers
mrcvrug,Fernmixer,“…to win a championship! 💪”,7,6711.0,1746758840.0,LAClippers
mrd7d31,chillandhornyy,"Way better than any backup guard they have now, but they desperately need another good forward",2,9.0,1746763857.0,LAClippers
mrcy51j,DCoop53,We actually traded for him in 2023 as part of the Porzingis to Boston trade and we would have sent Mook and Coffey to the Wizards but there were concerns about his health so the Clips canceled it. I don't think it's happening two years later if we already had concerns back then.,4,25143.0,1746759800.0,LAClippers
mrepk4r,Special-Valuable7678,Adalma? He might be expensive though.,2,176.0,1746793462.0,LAClippers
mrcspq1,ttttyttt678,Brogdon a free agent.,3,112712.0,1746757641.0,LAClippers
mrcxglj,DCoop53,"It doesn't have to be him necesarily but we definitely need a playmaker who can make 3s, we can't keep playing Harden for 40 minutes.",2,25143.0,1746759523.0,LAClippers
mrd5tby,InTheMorning_Nightss,"That and the free agent class is pretty empty, and Brogdon is a potential MLE candidate. The other potential names maybe in that range: Portis, Yabusele, Tyus, D’Lo, Hardaway Jr, Capela, and Bruce Brown.

Basically all of them are short term boosts really, so kind of just find the mutual fit.",10,343283.0,1746763144.0,LAClippers
mrcte91,penguinoo401,😭,11,8222.0,1746757902.0,LAClippers
mrd74lf,chillandhornyy,He was hurt the year before that and a few years ago too he’s legit a good all around PG who can shoot but he’s always hurt,6,9.0,1746763750.0,LAClippers
mrd7dkk,JimmyKanine,He was hurt this year but I also think the Wizards shut him down to finish off the season to help his free agency.,0,49135.0,1746763864.0,LAClippers
mrcw1v3,Ancient_Design_1332,Yeah good point that’s the biggest need. Though I do think a ball handler to take pressure off of harden would be good too ,7,7872.0,1746758952.0,LAClippers
mrd0f5v,JimmyKanine,"None of those 3 are ball handlers. Bogi showed that he can somewhat deal with it but he’s better at the 2. Norm and Dunn could not function with Harden off the floor.

Brogdon is also bigger than them which definitely would help.",7,49135.0,1746760753.0,LAClippers
mreyr5n,Canoli5000,I'm a 'develop the youth' guy at this point so going after Brogdan or any other mid free agent vet that doesn't move the needle for us brings me no joy,1,9082.0,1746796859.0,LAClippers
mrfs1rs,dkdoki,Yes agree thats the reality. It just gets frustrating when the FO says one thing and their actions are the opposite. I guess 32-33 is young to them lol,1,198866.0,1746806109.0,LAClippers
mrd1mk4,poppertheplenguin,I didn’t even know the age lol. I just remember him being on my MyPlayers team in 2K19 so figured he couldn’t be that young,1,4912.0,1746761268.0,LAClippers
