id,author,body,score,comment_karma,created_utc,subreddit
mqh90tw,IgnorantGenius,"Anyone think Harden shaves points and the whole beard is a smokescreen for his shaving?  I mean, he started holding the ball early on and just dribbling until the double team came.  He took 8 fucking shots.  8.  He didn't even turn it over much! Why Lue put Kawhi on Gordon when we have Batum.  

We got beat by a team that has no bench while we were fully healthy.  

Zu gotta go.  This is the perfect time to trade him.  His numbers are up.  But these last two games show that we are not going to win with him as the starting center.  Sure, he can matchup with Jokic, but he couldn't even dunk on him when he had the chance.  He's too nice.

So, who is gone?  We know Ben is gone, and maybe Coffey.  Batum might retire after this, he probably won't have a better season next year.  Mills is gone.  Eubanks has no guaranteed money for next year according to what I read, so he might be gone.  Harden will opt-in, most likely, not like we can get an upgrade for him.

/Doomer mode",2,73158.0,1746328442.0,LAClippers
mqhu8c4,Eyebarah,Bunch bitches,2,14752.0,1746338956.0,LAClippers
mqhu9bb,Eyebarah,Hoe ass hoes,2,14752.0,1746338971.0,LAClippers
mqhw0a4,Eyebarah,Hoe ass bitches. We lost like some hoes.,2,14752.0,1746339976.0,LAClippers
mqgz56n,Theballharperhit,If you watched harden play defense tonight you now understand why the nets and sixers wanted him gone. He for whatever reason in a big game just shows up with no energy/doesn't try/doesn't shoot and becomes a shell of the player he normally is. He is insanely talented but will always lose in must win situations because he is scared.  I would rather he shoot 6 for 26 and lose that way over him being a baby bitch letting it rest on everyone elses shoulders in a must win game.,1,22426.0,1746324375.0,LAClippers
mqh482a,McJumbos,No excuses. The nuggets were just the better team tonight and they kicked our ass. Fucking terrible way to go out but I'm ready to start the process again next year lfg clippers,1,237759.0,1746326430.0,LAClippers
mqgxplg,None,[deleted],5,,1746323818.0,LAClippers
mqgy6fk,im_scytale,"Sucks, their guys showed up and ours outside of kawhi didn’t.",1,22669.0,1746324000.0,LAClippers
mqgy6rh,TooManyLangauages,"You gotta find the positives, and our young guys went out there and showed up at the end, forcing back in the Nuggets starters for even a bit is huge. Great regular season, sad way to end it, hopefully we can see some of the young guys next year",1,89.0,1746324003.0,LAClippers
mqgy8kk,dvlonyourshldr,See you guys next season,1,10723.0,1746324023.0,LAClippers
mqgybt9,Fit_Cycle_2809,"This was the first season where I watched almost all games, I was excited because expectations were so low. I’m glad we overachieved but disappointed because we always lose like this. We were even with them until this game, the lack of effort is the worst part of it. Anyways, onto the next season!",1,204.0,1746324058.0,LAClippers
mqgz6g9,agypagymadden,"Looking forward to going back to the dome next season, hopefully with some fresh faces in the FO and roster. At least we didn’t have any major injuries",1,18022.0,1746324389.0,LAClippers
mqgzl2t,Osshhh619,"Clippers need a second option as a scorer, preferably someone who is young. Cam Thomas of the Nets would be a good fit, I think.",1,468.0,1746324548.0,LAClippers
mqh0bbx,neiler91,"Well thankfully I thought this game started at 10 est so I didn't have to experience the heartache in real time. 


No clue what's in store for us next year. New coach? New PG? Maybe giving some younger talent a chance? 


I'll pull foe denver to win now though for sure :)",1,369.0,1746324843.0,LAClippers
mqh14t0,MigzFern,GGS BOIS. BLOW IT TF UP HAHAHAHA,1,14334.0,1746325175.0,LAClippers
mqh44ox,Yasx00,That was fucking woeful. What a waste of a season,1,705.0,1746326391.0,LAClippers
mqh7izz,le_doink_salesman,4th quarter yelling why tf Batum in😤,1,3857.0,1746327795.0,LAClippers
mqhf4am,Prosado22,"All year, Lue did not care about not allowing role players to thrive. It came back to bite him in the end.",1,13541.0,1746331190.0,LAClippers
mqiby1b,Niceguydan8,"I'm re-watching the game and have a couple of things I guess I didn't realize the extent of while watching real-time:

-The Nuggets were trapping Harden *hard* the whole game, [here's an example of what I'm talking about](https://imgur.com/a/0nbVsjV).  There are possessions where he's getting doubled shortly after crossing halfcourt. Usually (not always) he's making the right play, but there's some hesitancy after the pass out of the double from the other guys that let's Denver recover.

-Good god that 2nd quarter lineup with Kawhi, Batum, Norm, Dunn, Bogi was so god damn bad, lol. [This is the Kris Dunn effect and how he makes offense harder for every other player when he's on the court](https://imgur.com/a/rKStqc2)

-This one probably can't be understated: The lead absolutely ballooned when they started giving Norm these possessions in the 3rd and he was genuinely abysmal.  The game got out of hand when Norm was just throwing the ball away for no reason and the Nuggets got hot on the other end.  Prior to that stretch, the team was losing but it was like low-double digits at most.

I still think Harden overall could have/should have done better, but I think in a lot of these possessions that I'm looking at, he's making the correct decision and usually doing so in a timely manner. 

I think Denver just challenged the non-Harden players to beat them and they weren't able to do it.  

Kawhi has a couple of spurts where he looks really good, but also has kinda large portions where he's just non-impactful too.",1,483300.0,1746349705.0,LAClippers
mqgy5u4,New_Kick_7757,"Well, at least we can enjoy the beating OKC is about to put on Denver",1,1752.0,1746323993.0,LAClippers
mqgy7xw,broby54,"Westbrook, no not a fan anymore.",1,538.0,1746324016.0,LAClippers
mqgy8fm,nosta2,Blow it up please. I’m sick of rooting for Kawhi/Harden. It’s time to move on,1,2813.0,1746324021.0,LAClippers
mqgzfux,unpopular-dave,"At the end of the day, both these teams were going to get swept by the thunder… Maybe gentlemen sweep if they’re lucky",1,60890.0,1746324491.0,LAClippers
mqhd6v8,Dunkamo,Harden dislocated his ovary.,1,524.0,1746330305.0,LAClippers
mqhphzn,2alligator,https://preview.redd.it/p3jl6s3japye1.jpeg?width=1070&format=pjpg&auto=webp&s=b09d2af6ee99fc98d3cd3d0d635bd9e75b1da9d3,1,291.0,1746336339.0,LAClippers
mqgy210,theonlythingissufjan,"Well, it was fun while it lasted. We over performed in the regular season, had hope, and then realized we’re the clippers. GG Denver, I wish you luck.",1,33679.0,1746323952.0,LAClippers
mqgydw9,Nyeteka,"That performance does not warrant much more than to say blow it the fuck up. 

Arguably the Suns overreacted when they were humiliated but we have done this for six years. Kawhi is not leading us anywhere. Make a start on the next era even if it’s a long road. The doomers have been right all along",1,4161.0,1746324081.0,LAClippers
mqgylik,dontmatterme810,Can't buy your way to a championship. *Shocked Pikachu face*,1,2799.0,1746324163.0,LAClippers
mqgyquk,pinya619,Trying not to play what if but man the Nuggets got so many lucky breaks this series that I have a hard time seeing them as the better team. Every year feels like Hardens and Kawhis last chance. I really hope this isn’t that year though,1,71553.0,1746324221.0,LAClippers
mqgyttc,UhFreeMeek,Disappointing end to a good season. Wait til next year!,1,337.0,1746324253.0,LAClippers
mqgyvjt,GP3ElPresidente,"Enjoy free agency James Harden

Happy birthday Ty Lue and u will be getting ur severance payment soon i hope…

And then Lawrence Frank…

What does he even do???",1,66957.0,1746324272.0,LAClippers
mqgzgzf,Sensitive_War2107,"You can't blame clips. Run it back next season, get rid of Ty Lue and Bogey. Trade Harden if he plays lazy defense next season (boxing out). Also let's say clips make the playoffs next year and Balmer doesn't petition against the obvious one sided officiating. Then Clips fans should boycott next season playoff games.",1,87.0,1746324503.0,LAClippers
mqh0dqu,student_of_theGame,"We weren’t supposed to be here and we surged so much that a lot of talking heads saw us as legit contenders. Overall, we showed a lot but we lacked that emotional intensity that’s required in the playoffs. I think that the Kawhi experiment is done. I feel like it’s time to rebuild unfortunately.",1,1327.0,1746324870.0,LAClippers
mqh0jh7,Mountain-Song-6024,"Honestly...

Where is the upside in this team? Is the window closed?

Trade Harden and build around Leonard and Norman?

Who would want harden anyway? I fucking wouldn't. 

It may be time to blow it up and embrace a full on rebuild.",1,13806.0,1746324934.0,LAClippers
mqh1cqu,PineappleDaddi,Time to get rid of all the old heads. Players and staff.,1,842.0,1746325264.0,LAClippers
mqh38pl,es84,"This goes to show you, the regular season matters. 2 game difference being between the 2nd and 5th seeds. If the Clippers take 2 games more seriously, if they don't schedule losses and let stars sit when they don't need to, this team is sitting at the 2nd slot battling an easier road. 


But in classic Clipper fashion, they have to go the hard way. And because of not taking a few games more seriously, the tiebreaker sensa the Clippers on the road vs Denver and the Golden State vs Houston on the easier side of the bracket. 


All I hope is that Minnesota or Houston shows up and stops OKC. 


Tough way to end the season. We've begged for health. Finally got it. And blew it. ",1,164375.0,1746326031.0,LAClippers
mqh47f5,justanotherfknloser,I started watching the game and they went on 15-0 run,1,19404.0,1746326423.0,LAClippers
mqh5q2w,Yasx00,That was fucking woeful. What a waste after the effort we showed this season,1,705.0,1746327042.0,LAClippers
mqhtn04,Lazydissident,"Harden is quite possibly the most frustrating athlete in NBA history. Just a Philly fan, drunkenly venting on behalf of the Clipper fateful. This dude has S tier talent and yet always folds in the clutch. Its fucking crazy.",1,1908.0,1746338618.0,LAClippers
mqgxw2i,IncandescentJabroni,hahahahahahaha lol clippers,1,1099.0,1746323888.0,LAClippers
mqgzne9,Gyncs0069,LMAOOOO BUM ASS TEAM ALWAYS HAVE BEEN AND ALWAYS WILL BE ENJOY CANCUN KAWHII NUGGETS OWN LA,-2,5268.0,1746324574.0,LAClippers
mqh3hx9,Just_Double3503,Typical Harden elim game performance lol,0,536.0,1746326138.0,LAClippers
mqgy5ng,Valuable_Agency_1306,Blow up this old & soft team 💣,0,810.0,1746323991.0,LAClippers
mqgy22e,None,[removed],-3,,1746323952.0,LAClippers
mqgyqwu,Rough-Estate-3376,RUSS!,-1,2279.0,1746324222.0,LAClippers
mqh02j4,that_ol_bs,"Can’t believe I’m seeing people overreact to 1 bad game. We’re in a slump, I get it. However to say this team isn’t a championship team is just ridiculous. To everyone who thinks we won’t be playing in June don’t show up for our Finals parade next year then. Good riddance.",-1,12459.0,1746324742.0,LAClippers
mqgxwag,Key-Geologist5370,Not even mad . Rooting for Knicks and rockets  for the rest of the playoffs,0,616.0,1746323890.0,LAClippers
mqgyav1,Nby333,They have 6 NBA players and every one of them had 15+. Quite endearing team. I hope they go all the way.,0,14699.0,1746324049.0,LAClippers
mqgytw0,Available_Sign164,BahahahhajahhahHahahHah,0,119.0,1746324254.0,LAClippers
mqgz0e3,HateMyKnife420,There’s just no fight in this team man. Age definitely pays a part but even earlier in the series they were playing with a lack of urgency that was very concerning. I know Jokic is really great but this depleted ass Nuggets team shouldn’t have been such a problem. Now we can’t even hold it over the lakers that we made it past the first round while OKC swept our tired ass team. Not a lot to look forward to for our team honestly. At least the dodgers are good.,0,86.0,1746324323.0,LAClippers
mqgzwc2,dexter2312421254217,yall should have given the win to the warriors the last day of regular season,0,1439.0,1746324673.0,LAClippers
mqh1980,Canoli5000,"Picked to finish #13 in the West and finished as the 5th seed. 50 wins, it was a good season.  
  
Harden, Kawhi, Norm, and Zu laid down. Either gassed, disinterested, or both. Dunn and Simmons both unplayable. Rest of the guys are whatever. Laid a massive egg.  
  
Next season: They're going to run it back with Harden, Kawhi, and Zu, but get a f\*cking point guard. Stop bullsh\*ting! Can't just be the ""Harden System"" and that's it on offense. Get a younger guard so we can go uptempo when the time calls for it and it also eliminates Harden playing 40 minutes and wearing down. Attach Norm to the 30th pick and move up in the draft. Much love to Norm, hell of a season, but his game doesn't translate to the post season. And yeah I'll say it again. Dumping KPJ and ""star chasing"" names in Ben Simmons was dumb and idiotic but typical of this front office. Mann is a much better post season performer than Bogdan, but whatever.  
  
Play the f\*cking kids. For the love of god cut the bullsh\*t! Kobe was ready to contribute but of course we're supposed to believe in Ben Simmons and that bullsh\*t move. He was unplayable! Since our draft cupboards are nearly empty, see what's up with Kobe Brown, Cam Christie, Trentyn Flowers, Pat Baldwin, and the 1st round pick we have. See if Reed Shepard can be had from Houston since he's riding the pine and they have no minutes for him whatsoever. Nice band-aid transition season, and we have a solid backbone, but start developing. Have some balls for a change and cut the shortcuts out.",0,9082.0,1746325224.0,LAClippers
mqh1vii,asc_12,So who are y'all riding with for the rest of the playoffs? I'm joining Minnesota FC personally,0,10555.0,1746325478.0,LAClippers
mqgxur6,Connor_Catholic,🇷🇸🇷🇸🇷🇸🇷🇸🇷🇸🇷🇸🇷🇸🇷🇸🇷🇸🇷🇸🇷🇸,-6,1452.0,1746323873.0,LAClippers
mqgxztc,z3TRIIKZ,Let’s hope the Kawhi/Harden experiment is over! Get what you can for Kawhi and move on. 6 years of failure is enough,-1,8248.0,1746323927.0,LAClippers
mqhun0v,FlyingBearSquid,OKC in 5 anyway,-1,11973.0,1746339189.0,LAClippers
mqgxx2m,fbeb-Abev7350,"Good series, Clips. Next time tell Steve to stay home.",-3,16226.0,1746323898.0,LAClippers
mqgxt63,Fit_Cycle_2809,I agree,31,204.0,1746323856.0,LAClippers
mqgyrfu,GopherFawkes,"This team is never going to get over the hump if we continue to build around hero ball players. That era is dead, the league has too many good players, the best teams are the ones who play as a team.",53,52778.0,1746324227.0,LAClippers
mqgynhm,MothershipConnection,"We lost this series with game 1 and 4, game 7 was sort of whatever by comparison but honestly… not even a top 10 most Clipperest disappointing finish

We lost with a healthy squad to a team that was pretty evenly matched and got the breaks. It happens!",33,279434.0,1746324184.0,LAClippers
mqgzngp,JMoon33,"> Just a weird season because we weren’t supposed to be here

Where are the Clippers supposed to be? They're all in on this roster. Everyone in the rotation but Zubac is 30+, the team has traded away all their picks, they have no cap space. If they're not winning now when are they supposed to?",14,349347.0,1746324575.0,LAClippers
mqgy1ew,Shoobedowop,that's the definition of Clippers basketball.,10,75335.0,1746323945.0,LAClippers
mqgzvur,ohmeohmy78,"I’ve been a fan for 20+ years, and I feel you… but I think it’s important to acknowledge that losing in heartbreaking fashion in the playoffs over the last 15 years or so, is much more preferred to the pre-Lob City era where there really was no hope for the franchise except for brief flashes (shout out EB and Sam’s team in 05-06)

Yeah it hurts, but that comes with the territory of actually playing for something, which the Clips have found themselves doing more in the Ballmer era. Of course we want more - and fans really do deserve more - but I think it’s still comforting to know we have an owner and organization who will continue to push for real success.",9,131501.0,1746324668.0,LAClippers
mqgyve5,Notreallyhere138,Agreed man……. It’s tough being a Clippers fan,3,3594.0,1746324270.0,LAClippers
mqh1367,Eduardjm,For someone who used to watch Pooh Richardson fight back while we were down 20 🫡 ,3,23347.0,1746325157.0,LAClippers
mqh1m44,sjsharks1912,This comment is too real,3,502.0,1746325371.0,LAClippers
mqgypp9,marvolonewt,"Agreed, there's gonna be a lot of overreactions (some rightfully so), but it was a fun season and we overperformed, especially with luck not being on our side most of the year. At least we no longer have to deal with the stress of watching Clipper basketball",2,28169.0,1746324209.0,LAClippers
mqh5jrq,gtahnyo,"Respect man came a long way from the sports arena but some things just won’t change.

They will though.",2,43757.0,1746326972.0,LAClippers
mqgyplh,Tricky_Structure_504,Pay the man.  Still gonna be clip nation till I die,1,7218.0,1746324207.0,LAClippers
mqgzh0b,New_Kick_7757,"No actually I don’t like that, I like when we’re doing well. It’s better for all of us.",1,1752.0,1746324504.0,LAClippers
mqgzilj,Nonon0name,"Well written! Couldn’t agree more. 

At the end, you can always count on Clippers to disappear one way or another",1,4625.0,1746324521.0,LAClippers
mqgzmif,Effective_Growth_122,Tldr: they just suck,1,45.0,1746324564.0,LAClippers
mqh0zrg,calcmg,"Or if you don't know that, you don't know Clippers' basketball.",1,15685.0,1746325119.0,LAClippers
mqhjyy0,diagoro1,"37 years here, what a ride....",1,26673.0,1746333485.0,LAClippers
mqgy8e3,PM_ME_UR_ANTS,"Were we not supposed to be here? I thought we were supposed to be here for sure, I thought we had a solid squad.",1,14301.0,1746324021.0,LAClippers
mqgy9od,MothershipConnection,At the beginning of the season all I wanted was to make the playoffs and have a honest healthy chance and we got that. Didn’t break our way!,56,279434.0,1746324035.0,LAClippers
mqgzb21,bucketGetter89,"Yeah man, that was such a fun season to watch and have all our guys healthy at the end. Losing is part of the journey and boy did I enjoy it this year. Great fun being part of the race and to feel the ups and downs that come with high pressure basketball. Would way rather get our hopes up and have our hearts crushed than to never even take place at all.

Gives you a total new appreciation for guys like MJ who just seemed to will his team to victory time after time after time, even after an initial retirement.",20,11855.0,1746324440.0,LAClippers
mqh46qb,student_of_theGame,Right. Our expectations changed towards the end of the season because we looked so good. Disappointed to lose but still love this squad.,1,1327.0,1746326415.0,LAClippers
mqhbdxv,Ineedpalmtreeliving,Next season is the real final run for this core. All healthy going in have a strong season to capitalize off,1,4767.0,1746329495.0,LAClippers
mqgy9jb,New_Kick_7757,We balled out tonight,67,1752.0,1746324034.0,LAClippers
mqgymvc,jgroove_LA,I mean I was originally just happy we weren't in the play-in. no one remembers that a month ago right?,17,340479.0,1746324177.0,LAClippers
mqgz8qb,Vantonage,Doomers never lose since they can and always will change the goalpost.,3,744.0,1746324414.0,LAClippers
mqh2can,TheSource777,I ate sooooo many downvotes when I said to trade Mann instead of our first rounders and the consequences of losing pick control. Well guess what we fucked for the rest of this decade 🤣🤣🤣🤣,1,30672.0,1746325668.0,LAClippers
mqgyoqt,keithb2real,I cried a little.,17,122.0,1746324198.0,LAClippers
mqh8uok,SweetLilMonkey,"I rarely do this but I turned the game off with like 7 minutes to go

Maybe that makes me a fake fan but I just couldn't take the pain",9,198726.0,1746328367.0,LAClippers
mqgyfzt,Big_Saens,"Finally, the Clippers don’t get to ruin my day by not showing up to play. I can enjoy basketball without stress, now that our season is over. I’m free",32,29740.0,1746324103.0,LAClippers
mqh938u,SweetLilMonkey,"I'll always have Game 3 of this series, our first playoff game at the Intuit Dome.

I was there and the roar of the crowd was insane. And we whooped their asses even worse than they whooped ours tonight.

I was also at the home opener and that was a lot of fun too, even though we lost. The vibes were immaculate and the venue is beautiful.

Felt very lucky to be a Clippers fan on those two nights.

See y'all back here in a few months",1,198726.0,1746328472.0,LAClippers
mqh7vlx,wusurspaghettipolicy,damn,2,47199.0,1746327945.0,LAClippers
mqh8kzn,SheenEstevezzz,You're the 🐐,2,98955.0,1746328250.0,LAClippers
mqgxx0f,Valkkorr,There it aint,48,9464.0,1746323898.0,LAClippers
mqh0io9,ElBluntDealer,Yea the doomers on this sub suck. I come here only when we win because the doomers are just miserable and don't look at things objectively.,20,70002.0,1746324925.0,LAClippers
mqgy2ko,Key-Geologist5370,Just delete all socials and enjoy b-ball for what it is . It’s much more enjoyable,17,616.0,1746323957.0,LAClippers
mqh1unk,ohmeohmy78,"I get you dude, I definitely decreased my time on the sub over the last few seasons because the doomers can be so loud and bring nothing but negativity.

But I’ll say that there are still a lot of fans here who are true-blue die hards, who provide camaraderie, thoughtful optimism, and at the very least, some funny memes even in defeat. 

If it helps, I’ve found that using the block button does help in clearing the sub’s worse offenders from my view.

Either way, just wanted to say that I’ve appreciated your contributions on the sub and esp on the post-game threads. It was a wild ride this season, and it was a pleasure to interact with like-minded fans like you. Go Clips!",4,131501.0,1746325468.0,LAClippers
mqgz0a3,InTheMorning_Nightss,"Yep. Lots of blame and scapegoating, but the reality is that they outplayed the hell out of us and our age cut up to us.  This sub wants this team to be something it’s not, and the reality is that we’re still in bridge years recuperating from the Shai trade.

Next year is gonna be a similar story at best, and we’re gonna have the same doomers insisting some specific person needs to be benched or Ty needs to be fired is the solution.",3,343283.0,1746324322.0,LAClippers
mqhf80q,APoliticalEgg,there it isnt :(,2,1860.0,1746331239.0,LAClippers
mqhfcd9,heymynameiseric,"The boomers really bum me the fuck out too. Let's remember though, we weren't even supposed to be here. Not even close. 

I know everyone always has their eyes on the prize, and the boomers will crap on what I'm about to say, but this season was a win for me. Loving basketball is loving the journey, and this was a great journey. Only 1/30 teams can win the championship, so it's always going to be a long shot. I'm sure you've enjoyed the ride as I have. I hope to see you get back on the ride next season as well",2,12282.0,1746331295.0,LAClippers
mqgyey7,Goldenredflame,We need you man. But life always comes first.,3,3605.0,1746324092.0,LAClippers
mqgy3na,Nyeteka,13 shots as Dan said and he came to play? The excuses are truly endless for this man,5,4161.0,1746323969.0,LAClippers
mqh1jhr,New_Kick_7757,"I steered away from this page for the majority of this season. Made a difference, fans can be an absolute drag. Looking forward to the changes we make this Summer.",1,1752.0,1746325341.0,LAClippers
mqi51rt,getzumm,"I've suspected for a while now that your ""lol chubby updoot pls"" comments are one of the elements that contributes to the Clippers curse.",1,89612.0,1746345393.0,LAClippers
mqgyzq6,vmpafq,Kawhi was team worst -33,-5,34835.0,1746324316.0,LAClippers
mqgyh3v,youblewwit,"He's older now, playing heavy minutes too",15,134890.0,1746324115.0,LAClippers
mqgy890,Key-Geologist5370,"As a harden fan , I deleted all social media lol . There is going to be so much hate",17,616.0,1746324019.0,LAClippers
mqgy54p,Scoobersteve321,"People gonna hate either way, but he wasn’t the issue today. Shit sucks but it is what it is",17,12116.0,1746323985.0,LAClippers
mqh0ecb,Resshin31,"Harden has done so much for this team, dragged our ass to the playoffs, and helped develop our young guys.  I hope he is back and finishes his career here while we look for more high upside youth to play and be mentored.

Harden will help get us to the playoffs.",7,57931.0,1746324877.0,LAClippers
mqgyr0q,musy101,Harden can be our 3rd or 4th guy and we should still not lose this series lmao,2,42314.0,1746324223.0,LAClippers
mqgyzr4,Nyeteka,"This isn’t the first time he has seen a double in this series. The difference in aggression outside and during late series and Game 7s is palpable. Now he may be tired from having the carry this team but he also has a huge choking problem, should get some sports psychology or some such",1,4161.0,1746324317.0,LAClippers
mqh42tr,r_lul_chef_t,Even though Balmer flew every real Clippers fan to Denver to rEcReAtE tHe WalL?,-5,6068.0,1746326370.0,LAClippers
mqhytuu,Buzzy-Pasta,"Just remind yourself, we could be the bucks",1,17931.0,1746341625.0,LAClippers
mqgzpgg,Clipgang1629,Yeah I suffered my disappointment after game 4. We lost the series last weekend tbh,11,65366.0,1746324596.0,LAClippers
mqh04qx,Clipgang1629,"There is no pulling the plug lmfao. We did that when PG walked. We have no picks until 2030. This is our team for next season, 2026-2027 and 2027-2028 we will have unlimited cap space to work with and we will see who is available. 

The goal is to be competitive until we regain control of our draft capital",14,65366.0,1746324768.0,LAClippers
mqjuia2,CompetitionHot5943,"League is rigged. They favor big teams. 


Playoffs with no Leonard, LeBron, curry, 


/S",1,323.0,1746372999.0,LAClippers
mqh32xj,nickmartxn,Kobe brown 13 piece 🔥🔥,3,27744.0,1746325968.0,LAClippers
