id,author,body,score,comment_karma,created_utc,subreddit
mqgxn13,friendswithbillw,"Been a fan 30+ years and there always been two constants:

Bad luck and being mentally soft.

Bad luck: a perfect tip dunk game winner, the league scheduling an extra game in the regular season.. in Denver..  LA fires happen.. Kawhi misses the game.. lose our tiebreaker with them.. the injuries throughout the years. 

Lack of mental toughness: giving away games 1 and 4, not even showing up game 7, PG missing 2 FTs then the Valley Oop, choking in the bubble and against the Rockets.

Just a weird season because we weren’t supposed to be here, it was a fun season, but it’s still disappointing and sad as hell.

If you don’t like that, you don’t like Clippers Basketball.",324,15337.0,1746323790.0,LAClippers
mqgxp8c,KrabS1,"Not with a bang, but with a whimper. At least we got to see them play healthy.",139,179586.0,1746323814.0,LAClippers
mqgxz85,mvpmvh,Doomers undefeated,77,27295.0,1746323921.0,LAClippers
mqgxp8p,ayeno,This was hard as fuck to watch till the end,68,349256.0,1746323814.0,LAClippers
mqgxo40,buffythebodyy,"At the end of the day, the day gotta end. It's just basketball",99,9338.0,1746323802.0,LAClippers
mqgy1o4,lolwtferic,https://i.imgur.com/neKGHuD.jpeg,33,318500.0,1746323948.0,LAClippers
mqgxsxg,tvztvz,No chubby tonight boys. Sucks to go out like that but I’m proud of the season and we looked really promising at points this season. No one came to play tonight except Kawhi. Idk if I’ll come back to the sub much next season. The doomers bum me the fuck out.,127,75707.0,1746323854.0,LAClippers
mqgxmoo,MrMcPhee3,Fuck,29,3203.0,1746323786.0,LAClippers
mqgxvl9,_lxviiii,clips gang or don't bang til the day i die,29,67127.0,1746323882.0,LAClippers
mqgxnb1,notzekypoo,CLIPPERS IN 9,48,25182.0,1746323793.0,LAClippers
mqgxsww,marvolonewt,"You can blame Harden all you want, but in reality, there's just no way he was going to score easily with the double-teams they were throwing at him. That's kinda why he had 13 assists on pass-outs. And we lost the game in the 2nd quarter when there was no one to playmake.

Denver made adjustments on defense, while ours fell apart.",76,28169.0,1746323854.0,LAClippers
mqgyhym,trizzo0309,At least Kawhi was healthy!,17,49399.0,1746324124.0,LAClippers
mqgxwnv,MothershipConnection,Bad last game but I will still have fond memories of this season. Thank you squad!,17,279434.0,1746323894.0,LAClippers
mqgyfbs,InTheMorning_Nightss,"Gonna be a lots of hindsight about a bunch of things, but ultimately nobody on our team showed up. Really simple.

Can blame Ty, but he wasn’t out there turning it over. Can blame Harden, but you still need guys making shots he sets up. Can blame Norm, but why are Kawhi and Harden deferring to him.

Hard to see now, but this season we ultimately still exceeded expectations. Sucks to go out this way, but our run was eventually going to end with our age and sloppiness.",17,343283.0,1746324096.0,LAClippers
mqgzw6s,Retrofusion11,Denver really has the best home court advantage with that altitude ,17,6114.0,1746324672.0,LAClippers
mqgxsdq,Valkkorr,"Pathetic way to end it. I'm not even mad, I got all my emotions out during the 3rd.",40,9464.0,1746323848.0,LAClippers
mqgyc1g,DreTheGreat2122,I'm glad I missed every minute of this atrocity,13,246.0,1746324061.0,LAClippers
mqgyqp5,ico232,"I had fun this season. This was probably my favourite team since 20/21. The series ended when we lost home court on a 1 in 1 gazillion tip, but we move. Se yall next year 👋",13,1813.0,1746324220.0,LAClippers
mqgxmf6,dolphin712,Damn.,10,245.0,1746323784.0,LAClippers
mqgzk6g,Vantonage,The moment I saw Norm bring up in the ball in the 1st quarter while Harden was in the corner I knew we were getting the low fga Harden game 💀,11,744.0,1746324538.0,LAClippers
mqgxn29,yung999_,Disappointment is all I can say,20,24127.0,1746323791.0,LAClippers
mqgy8py,Tricky_Structure_504,Terrible ending but I had a blast watching them this year.  See you next year kids,6,7218.0,1746324024.0,LAClippers
mqgye14,Nby333,"Nuggets MVP: Russ

Clippers MVP: Kobe",8,14699.0,1746324082.0,LAClippers
mqgxz7c,ForeverDenGal,"It’s time. 

Time to finally pull the plug on this era and start a new one. Goal is to win a title not be a playoff team. This needs to be it.",20,19624.0,1746323921.0,LAClippers
mqgy736,kimberlyfreecash,Both LA teams out in the first round wow,8,2374.0,1746324007.0,LAClippers
mqgydna,inmyhumbleo,"https://preview.redd.it/un929aa2aoye1.jpeg?width=1320&format=pjpg&auto=webp&s=430c0adf6c984997bc79f45d22bc79d6fefe3e87

Look at this shit.",7,16721.0,1746324078.0,LAClippers
mqh2zrv,ISLYINP,WTF HARDEN AND POWELL? You let us DOWN,7,1672.0,1746325931.0,LAClippers
mqgybhg,Efficient-Round-9493,"8 shots for Harden in a Game 7, forget the 13 assists that’s criminal. We literally saw you go off for 28 points in Game 6 which opened up the offense for the whole team but he went into his shell AGAIN.

Powell was awful this series apart from Game 6, can’t dribble to save his life and turns the ball over far too often, usually in fast break opportunities for Denver.",12,1291.0,1746324055.0,LAClippers
mqh0lhq,jadcntrs,"Just want to shoutout u/lolwtferic and u/tvztvz 

thank you for the service and see you nxt season. ride or die clip gang",14,28508.0,1746324957.0,LAClippers
mqgy8ki,Blachawk4,"Best player only had 13 FGA in a game 7 and the first attempt came almost 5 min into the game 🧐

Wonder what the game plan was",5,28649.0,1746324023.0,LAClippers
mqgz1jp,Throwaway4PervyShit,At least we get an answer to “what if Kawhi was healthy for a playoff run?”,7,26722.0,1746324336.0,LAClippers
mqgz7xo,Aracion1,It’s been a great season boys🫡,5,1601.0,1746324406.0,LAClippers
mqh070m,Greedy_Ear_Mike,"Our team needs a culture change. It's the same shit every year. This team is always lacking energy and urgency. Why is that? 

What a soft, pathetic way to go out. What happened after halftime was pathetic.

I assume Ty sets the culture. 

James and Kawhi are not vocal leaders.

Seems like Harden is never gonna beat the big game choke allegations. 

Like, overall, it was a fun season.

But this team as it's current culture stands, we ain't gonna win shit in the playoffs I think.

Maybe next year with a full year of Kawhi, we can get homecourt, so we don't have to be in this situation again on the road 

Will be an interesting off-season.

At least everybody is healthy I guess, hehe.

Congrats to the Nuggets. Great series. Y'all fucked us up in this here game 7, lol.

I hope to fly back home for some games next season at the Dome.",6,12778.0,1746324794.0,LAClippers
mqh2e3v,Avocado_6,Harden choking in the game of the year is a lock at this point,7,1970.0,1746325688.0,LAClippers
mqgy6q1,MetalGearSolid108,Soft ass team smfh. Can't even blame Ty Lue. This team played with no effort until the young guns came in. Pathetic showing.,15,6231.0,1746324003.0,LAClippers
mqgxtps,zggystardust71,"Well f&ck. 

So many mistakes on both sides of the ball. Too many to count. 

Another year my betting slips go in the trash, sigh.",4,51892.0,1746323862.0,LAClippers
mqgyjh3,smoothsoul23,What a whimper of a way to finish a fun season.😟,5,34521.0,1746324140.0,LAClippers
mqh27v8,a11_day_everyday,We will never win a chip with Ty Lue coaching this team.,6,2758.0,1746325618.0,LAClippers
mqh559b,teokun123,Poor Harden got gassed. Ty shouldn't have played him on defense.,4,69810.0,1746326809.0,LAClippers
mqhglpu,aginglifter,Is Lue overrated? I am beginning to think he might be another Doc.,7,22539.0,1746331884.0,LAClippers
mqgxyxt,HoodieFrank,I blame this loss on PG13,3,3445.0,1746323918.0,LAClippers
mqgyc9y,DCoop53,"Thanks for the exciting series and no thanks for giving up on this game so early. Stay safe Clips Nation, happy offseason to y'all, this summer could be exciting actually. If whoever our FO is wanna go chase Giannis, feel free to send whoever you want in the trade.",5,25142.0,1746324063.0,LAClippers
mqgyp48,Neto34,Game was lost in beginning of second quarter. 7-0 run by nuggets with joker on the bench.,5,80549.0,1746324202.0,LAClippers
mqgyp8l,Niceguydan8,"-Harden's scoring was terrible.  His facilitating was great and the Nuggets were selling out on Harden early on. He was making the right decision a lot of the time despite his horrific scoring.

-That portion early in the 2nd when Dunn subbed in for Harden for ~2-3 mins was a fucking *disaster.*

-I think Kawhi as a first option guy is pretty much done.  Not assertive enough in most of these games, including this one. He's been good overall in the series, and definitely efficient.  But I think his volume is too low offensively for a non-facilitating offensive star.

-The bad shooting role players were generally awful in this game and this series.  Norm is a good shooter, but he falls in here too.  He was atrocious most of the series and I think probably the largest contributor to actually losing the series with how much he underperformed.

Overall though, really fun season! Definitely exceeded expectations. Not really worth dooming over, they lost to a better team(DEN's role players were *substantially* better than LACs throughout the series) and realistically both of these teams would get fucking dogwalked by OKC.",3,483300.0,1746324203.0,LAClippers
mqgyx1t,Justafanofnbadrama,I'll still be first in line next season lol love you all,3,14649.0,1746324288.0,LAClippers
mqgz938,h1gad,"Loved the fight from the bench warmers.  But this was over in the third when the Clips didn't come out with energy.

Good season.  Thank you Clips for going further than most expected. 

Ngl, if they even won this game, I had some doubts that a gassed Clipper team had anything left in the tank against a young, talented thunder squad.

Congrats to the jokic, the nugs and their rookie interim coach who outhustled the Clips almost every game.

Clippers missing some heart and grit at times out there which made me miss the gunshy TMann. 

It's a different off-season when everyone thankfully ends it relatively healthy, so we still have a lot to look forward to.

CLIP GANG OR DON'T BANG!",4,3291.0,1746324418.0,LAClippers
mqgziz6,rooooob,"Fun season, the only thing I would change for the upcoming one is ty lue… he has to go. We need a coach that trusts youngsters and have a mix of them and experienced, cant rely in old anymore.",5,8833.0,1746324525.0,LAClippers
mqhaa3k,rychun22,We need to get younger fam and play like a unit. Harden not boxing out because he superstar don’t cut it. Throwing away lazy passes. Zubac throwing up his hands because there was a defensive miscue. Man it was tough to watch and hoping that ballmer can bring in some unproven talent.,3,137.0,1746328996.0,LAClippers
mqhexoi,Prosado22,"The problem with Harden not being aggressive is that he initiates the offense. His hesitancy affects the rest of the team's offense. 

Also, that lineup that Lue put at the start of the second quarter did not make any sense. He knew that Dunn was not being effective. He stopped bothering Murray, and he missed so easy shots that really hurt the team. 

  
Finally, Powell was awful.",4,13541.0,1746331106.0,LAClippers
mqgyrh2,Awkwardphase06,"The coach outcoached by a 10 game rookie head coach. lue will be gone, powell is not a playoff performer he needs to be traded, hopefully for a 3 & D player.",10,20315.0,1746324228.0,LAClippers
mqgxmdx,None,[deleted],20,,1746323783.0,LAClippers
mqgxwlc,TechnoGauss,Obviously not the ending we wanted. Yes there were a lot of negatives in this series but I'm counting the fact we even made it this far as a win. Hoping we make some moves this off season to put is in a better spot next year,7,31642.0,1746323893.0,LAClippers
mqgynbp,Efficient-Round-9493,"Ty Lue needs to be fired tonight, Ballmer has to show he has his finger on the pulse because a rookie coach essentially outcoached him in this series and had his team better prepared.",5,1291.0,1746324182.0,LAClippers
mqgybyr,zggystardust71,We lost games 1 & 4 that we should have won. That put us in a game 7 on the road and we got our ass kicked. Completely unacceptable.,6,51892.0,1746324060.0,LAClippers
mqgxwbt,MetalItchy2099,Enjoyed the season. Sad ending. I thought we came out with the right intent but I think our older guys were running on empty especially harden,3,13214.0,1746323890.0,LAClippers
mqgy2i0,CP3_for_MvP,"Another 3rd quarter disaster in an elimination game. 

Every. Fucking. Year. 

Always the 3rd quarter.",3,192288.0,1746323956.0,LAClippers
mqgy5iz,Halfgridd,Did chuck guarantee this?,3,3315.0,1746323990.0,LAClippers
mqgy673,im_not_witty_,That was just a dog shit performance by our entire fucking roster besides kawhi. Every single player shrunk under pressure and just looked stunned the entire game. ,3,27561.0,1746323997.0,LAClippers
mqgy6rw,Function_Fighter,No energy after first quarter. no sense of urgency. no blitz or anything out of the ordinary. just playing through the motions. everyone ball watching and harden stopped attacking the rim. absolutely no chance of winning that one.,3,22638.0,1746324004.0,LAClippers
mqgz413,unc2ous,going to be an interesting offseason to say the least,3,12163.0,1746324363.0,LAClippers
mqgz62q,OverallInternet2343,end of the Kawhi era,3,58844.0,1746324385.0,LAClippers
mqgzq82,Skullastic,I’m still just sitting here like “damn”. Such a tough loss to end our season.,3,2081.0,1746324605.0,LAClippers
mqh04ef,TigerKlaw,I'm glad I didn't watch this game and only woke up halfway through the 3rd so I knew not to bother.,3,159546.0,1746324764.0,LAClippers
mqh0bn9,pbaagui1,"All in all, fun season. See y'all next season. GO CLIPS",3,70014.0,1746324847.0,LAClippers
mqh0fya,tkfire,Pushed it to the limit. Time to blow it up?,3,79817.0,1746324895.0,LAClippers
mqh19qr,Tony_sneakerhead,Was nice to finally see Kawhi healthy.,3,4597.0,1746325229.0,LAClippers
mqh2dmi,BigUnkLilUnk,Build around Zu!,3,372.0,1746325683.0,LAClippers
mqh83q3,One_Dependent7612,"what's disappointing is how predictable the outcome was, especially not starting batum.  No rebounds, stupid passes, settling for threes and missing easy layup. Just sad. Ballmer needs to make a change at head coach immediately. Unacceptably laughable.",3,917.0,1746328043.0,LAClippers
mqh84ki,it_846,Thank you all for a great season.,3,376.0,1746328053.0,LAClippers
mqh9mgs,phoenixsuperman,7 points. uno en route to the pasture. let's trade for a good guard and try next year.,3,76240.0,1746328707.0,LAClippers
mqi1aj3,Salty_Watermelon,"The first quarter was good.


I think this team is done.  Even though we don't have any incentive to blow it up and tank, how can the same coaches and players realistically give 100% next year?  They already know that they're a first round exit, even with a clean bill of health + a ton of positive momentum at the end of the regular season.  To be a great team you first have to believe that you can be great.




And if we do run it back without any major moves, I think next year's team will be what everyone predicted this year's team would be.",3,237686.0,1746343103.0,LAClippers
mqkae2y,Dramatic-Ad-2008,"I am Nuggets fan, but I think that people realise how good this Clipper team is. I see people now saying, how OKC will get gentlemans sweep of Nuggets. Truth is, Clipps are great team, and will be evident in the OKC Nuggets series.

I think Harden for 35m is great contract. But he can not be expected to be sole playmaker, at his age. Clipps still have cap flexibility, i would refrain from blowing this up. Just find secondary playmaker, maybe even Bogi can be that, given more time with team.",3,19.0,1746377897.0,LAClippers
mqgxtuc,None,[deleted],13,,1746323863.0,LAClippers
mqgy6d7,ShadowAgent41,"James harden is not beating these allegations. 

7 points on game 7",3,76659.0,1746323999.0,LAClippers
mqgy8kn,Renegadeforever2024,What a bittersweet end to a mostly successful season,5,217488.0,1746324023.0,LAClippers
mqgymuo,ThaEternalLearner,"The Clippers’ age got them at the end. Not enough energy and juice to close the series. The bench wasn’t as good as we thought they would be. Bogi was disappointing this series and he seemed to only score when the games were out of reach in Game 5 & Game 7.

Dunn and Simmons both became unplayable. Harden faded at the end of the series. Norm underperformed for the second Playoffs in a row. DJJ had a decent series but his 3pt shot was non-existent and hurt the offense.

Kawhi, Zu, & Batum were the most consistent in their roles this series. But ultimately, the team just wasn’t good enough. Time to blow it up and rebuild.",4,35206.0,1746324177.0,LAClippers
mqgy3kh,One_Dependent7612,Leave ty on the tarmac,7,917.0,1746323968.0,LAClippers
mqgy0fk,madsharps,"Which one of our guys is gonna come out limping saying they sprained their ankle and wouldn't have been able to play the second round anyway?  
Answer: None.  We're not those kinda bitches.",4,5675.0,1746323934.0,LAClippers
mqh5wk9,Last-Maintenance-164,Brian Shaw would have won this series.. I am sorry to harp on this,4,243.0,1746327115.0,LAClippers
mqgy1dd,TZauch18,"Hopefully that's the last we see of Ty Lue and Norman Powell. Another year where the Clippers go out sad as hell.

What makes it so much worse is that the Clippers could have won this series. The threw away entire games. The players are certainly at fault, but a coach should not allow that to happen.

Edit:

I'll say a bit more about the season. Everyone had low expectations for this team and the season they had was otherwise really special. March and April were exciting. It's a likable group, but it's also the same woes that have plagued this team for years.",6,10338.0,1746323944.0,LAClippers
mqgys7v,eagleeyes55555,"Without norm, zu, and harden, we wouldn't have made it in the playoffs.  Harden played his heart out during the reg season with all those 40 min+ games. We over achieved this season.",5,303.0,1746324236.0,LAClippers
mqgy4zk,Shoobedowop,Good news! So many free evenings this upcoming week!,2,75335.0,1746323984.0,LAClippers
mqgy87j,GOONER-ONE,"Welp, I'd like the team we had this season, sad it had to end this way. Lots of blame to go around, hopefully we come back better next season. The team needs some discipline. Make em run suicides. Send me to marine boot camp. Whatever. They need hustle. ",2,1171.0,1746324019.0,LAClippers
mqgyiyx,jgroove_LA,"the best home court advantage the Clips have had in the Kawhi era was the first 213 year in the bubble when we were the no. 2 seed. we were 4th and healthy when we made it to the WCF. this year, despite a fantastic end to the season and 50 wins, we got unlucky getting the 5th seed with 3 teams each winning 50 games. the front office has to find a way to upgrade our talent to get us better homecourt for the. playoffs. if not, it may not matter how healthy Kawhi is or not. and in the West? it may not matter anyway. it may always be the luck of the draw if you can't get a top 2-3 seed.",2,340479.0,1746324135.0,LAClippers
mqgyo0i,BlueCrayolaMarker,They gotta accept fate and start the rebuild. End this purgatory.,2,2391.0,1746324190.0,LAClippers
mqgzn7w,SaltyPopsicle117,"Stopped watching after the first few minutes of the second half when we allowed wide open 3s and forgot how to dribble. I think it's time to admit that this version of Kawhi, although still All-NBA level player, is not good enough to lead a team to the Chip anymore. 

If I was GM, I seriously consider trading Kawhi, Harden, and Norm for as many 1st round picks as possible.",2,1519.0,1746324572.0,LAClippers
mqgzvqe,SchmittyGang,This team will never change lmao,2,1889.0,1746324666.0,LAClippers
mqh07m6,Netero_29,"Decent season but I’m so disappointed. I’ve been a Harden fan forever and seeing him flame out like this year after year hurts so much man. I really wanted the clippers to win, but I guess they just didn’t want it as much.",2,1156.0,1746324801.0,LAClippers
mqh0xqi,Function_Fighter,There's people in the gym that play with more heart than this team. lmfao,2,22638.0,1746325096.0,LAClippers
mqh1086,Nukes8,"Trade everyone. I know it is not that simple, but please, I swear no player on this team can close on defense. We do not have young guys or anyone who can go off on any random night. We are mediocre at best and a laughing stock at worst. We just dropped a game 7 we needed to win and no one can elevate this team to a championship. We need to Trade and no one is off the table. Harden, Kawhi, Powell, Zubac, Jones, Bogdanović, Batum, Dunn, Coffey, Eubanks, Simmons, it crazy to say but you have to rebrand. We need a fresh start. The only way to do that is to rebuild. We can could even splash for a big superstar this off-season, and we need to be the first one to sign to be in contact with free agents if and when that superstar comes. But I'm delusional, This is not going to happen.",2,286.0,1746325124.0,LAClippers
mqh8ywh,ForThreeAndItsGood,"On the upside, Kobe Brown looks good.",2,2083.0,1746328419.0,LAClippers
mqhfw00,JackHughman69,"Sad to think if they would have had better defensive players in during the end of Game 4, they might have went up 3-1. The curse of the Clips may have kicked in anyways but I’d like to think it would have made them all more confident and the 4th win would have been slightly easier and more doable.

I wanna see Kawhi win another for his sake, I wanted Harden to get his ring, and it was all clicking so perfectly at certain stretches during this season. 

But I guess we all just gotta be happy that they outperformed expectations, still kept it competitive with Kawhi out most of the season, and made this series probably the most entertaining of all the first round series. 

This Clips roster is good but they need to inject a bit of youth somewhere and I’ll say this a million times over- they NEED a true PF. A big athletic younger guy who can crash the boards, shoot decent from 3, make proper passes, and switch when needed.",2,44581.0,1746331552.0,LAClippers
mqhx93s,RUSInteriorDecorator,Clips are mentally weak and have no good young players. The nuggets are mentally tough and have at least one young guy they can play with legs. They are bad at drafting but no where near as bad as the clippers,2,2123.0,1746340706.0,LAClippers
mqhzqpb,crittypor,Glad I watched Game 6 live at home,2,107.0,1746342165.0,LAClippers
mqj18wa,gansobomb99,"I've been a Clips fan since the start of Lob City and I AM SO TIRED 😂😂😂 it's always something


F*cking 0.001 second dunk by Gordon 😂☠️",2,34437.0,1746363099.0,LAClippers
mqjulxp,goli14,I still cannot believe Lue didn’t call TO when Nuggets were rolling them over. Still haven’t heard why those TO were not used.,2,22943.0,1746373030.0,LAClippers
mqjunor,CompetitionHot5943,People will blaim harden. But I think Powell no show is what destroyed the clippers. He was a non factor every game. ,2,323.0,1746373045.0,LAClippers
mqgxq5n,Shoobedowop,Kawhi smiling with Russ after the buzzer says it all.,7,75335.0,1746323824.0,LAClippers
mqgy4or,WadeCountyClutch,Ty Lue needs to go. This Nugget team was injured and had a thing roster. No excuse. Careless basketball,3,118534.0,1746323980.0,LAClippers
mqgy4xz,Putrid-Impact8999,"A shocking performance overall.  James Harden is a great player but he's best in a Manu Ginobili sixth man role in my opinion in the playoffs.  Norman Powell and Ivica Zubac were not good enough.  Kawhi Leonard did his best but basketball is a team game, look at how many guys got into double figures for them.",3,48115.0,1746323983.0,LAClippers
mqh1qoz,BackendSpecialist,"Why did Lue start DJJ and give him such a long leash? He played like trash offensively.. he took so many shots

Seeing how Lue handled this vs Ime benching Brook shows the difference between great and good coaches.",4,111100.0,1746325424.0,LAClippers
mqhrtp9,CapGun7,James Harden with his signature playoff disappearance act!,3,14524.0,1746337600.0,LAClippers
mqh2qz5,Imperatum15,"Soft mentality starts with Ty Lue. Took way too long to start Batum and give him significant minutes. Stagnant ISO ball. Giving Bogi, Dunn, and Harden way too much minutes. End of the Kawhi era. Ty Lue has to go. Get some young blood in this team. Balmer has the pockets to add a young superstar later on.",3,60812.0,1746325835.0,LAClippers
mqgy2z7,garbink,What a terrible way for such a great series to end. Our starters and coach quit in the 3rd quarter,2,32026.0,1746323961.0,LAClippers
mqgynbh,JaiKB,I think at the end of the day the league as a whole is just shifting to a younger superstar generation. Kawhi isn’t his 2019 self anymore. Harden isn’t his MVP self anymore. I appreciate everything they did for this team this year but before this year we always wondered “if Kawhi was healthy what could it be” and now we have the answer. It’s time to move on. I love this team. I love Intuit. I love Balmer. We can win but change has to happen. Great season for what it’s worth and let’s see what the offseason brings. Clipper Nation for life ✌️,2,2916.0,1746324182.0,LAClippers
mqh25c3,dikroundtree,Can't give up 2 games. Aaron Gordon can't win a game on a dunk and you can't let Russel Westbrook take you to OT. But it happened because of a lack of effort from an aging team. Now is the time to sell on Norm and get a PF.,2,159.0,1746325589.0,LAClippers
mqh4dxk,HalaMadridCrO,"Problem for me is effort, bro give it your all like it’s do or die. Mentality is not there, the group of players will not win a championship. Changes need to happen. Kawhi and Harden aren’t getting any younger. Hope Zu continues to get better. He needs to work on being aggressive and being a bully.",2,760.0,1746326498.0,LAClippers
