id,author,body,score,comment_karma,created_utc,subreddit
mq7rq7k,NotSerbian,"Sad that he’s no longer head coach, but happy he’s still going to be with the organization.",790,11372.0,1746201030.0,NBASpurs
mq7rrtg,GorillaEstefan,I’m gonna need some time. 😔,244,13545.0,1746201043.0,NBASpurs
mq7s0se,Conn3er,Thanks for the ride Goat,143,175663.0,1746201113.0,NBASpurs
mq7s0c5,murkymurk94,It was inevitable but still hurts… a lot.,164,5842.0,1746201109.0,NBASpurs
mq7rzu4,TimDunkinDonut,Fuck. Knew this was probably the most likely outcome but still sad he won't get one last game as a send off. Hope our first game next year just goes all out honoring him,161,108424.0,1746201105.0,NBASpurs
mq7rsre,CommodoreIrish,Fade me,51,183002.0,1746201049.0,NBASpurs
mq7ru6i,Stratys,"Very happy he's still gonna be around, but this still hurts so much 😞",47,152701.0,1746201061.0,NBASpurs
mq7s1la,The_Littlest_Bark,Knew it was gonna happen but was in denial. Glad he’s going to stick around but I’m gonna miss him on the sidelines. This and Duncan retirement hurt.,91,12638.0,1746201119.0,NBASpurs
mq7sqkf,Every-Cucumber5758,"As a laker fan, this man is the goat coach. And yes better than Phil Jackson and red Auerbach.",86,129.0,1746201314.0,NBASpurs
mq7rytm,TruTexan,Fuck… that really sucks to hear but glad he’s gonna stick around the org. It’ll be better with his health too,34,59784.0,1746201098.0,NBASpurs
mq7s0gb,hacxgames,"whoever becomes the next head coach will have some really big shoes to fill, good to know pop will still have a big role in choosing who that may be",28,45842.0,1746201110.0,NBASpurs
mq7sng4,BBQLovingBastard,I’m gonna have to fire up the grill tonight,30,13468.0,1746201290.0,NBASpurs
mq7ybl2,KipTDog,"I’m a Lakers fan, but wanted to express my sadness for the Spurs community and tremendous appreciation for this man. He didn’t die, so I don’t want to sound like this is a eulogy, but his integrity, excellence, and voice will be badly missed in the NBA. Anyone who claims to have been a fan of the NBA through the early 2000s till today, and doesn’t have immense respect and appreciation for Pop, needs to have themselves checked.

You guys had one of the truly special ones for many years, and I know you all are very proud and appreciative. I hope whatever he does now brings him enjoyment.",28,7661.0,1746202902.0,NBASpurs
mq7s3b9,Arkin47,"damn shame he couldn't coach one last game :(

Stay safe pop",20,10419.0,1746201132.0,NBASpurs
mq7ssn7,RedRumRick,"Hold on brother, I’m crying 😭",23,12726.0,1746201330.0,NBASpurs
mq7si2u,Severe-Rope-3026,"pop has been the coach of the spurs since i was a small child


im chris pauls age


this is...",53,81230.0,1746201248.0,NBASpurs
mq7t4ev,huhrod,I know coaches don't have numbers to retire but they should retire a number for pop anyways,16,4833.0,1746201421.0,NBASpurs
mq7sddn,HisHilariousness,GOATovich,16,8639.0,1746201211.0,NBASpurs
mq7sdlr,ojasc,![gif](giphy|ePbtplyRUqBCdKwd43|downsized),28,288.0,1746201213.0,NBASpurs
mq7s242,mallllls,Tragic :( but good for his health,10,20829.0,1746201123.0,NBASpurs
mq7si6v,Electrical_Net_6691,Thank you for all you’ve done coach pop 😭 literally the goat of coach’s. Ima need some time to recover lol,9,12043.0,1746201249.0,NBASpurs
mq7ssk0,CRoseCrizzle,"I had a feeling this would happen. Still sad to hear. Obviously, I appreciate the 20+ years of him as HC, all the memories, and ofc the the championships. He's a great man and a great coach. I'm glad that he's still with the organization and hopefully will be involved in selecting his succesor.",10,607408.0,1746201329.0,NBASpurs
mq7s275,Bushbugger,End of an era for one of the greatest minds in the game.,8,58082.0,1746201124.0,NBASpurs
mq7szgl,ffadicted,"The fucking GOAT.  Happy for him, I think it was the right decision for his health and well being.  Awesome that he's sticking with the team in some fashion though.

You're a legend Pop, thanks for everything",8,10626.0,1746201382.0,NBASpurs
mq7t6dw,RedRumRick,"Thanks for everything, GOAT :(",8,12726.0,1746201437.0,NBASpurs
mq7s6q0,Specific-Lion-9087,"Thanks for everything, Pop.

That said, Mike Malone announcement by Monday, bet 10.",32,32663.0,1746201158.0,NBASpurs
mq7tao6,sapristille,I mean it's not a surprise but I'm still 100% in denial and probably will be for a good while.,7,26478.0,1746201470.0,NBASpurs
mq7sjbt,Sob_Rock,Damn end of an era,6,117769.0,1746201258.0,NBASpurs
mq7tah7,dominicdotg,i’m unwell,6,6838.0,1746201469.0,NBASpurs
mq7tp9e,MapWorking6973,"I hope he comes down from the box once a game just to randomly yell at somebody, just for nostalgia. Bonus points if it’s Danny Green or TP",5,10947.0,1746201585.0,NBASpurs
mq7tcll,Christop_McC,The greatest coach of all time and they only coach my team has had in my lifetime. Pretty cool to make it to 22 and only know one coach. Stay healthy pop lead the team from up top.,5,85697.0,1746201486.0,NBASpurs
mq7teld,nicklessflo,GOAT. Much love to Pop. Spurs legend.,4,11280.0,1746201501.0,NBASpurs
mq7tfwd,joshharris12,Only coach I ever knew. Hopefully we make a great hire for another 25 year run.,5,11869.0,1746201512.0,NBASpurs
mq7th78,OldArmyMetal,It’s time for Bob Hill to awaken from his slumber and guide us in our hour of need like Barbarossa.,4,119457.0,1746201522.0,NBASpurs
mq7toox,Dan_K211,"He needs to coach one more home game, get T'd up, then call it a coaching career.",5,2316.0,1746201581.0,NBASpurs
mq7xxtg,kingbradley1297,"Damn. The last connection to the good old dynasty of our team has stepped down.


We're now well and truly in a new era. Can only say thank you to one of the greatest coaches the game has seen. It wouldn't have been easy for him at his age turning up and being motivated but he did it till the end.


With that said, I'm gonna go cry in the bathroom. Peace out ",4,117135.0,1746202794.0,NBASpurs
mq7sjx4,baulboodban,the GOAT. gonna miss seeing him on the sideline,3,23753.0,1746201263.0,NBASpurs
mq7slye,serdna1234,Heart breaking. I hate the way it all happened for him. Happy he's still part of the org.,4,11381.0,1746201278.0,NBASpurs
mq7t1gv,FireBeeChin,fuck….,5,24861.0,1746201398.0,NBASpurs
mq7t4ud,aeamador521,Hurts right in the heart,5,2726.0,1746201425.0,NBASpurs
mq7t9cd,-imhe-,"29 seasons as head coach, right? Amazing guy, amazing career. Glad he'll still be around, but super sad we won't be seeing him on the court.",3,14342.0,1746201460.0,NBASpurs
mq7tmuk,SkunkyBottle,I can’t lie. I’m a bit teary-eyed right now. He’s been the coach of the Spurs for almost the whole time I’ve been a fan of this team.,3,6180.0,1746201566.0,NBASpurs
mq7toy0,obxsguy,this man has been coaching the team longer than i''ve been alive. i'm 27 LOL. feels unreal he wont be our HC anymore but with his health issues i'm glad he's taking a step back. it's a very stressful job,4,45420.0,1746201582.0,NBASpurs
mq7tr6n,DismalComparison2625,"So sad.

Pop is an icon. Knew it was coming but wanted another year with a healthy Wemby and squad.

Man this sucks.",4,1589.0,1746201600.0,NBASpurs
mq7tri3,fattest-fatwa,I’ll just be in here with my feelings.,4,14397.0,1746201602.0,NBASpurs
mq7u3sn,diamondhorizons,"Thank you for everything, Pop. Hope we get to send him off at the first home game next season.",5,2506.0,1746201698.0,NBASpurs
mq7u50p,NerkoFC,Thanks for everything and I’m glad he will still be involved with the organization. THE GOAT,4,3308.0,1746201709.0,NBASpurs
mq7usi5,offmycookies,"I’ve enjoyed the last 28 years king, now is time to rest. You are more than loved by many.",5,31147.0,1746201898.0,NBASpurs
mq7uuj0,munchonsomegrindage,I've been dreading this day but it's good to have the uncertainty behind us. I trust PATFO to make the right decision moving forward.,4,5431.0,1746201915.0,NBASpurs
mq7wx9l,oceanfloors1,Didn't think I was going to cry at work today but here we are.,3,30945.0,1746202505.0,NBASpurs
mq7x7zz,Primarycolors1,I hope he can finally relax a little.  He gave us all we could have dreamed of and more.,4,38152.0,1746202592.0,NBASpurs
mq9wcs9,Frendlin,I really believe pop made San Antonio a better place. Like a Pro sports coach affected a city that positively I really do. ,4,850.0,1746223596.0,NBASpurs
mq7sk7i,No_Amoeba_9272,This is the best case scenario.  Way to go Pop,3,19266.0,1746201265.0,NBASpurs
mq7smk8,duvaLavud,😢,3,1547.0,1746201283.0,NBASpurs
mq7sqov,NittanyScout,"🫡 saw this comming tbh, I think its good pop is focused on winding down and preserving his health. Having him still involved in team ops is huge though.

Thank you so much for a legendary career pop!!",3,353051.0,1746201315.0,NBASpurs
mq7t55r,Dswy512,I just wanted one more game….at least so the fans could shower him with the love he deserves. I wanted some nasty….😔😢,3,577.0,1746201427.0,NBASpurs
mq7t59u,evxnreps,Sad but what’s best for him. Atleast he’ll still be involved in the organization,3,36.0,1746201428.0,NBASpurs
mq7t770,oedipascourage,And the Popovich era has ended. The greatest coach in the NBA history.,3,7966.0,1746201443.0,NBASpurs
mq7t9qx,joelamosobadiah,"So glad to see the announcement includes him being a part of the team in an official capacity right away.

Thanks for everything Pop!",3,13880.0,1746201463.0,NBASpurs
mq7tbow,FireBeeChin,Greatest of all time. Been the coach before I was born. Don’t even know how to feel besides depressed and grateful,3,24861.0,1746201479.0,NBASpurs
mq7tbpg,aggie2012,"I’m glad to have some clarity so that I can properly grieve his wonderful tenure as HC of the Spurs. What a tremendous legacy of athletic, community, and humanitarian excellence. Thanks for the coaching memories, and onward to the exciting next chapter. 🖤🩶",3,1489.0,1746201479.0,NBASpurs
mq7tkpr,Dere-Lick-My-Balls,"End of an era. I hope we get the chance to say goodbye. Love you, Pop! Thank you doesn’t begin to describe how much we appreciate you.",3,317.0,1746201550.0,NBASpurs
mq7tkvy,DunkinEgg,"Thanks for everything, Pop. Glad you’re still going to be with the franchise. May have to crack open a bottle of wine this evening.",3,141111.0,1746201551.0,NBASpurs
mq7tmxx,Chillinthamost,Can't say this is surprising news but hearing it officially has me in my feelings. Thanks for everything Pop! San Antonio loves you!,3,29008.0,1746201567.0,NBASpurs
mq7toq4,Joethetoolguy,"I think we all knew, but this still hits hard…",3,17273.0,1746201581.0,NBASpurs
mq7tr2r,sp000ners,"The GOAT stepping down, never thought I'd see the day...

I'll never forget that game to get the All Time Wins record, one of my favorite games in recent memory",3,7448.0,1746201599.0,NBASpurs
mq7tv7d,msc49,"I really hope we get a formal retirement event like we had with Manu, TP and Timmy.  Would love to see all his old players come back for it.  Turbout would be insane.",3,23334.0,1746201631.0,NBASpurs
mq7u11v,Gorrrn,"Lotta happy memories of this guy, been the coach since I was like 4. There’s not gonna be another one like him, sad to see him leave the bench but it’s for the best.",3,52014.0,1746201676.0,NBASpurs
mq7v5ct,whiterock001,"I’ll be honest, I was pissed when he fired Bob Hill and gave himself the job the game that DRob came back from his first injury in ‘96, but wow was I a quick convert!  

Thanks for everything POP, we love you Coach!!",3,54112.0,1746202000.0,NBASpurs
mq7vz1q,thepeatiest,Thank you for all you did for the Spurs! What an amazing run,3,1059.0,1746202236.0,NBASpurs
mq7w8hn,hereiamnotagainnot,"As a Boston fan, I’ve loved Pop as a coach and human being. He is a rare goat of the game. I will truly miss his presence as a coach. I really enjoy the Spurs, and wish them nothing but success moving forward. With back to back ROY players on the roster, I’m hoping your franchise will continue to prosper.",3,14076.0,1746202309.0,NBASpurs
mq7xjaw,ccharlie03,The Mf goat. No one talk to me today ,3,51309.0,1746202681.0,NBASpurs
mq7xlqr,figgnootun,"Wow, Pops been hc longer than I’ve been alive so this feels a little strange. Legendary career and I’m glad he made a choice to prioritize his health. Even more glad he’s still going to be around the team(never doubted it).",3,33948.0,1746202700.0,NBASpurs
mq7xmbo,MirceMuncan,"Thx for everything Pop. You've done so much for the Spurs, but also as a Serbian I must say thank you for always giving shout-outs to our coaches like Duda and Željko and admitting to 'stealing' plays from them, even though you didn't need to. 2014 playoffs will always be ingrained in my heart. 

Hvala na svemu, Greg!",3,7955.0,1746202704.0,NBASpurs
mq7xrrf,smashed__,"Been Spurs fan for over 20 years since I was a kid. In Wemby’s rook season, I was finally at the point in my life with disposable income and I went to my first NBA game which was the Spurs vs Bulls. At the time, I was more excited to see the Alien, but in retrospect, the highlight was seeing Pop work is magic. He’s one of the very best coaches ever and I’m glad I grew up watching him on TV.",3,3295.0,1746202747.0,NBASpurs
mq7xzf9,DevilGunManga,Absolutely nothing left to prove. Pop is legendary. So glad he's still with the organization.,3,42497.0,1746202807.0,NBASpurs
mq7y5ik,Focalist,"Bittersweet news... Was hoping to see him on the bench one more time, but happier he's going to take it easy now. 🐐",3,5344.0,1746202854.0,NBASpurs
mq7y9v0,CouscousWithGoose_,“It’s a terrible day for rain”,3,4654.0,1746202889.0,NBASpurs
mq7y9zi,Datboy_98,"We LOVE YOU Pop.

Thank you for changing this franchise and for being a truly admirable human being♥️",3,84975.0,1746202890.0,NBASpurs
mq7ycs1,AutismbyPfizerjab,"Pop was hands down the best coach in pro sports. The Spurs won 70% of their games for a decade.  No other coach has come close to that achievement in the NBA, NHL, NFL, or MLB.",3,59.0,1746202911.0,NBASpurs
mq7ykhl,t2150,"Here’s to you Pop 🍷
Congrats and thank you for the 🏆🏆🏆🏆🏆 
🥹",3,2930.0,1746202974.0,NBASpurs
mq7yls1,generational_lover69,I was expecting this but it still makes me sad and nostalgic... It's nice to see all the love for him pouring out. Thank you GOAT,3,7542.0,1746202984.0,NBASpurs
mq7z1pk,Legal_Cartoonist2972,Smoking one for you Pops!,3,245.0,1746203113.0,NBASpurs
mq7zaqd,aliens_can_dunk,🥺 End of an era.,3,2817.0,1746203185.0,NBASpurs
mq7zpp3,nousername66,"I hate that Pop's tenure as HC ended this way, but at this point It's completely understandable. Hopefully his health stays intact and he can be a successful team president",3,21878.0,1746203304.0,NBASpurs
mq82tcl,ToinouAngel,"Sad but expected. Health has to remain the priority. 

Wish you all the best, Pop. Greatest coach of all time.",3,60403.0,1746204191.0,NBASpurs
mq8549x,thegaykid7,"It sucks whenever one's fate is removed from their hands due to circumstances outside of their control, but it's an inevitability of life. The fact that Pop is remaining in his role as Team President is a good sign that his health is at a place where he feels comfortable continuing in an important function. Here's to hoping it stays that way for years to come.


Although I have to wonder if we would've ever been able to give Pop a proper sendoff even without the health issues. After all, he doesn't seem like the type of guy who would do the whole farewell tour nonsense (*cough LeBron cough*), so would we have even realized game x would be his last game? Maybe his contract would've been expiring or maybe fans would've sensed the possible moment and showered him with love one last time just in case. It's a moot point now, but it does ease the sting just a little bit. Either way, I doubt Pop cares about any of that.


As sad as it is for us to have to say goodbye to him, though, I'm sadder that Pop won't be able to get one last taste of and shot at playoffs success. I know that isn't the be-all, end-all of everything, especially for someone like him---he has said those awful rebuilding years were some of the most enjoyable he's coached and helped to reinvigorate him---but it's still a shame nonetheless. Wemby and Pop, in the playoffs for one last series of rodeos...well, such is life. Real tragedy is all around us, every day and in many forms, so I'm just glad he's still with us.


Thanks for the memories, Pop. A great, humble man who always made the game bigger than basketball, and a great example of leadership in a world where we seem to be prioritizing all of the wrong traits in our chosen leaders. If every company or government agency were lead by a Gregg Popovich, the world would be a much better place.",3,14034.0,1746204840.0,NBASpurs
mq87rfi,gyuk8,I expected it but God if it hurts...💔,3,895.0,1746205581.0,NBASpurs
mq87w5r,Chuggy_McChuggerson,"One of those things where you knew damn well it was coming, but still sucks to see it happen. Glad he'll still be with them in some capacity. Hell of an era and thankful I got to watch all of it.",3,5344.0,1746205618.0,NBASpurs
mq87yvo,Einhander_pilot,Well at least he’ll still be around with us!,3,137022.0,1746205639.0,NBASpurs
mq88ddg,Mdanor789,I wish they'd give him the opening game so he can get a proper send off,3,5982.0,1746205754.0,NBASpurs
mq8dkts,Subject_Proposal3578,"When he had that incident at the restaurant recently I figured it was over. I have been a Spurs fan for a long time before Greg Popovich was ever the head coach, actually I became a fan back when Larry Brown first came in and Pop was an assistant on that staff. So I've seen Pop for almost my whole Spurs fandom, him and Sean Elliott used to do a segment on the Spurs report on channel 12 where they reviewed movies when he was an assistant coach and he was always funny on that, to now seeing him retire as one of the greatest coaches in professional sports. What a ride thank you for all the championships and all the memories.",3,30890.0,1746207208.0,NBASpurs
mq8epkc,Kileni,"I’m not officially a Spurs fan but I have cheered for and loved them since Robison was a rookie. Classy. Classy. Classy. I’ve loved how they have preferred right, deep, relational culture over pandering to self-centered brats. And how it’s rewarded them. I’m hoping they get surprisingly good drafts again and again because I think they give the best odds for a player reaching his potential.",3,56762.0,1746207530.0,NBASpurs
mq7sh4l,LastSaiyanLeft,one of the greatest coaches ever. Kobe respected the fuck out of Pop and at this point he has nothing left to prove but take care of his well being and enjoy life,4,7941.0,1746201240.0,NBASpurs
mq7trxs,bassetthound11,"It’s the best move for him and the franchise, sad to see him go but glad he’ll be in the FO where he won’t have to travel and day to day stress could be reduced.  I think this move could extend his career, and this is the optimal time to find a replacement",2,18868.0,1746201606.0,NBASpurs
mq7ts4x,None,Thank you for everything.,2,,1746201607.0,NBASpurs
mq7u7z6,moonlight_sinatra,BUILD HIM A STATUE,2,1176.0,1746201732.0,NBASpurs
mq7u8nq,countgino,"I'm the same age as his coaching career 😭 literally never knew any other Spurs HC in my entire life. Stay healthy, Pop! And many thanks for everything",2,3079.0,1746201738.0,NBASpurs
mq7udbo,Alternative_Slide_62,Such a sad day for basketball,2,13815.0,1746201776.0,NBASpurs
mq7uirf,OkJuggernaut8441,Hell of a fucking run man,2,113.0,1746201819.0,NBASpurs
mq7unno,BraveCable,At least he still will be a part of the org. He deserves all the time with his family enjoying life and drinking wine,2,12279.0,1746201859.0,NBASpurs
mq7uoxi,mlvassallo,Thank you Pop!,2,13426.0,1746201869.0,NBASpurs
mq7uuex,Independent_View_438,"This one hurts. A lot. More than I expected and I expected it to hurt pretty bad.

Gonna go cry over YouTube videos of Pop sideline and post game press.",2,2358.0,1746201914.0,NBASpurs
mq7uztc,BigDaddyD00d,"Knew it was coming, and its definitely for the best, but fuckkkkkkkk it still hurts. The man has absolutely earned it though. Thank you, Pop.",2,29339.0,1746201957.0,NBASpurs
mq7v3n4,midwestbeaner,"All hail the fucking king. Best to ever do it.....

Now, to polish my resume.",2,2120.0,1746201987.0,NBASpurs
mq7v4gi,ChunkyDickCheese,"Time yields for no one. 

Thanks for the years, Pop. Glad I got to attend the game that put him as the winningest coach of all time.",2,2486.0,1746201993.0,NBASpurs
mq7v4ty,Dsarg_92,I had a feeling it was coming. Just a matter of when but this really hurts. I am very happy to know he’ll still be a part of the organization.,2,209041.0,1746201996.0,NBASpurs
mq7v5xb,lunatocracy,"Pop is the greatest there is, was and ever will be. 🐐",2,5684.0,1746202004.0,NBASpurs
mq7v6s8,MaccTHC,"Sad but for the best. Let the man relax some. Dude’s Spurs coaching career is the same age as me💀glad his GOATness is still sticking around in some capacity.

Now…bring on Taylor Jenkins",2,1441.0,1746202011.0,NBASpurs
mq7v8il,BlueEyesBryantDragon,"I know it's what's best for him, and I'm glad he'll be staying with the organization, but fuck this is gutting.",2,42422.0,1746202024.0,NBASpurs
mq7va2f,go10sai,thank you for everything goat,2,5611.0,1746202037.0,NBASpurs
mq7vabx,BananaRepublic_BR,"Man, this sucks. I was really hoping for one last ride for him with a better squad than last season's.",2,121696.0,1746202039.0,NBASpurs
mq7vcsq,Professional_Exam_61,The goat 😞,2,10072.0,1746202059.0,NBASpurs
mq7vku5,supickumaterinubre,😢,2,6746.0,1746202122.0,NBASpurs
mq7vn4o,thatrandomdog415,Knew it was coming but it still hurts. Thank you pop for leading the team to 5 championships I really hope on the first game into the season they honor him in some sort of way.,2,12876.0,1746202140.0,NBASpurs
mq7vo7d,amofai,[ Removed by Reddit ],2,32141.0,1746202149.0,NBASpurs
mq7vv82,Conscious_String_195,"While I know it’s different, but it makes me feel like when TD or Ginobilli retired. It’s hard to believe that it’s the end of an era, even though we kind of knew that it was unlikely he d be back. 

Hope we can find stability at coach, like we have had, and not go back to when I first started watching w/Larry Brown, John Lucas, Bob Bass, Bob Hill, etc. (feel like I might be forgetting someone but you get the point.)",2,26128.0,1746202206.0,NBASpurs
mq7vwqn,rattatatouille,o7,2,1640530.0,1746202218.0,NBASpurs
mq7vwth,OGWallenstein,I was happy to see that he’s still with the organization but it just hit me that he’ll no longer be on the sidelines. Now I’m sad.,2,35075.0,1746202219.0,NBASpurs
mq7w5es,rawman200K,Gonna miss Pop so much man,2,61079.0,1746202285.0,NBASpurs
mq7w9sj,Elever_Galarga69,Crying onto my chicken on a stick rn,2,5275.0,1746202320.0,NBASpurs
mq7wc0e,fraygirl,"He’s been my coach, now he’ll be my president! 🖤🩶🤍",2,2223.0,1746202337.0,NBASpurs
mq7wgct,TheMindsGutter,This hurts!,2,135831.0,1746202372.0,NBASpurs
mq7wh21,kograkthestrong,"Get in, we're going downtown and crying.",2,108165.0,1746202378.0,NBASpurs
mq7wkmu,Dingo_Strong,I think many of us saw this coming. I’m glad he made the decision early enough to give the team an opportunity to find the best person to take the job. But maybe the Spurs give Mitch Johnson another year to prove himself…,2,1031.0,1746202406.0,NBASpurs
mq7wqy7,guinness_blaine,Just fell to my knees in HEB,2,304086.0,1746202456.0,NBASpurs
mq7wv5t,SplinteredBrick,"He started when I was a junior in high school, I now have kids in college. He’s seen some things.",2,2278.0,1746202489.0,NBASpurs
mq7wwui,keexko,"Probably best for his health. Will Mitch be HC? IDK. He did improve and had the guys fighting in meaningless games. If he continues that momentum, I do feel that he will be a good fit.",2,5142.0,1746202502.0,NBASpurs
mq7x4bg,GreginSA,"The end of a legendary coaching career, while a continuation of an organizational legacy.

The phrase “Next man up” isn’t just a philosophy for players.",2,2592.0,1746202563.0,NBASpurs
mq7x7ms,Nightmist82,"We all hoped for a better end for Pop coaching career, but all things considered it's for the best. Pop will always be part of the Spurs organization in one way or another, this way he can focus on his health and he'll still be around to help the guys.",2,2279.0,1746202589.0,NBASpurs
mq7xf7t,ryde041,Need a moment. So much more to it but first comes to mind was grateful that Wemby got a year of him and was able to be exposed to that.,2,5868.0,1746202649.0,NBASpurs
mq7ygk2,bit_pusher,"Always my coach. Love you Pop. Take whatever time you need, you’ve earned every minute and owe no one anything.",2,113851.0,1746202942.0,NBASpurs
mq7yskm,Powerserg95,Thank you Pop ❤️🫡🥹,2,165310.0,1746203039.0,NBASpurs
mq7yx8s,xVGxCrYpTiC,End of an era 🙏,2,3446.0,1746203077.0,NBASpurs
mq804w9,awesomenerd16,Thanks for everything Pop. Loved being a Spurs fan with you at the helm. Class act all the way. Good luck as Team President and get healthy,2,28545.0,1746203425.0,NBASpurs
mq80gfn,Significant_Youth921,Best to ever do it. Glad I got to witness it. In pop we trust.,2,1486.0,1746203518.0,NBASpurs
mq80jt8,randomtrancefan,"After the last health incident, I think we all kind of assumed we'd hear that he was stepping down as coach. I'm glad he's transitioning to President of Basketball Operations, but it's sad to officially see the end of the ""Coach Pop"" era. As legendary as The Big 3 were, there is no Spurs dominance without Popovich.",2,60.0,1746203544.0,NBASpurs
mq80o8t,OnomahIsABaller,"This is so sad but the right decision. Not seeing Pop on the sidelines for almost the whole season was so weird because he’s been the Spurs coach longer than I’ve existed 

Top 3 basketball coach of all time. Thank you for everything Gregg Popovich 💙",2,117901.0,1746203580.0,NBASpurs
