id,author,body,score,comment_karma,created_utc,subreddit
mrgds42,fhernands,Comparing him to Caruso smh,3,182.0,1746812705.0,NBASpurs
mrfo9y0,Fogger-3,"It's time to remember when the legend had Hair,

Everytime a see a pic with Manu with hair, it's like travelling to the past when I was young",2,8148.0,1746804972.0,NBASpurs
mrgeiux,jonee316,San Antonio really got Phoenix's numbers aside from that one playoffs when Phoenix got Dragic in 2010. That same year a low ranked Spurs (#7) beat Dallas (#2). Dallas will get their first championship the next year.,2,11316.0,1746812926.0,NBASpurs
mrfjlh7,vfronda,matrix gets a whole mouthful of ginobili nuts,1,4771.0,1746803545.0,NBASpurs
mrgx97g,vfronda,That 2nd pic tho 😂,2,4771.0,1746818632.0,NBASpurs
mrcycvw,InsertDev,"ooooooooo\~

we getting there. we getting there",169,8327.0,1746759891.0,NBASpurs
mrczb6a,teenagetwat,"Looks so much better than when he came out of Baylor, holy shit it’s a trip to see",153,126382.0,1746760291.0,NBASpurs
mrd5cp6,sp000ners,God I love Jeremy Sochan,32,7448.0,1746762933.0,NBASpurs
mrcy0l3,Chip102Remy30,"Same court where Team USA practiced in the World Cup last 2023!

His jumper looking smoother now compared to before.",48,6472.0,1746759748.0,NBASpurs
mrczp2s,oedipascourage,One of my favorite types of video to stumble upon in this sub.,38,7966.0,1746760454.0,NBASpurs
mrczj3z,iro3,my starting sf pls mitch give him those minutes next year,53,315350.0,1746760384.0,NBASpurs
mrcz7o9,justanotherdumbidea,TRUST THE PROCESS!!,32,11509.0,1746760250.0,NBASpurs
mrd1g5w,someguyfromtecate,He’s gonna look so good at the 3 right next to Flagg.,30,83513.0,1746761192.0,NBASpurs
mrd02gl,MrShonen,My Polish Prince 👑,26,11058.0,1746760609.0,NBASpurs
mrd3a5q,radicalcamel,"Sochan as a league average 3pt shooter is an amazing piece to have, I’m hoping he can get there",22,33272.0,1746762002.0,NBASpurs
mrd1r0b,baulboodban,if he actually becomes a respectable 3pt shooter that would help us out a TON long-term from a team-building standpoint,22,23753.0,1746761322.0,NBASpurs
mrd408f,Thatonlyguy988,THAT SHIT IS LOOKING GOOD MY KING,19,11022.0,1746762327.0,NBASpurs
mrdk2pr,hera9191,Is he going to EuroBasket? Poland is in a group with Slovenia and France.,9,33150.0,1746770369.0,NBASpurs
mrd2x2o,Fancy_Chipmunk5472,If Aaron Gordon develop a jumper. Sochan could absolutely can . This looks promising  him developing a jumper even just midrange will be big not just for him because it'll help with his longevity in the league but for everyone as well because people wouldn't dare him to shoot. As a result it gives opening for a lob or a backdoor cut,24,5834.0,1746761836.0,NBASpurs
mrdgmgi,jdavis2093,Looking a ton better. Less of a hitch but its still there a bit. Improvements are being made though and I'm loving to see it.,7,378.0,1746768476.0,NBASpurs
mrdtkr4,notcool_5354,Chip approved.,7,4058.0,1746776072.0,NBASpurs
mrd2i4e,allanjameson,https://preview.redd.it/2b7p4ed7foze1.jpeg?width=1179&format=pjpg&auto=webp&s=2d24a33188e7440971c9c7cfc4b9b7f5ec88198a,26,21129.0,1746761652.0,NBASpurs
mrd0m33,Str8OutArgentinianML,That's great to see :D Go Spurs go!,13,19.0,1746760834.0,NBASpurs
mrd1y30,The_Guerrilla,"Promising. 

Spurs should try and snatch Peter Patton as an assistant coach while they can. He was just let go by the Bulls (the players loved him) as a shooting coach and has also worked in Dallas with Luka. I know we still have Baron, but we have a position ready for an assistant.",12,7595.0,1746761407.0,NBASpurs
mremj9e,Dsarg_92,That actually looks a lot better.,6,209041.0,1746792241.0,NBASpurs
mren3b8,deneuvig,"What a journey for his jumper, to be complete broken down and rebuilt like that. Still some kinks but just looks so much smoother. Wish he was a bit less tucked with that elbow but hey, the progress is obvious",5,26269.0,1746792473.0,NBASpurs
mreuq29,Takeomark,Lookin good Jeremy! I’d also like to see him working on a little turnaround hook for when he gets deep paint touches,6,423.0,1746795420.0,NBASpurs
mrd7ixt,SBKSamurai,If he ever starts shooting 35-36 percent from 3 he'll become a top 10 power forward in the league idc.,10,1294.0,1746763935.0,NBASpurs
mrdanw8,jo3pro,"The hitch is slowly going away. 

In a lot of the games this season, when he had to shoot quickly his shot looked better and he hit them more accurately. When he had time, it’s like he was thinking too much and you would see the hitch. 

Keep practicing hard Jeremy. The shot is coming along",10,24268.0,1746765453.0,NBASpurs
mrdd42d,bcvaldez,imagine he became a 40% shooter next season..,9,17688.0,1746766674.0,NBASpurs
mrdvpub,ericktrejo,Still a hitch in it but so much faster and off the dribble? Nice,4,928.0,1746777437.0,NBASpurs
mrf71ud,Bonesawisready5, Bro if he can get to even league average 35% we cooking,5,104467.0,1746799647.0,NBASpurs
mrf72v3,ManagerEmergency6339,sochan sg experiment this season 😂,5,12941.0,1746799656.0,NBASpurs
mrfhdzf,jplugo10,"Every year it gets slightly smoother, I wonder if that’s by design. Like instead of overhauling it all at once, they break down the adjustments piece by piece and spend each year adjusting a different part of the shot.",5,162.0,1746802871.0,NBASpurs
mremine,mars210,![gif](giphy|37Fsl1eFxbhtu),3,15361.0,1746792234.0,NBASpurs
mrfb09j,Mandit0,https://i.redd.it/c94i96zwnrze1.gif,3,23244.0,1746800910.0,NBASpurs
mrfi7o6,Stxrudeboy,"If he can get to just below league average or league average, it would be a game changer. He's had a few hot streaks in his career, i think it's possible he could get to 34-35%.",3,448.0,1746803123.0,NBASpurs
mrfqebu,OGWallenstein,LETS GOOOOO SOCHI BEAR,3,35075.0,1746805608.0,NBASpurs
mrd5s41,Imaginary-Cycle-1977,Cute that he’s practicing them off the dribble,7,68225.0,1746763128.0,NBASpurs
mrdsk3p,estmit,Is that the Spurs shooting coach?,2,17856.0,1746775416.0,NBASpurs
mrfgmbb,JuJustice,Looking more fluid. Don’t see the weird hitch,2,1964.0,1746802641.0,NBASpurs
mrflhmz,Jznvh,"if Giddey can improve his jumper, so can Sochan",2,25345.0,1746804122.0,NBASpurs
mrfmb0t,Drisurk,Wow…,2,47718.0,1746804372.0,NBASpurs
mrgt6op,Independent_View_438,"I'm completely ignoring an off season video here.

Jeremy has All Star potential. He already is one of the top 20 peremiter defenders in the league. He moves excellent off ball, elite cutting skills. He really is a legitimate jump shot, and a few years of incremental overall improvement away from an all star injury replacement.",2,2358.0,1746817370.0,NBASpurs
mrf0ejq,overwhoop,Don't be prematurely fooled lol. I watched Ben Simmons do the same thing for what felt like a decade for him just to revert in real games. Wishing different for Sochan but the summer gym videos really be the ultimate misdirection.,2,2143.0,1746797431.0,NBASpurs
mrd2xvt,Thebarakz21,"Still has that.. hitch? Is that the right word? But yeah, he still has that delayed release after he brings that ball up. But yeah, it looks SO MUCH BETTER. Fingers crossed this is good to open up  things for him and the team.",2,28264.0,1746761847.0,NBASpurs
mrdctlf,dsulit408,"A lot of improvement but I still see a short pause when loading up, but what do I know.",2,2881.0,1746766527.0,NBASpurs
mrd6l72,siphillis,Looks like Castle’s,1,916711.0,1746763500.0,NBASpurs
mrebaby,thematrix185,Is Sochan the new Ben Simmons? He makes 2 in a row in the summer and everyone loses their mind that he's suddenly going to turn in to a shooter,-2,24224.0,1746787057.0,NBASpurs
mrcy3do,Thugganae,Hitch is still there,-16,10551.0,1746759780.0,NBASpurs
mrdjqdb,nohesi8158,remember guys when ben simmons had a jumper during offseason ?? lmao but i love to see it on regular season not on this ig clips surfacing,-10,9584.0,1746770176.0,NBASpurs
mrd3wxs,Lionheart0021,"Off the dribble 3's should be the last thing that he is working on.  

I have no problem in practicing catch and shoot 3's. DUDE please develop a serviceable jump hook or a floater. I can't watch you getting deep in the paint and doing another fade away midranger.",-15,6468.0,1746762286.0,NBASpurs
mrd67o4,keithington1,Will he stop being scared to shoot is the question here,-7,8811.0,1746763326.0,NBASpurs
mrd875t,Dan_K211,Looks kinda slow,-11,2316.0,1746764252.0,NBASpurs
mrczsmr,Loose-handles,im most excited how relatively quick he's getting that shot off. the last 3 years it feels like his percentage isnt awful but its such a slow load up that he'd have to be wide ass open to pull a 3,82,113.0,1746760495.0,NBASpurs
mreutl0,bandwagon_follower,Ben Simmons taught me never to trust offseason vids… but it looks solid 👌,6,7082.0,1746795456.0,NBASpurs
mrfaa7e,sixthdayoftheweek93,League average 3pt shooting would make him one of the best 3&D players in the NBA.,6,897.0,1746800683.0,NBASpurs
mrdpyc5,ballthyrm,I would like to know as well. I think playing international is good for our players but I'm French so I expect it that way.,8,101316.0,1746773796.0,NBASpurs
mre17yy,iksmadab,"Yes, it’s confirmed is coming. Dude is very passionate about playing for national team and for this EuroBasket. It’s probably also good for him marketing wise as hype for Jeremy is big in Poland, all games sold off in hours, even without confirmation of Luka or Wemby coming.",8,80.0,1746780993.0,NBASpurs
mreo75e,Cordaner,Nothing official but he teased Vic earlier that he was gonna see him at EuroBasket,3,6581.0,1746792921.0,NBASpurs
mrd51qp,changeUsernameXdd,lmao my reactions exactly every time it swished,4,1677.0,1746762797.0,NBASpurs
mrg6p5a,Celina_cue,Go Spurs Go!,2,2445.0,1746810581.0,NBASpurs
mreyucz,Loose-handles,"i do think that once the jumper is respectable his whole game is going to open up significantly. I remember last season Sochan had a really cool 3 bucket sequence that I probably hold onto more than I should, he scored a traditional post up hook shot on Kyle Anderson, did an awkward dream shake to a fade away on ANT and then blew past KAT and scored a running hook shot over Rudy Gobert. those moment are few and far between but if you squint you can see he's more offensively creative and talented than the average player outside of a jumpshot",5,113.0,1746796889.0,NBASpurs
mrf7ivd,Bonesawisready5,"Sochan could average 3 blocks, 3 steals and shoot 45% from 3 and IG casuals would still post 12/2023 takes like “he don’t pass to Wemby!!!!”",5,104467.0,1746799802.0,NBASpurs
mrfyg20,Loose-handles,agreed. he's only 1 percent worse than Keldon but if he can keep the defense stretched like KJ does than its mission accomplished imo,1,113.0,1746808074.0,NBASpurs
mrekshz,Loose-handles,i think thats his personal coach he works with in the offseason.,3,113.0,1746791511.0,NBASpurs
mrf7thm,Bonesawisready5,"Ben plays scared but Sochan has been far more brave. Dude played PG, SF, PF and center all while guarding the 3 hardest players at all times. The idea here is his mechanics are dramatically better, no one is saying he will suddenly shoot 35%+ but that’s the hope that he can get there with better mechanics",5,104467.0,1746799898.0,NBASpurs
mrf1ou9,Loose-handles,I think in general the Ben Simmons issue is just as much mental as it was broken. Ben just refused to shoot in game. Sochan shoots open jumpshots and has shown real improvement being around 31% for 2 years but god dayum did that jumpshot take 3 business days and a handwritten signature to get off.,4,113.0,1746797873.0,NBASpurs
mrd76pz,Sparkasaurusmex,"Yeah there's still something.  It isn't perfect, he's not even beginning the shooting motion with the jump or whatever.  I don't know, a lot of different players have different shooting styles, but this doesn't look ideal, however that hitch is vanishing or at least lessening.",0,35131.0,1746763776.0,NBASpurs
mreltu5,Loose-handles,"I guess to some degree there's some truth in that we are excited seeing Sochan's outrageously slow and segmented jumper smooth out and get faster. Difference between Ben and Jeremy is Sochan averages around 2 attempts game, where Ben took 2 a season.",7,113.0,1746791946.0,NBASpurs
mrczgnw,No_Amoeba_9272,"He's smoothing it out, though.  That elbow looks much better.  Two years ago, his shot looked like Barkley's golf swing from way back.",29,19266.0,1746760355.0,NBASpurs
mrczj24,Mr_Pizza_Puncher,This is significantly better than it was last year. I posted a video of him shooting around last pre season  and the difference is night and day,14,25699.0,1746760384.0,NBASpurs
mrd0qh5,LegoTomSkippy,Except Hitch's five friends don't seem to be tagging along.,11,17877.0,1746760887.0,NBASpurs
mrf84xk,Bonesawisready5,I mean yeah half of the shots are in slo mo literally,6,104467.0,1746800001.0,NBASpurs
mrczxiz,devinvassellfanacct,Exactly what I was thinking. Fluid and he gets the shot off fast enough,32,4557.0,1746760552.0,NBASpurs
mrd1ue8,Papa_Huggies,"I actually think this quickness is all he would need to be useful. 

His usefulness won't ever be as a legitimate sniper, simply as someone who can flare out and hit them wide open so he can't get sagged off. 

If he hitsw a short this fast at a 35% clip you dont sag off that.",24,130030.0,1746761362.0,NBASpurs
mrers9n,WhatMeatCatSpokeOf,"He’s starting with the ball much higher, that’s the biggest mechanical change I see. I think that’s why is release is quicker, and it seems to just skip over the part of his release with the hitch. Like they said, “your hitch happened at your sternum, so don’t let the ball go lower than your collarbone.” Cool to see his work ethic paying off.",6,5552.0,1746794333.0,NBASpurs
mrewgex,iro3,Sochan has more passion and drive then Simmons did,15,315350.0,1746796046.0,NBASpurs
mrg3hsj,estmit,Thanks! It’s looking so much better than before it’s definitely encouraging to see,2,17856.0,1746809610.0,NBASpurs
mrczmsp,Thugganae,"Bro his season ended just 3 weeks ago and his jumper looked terrible then, it’s not gonna magically improve that fast😭",-27,10551.0,1746760428.0,NBASpurs
mrd34lp,Loose-handles,thats hilarious 😂,3,113.0,1746761931.0,NBASpurs
mrh1j4o,Dan_K211,I know it was in slo mo. It was a joke.,1,2316.0,1746819969.0,NBASpurs
mrf7046,fireemblem4812,"And if people do keep sagging off on him (probably to double team Wemby) then Jeremy just takes those open 3's. It makes for a nice catch-22, and also opens up the hilarious possibility of Jeremy getting fouled at the 3 point line and making a 3 pointer via one-handed free throws.",6,8918.0,1746799631.0,NBASpurs
mrf0rrh,Loose-handles,thats reminds me of something Sean Elliott said about Harrison Barnes on commentary. is that you can pass the ball at his head and he's in perfect rhythm for a catch and shoot. (not sure if that's a shooting mechanic thing or a praise on HB for just being a perfect spot up player that can get into his shot from any angle),4,113.0,1746797557.0,NBASpurs
mrg1zt7,Arodthagawd,Wasn’t the lottery live before like watching the ping pong ball’s drop,15,10433.0,1746809158.0,NBASpurs
mrg8acp,lanman33,"“1,000 of those 1,001 combinations will be assigned to the 14 participating lottery teams”

If that last combination is drawn, does it mean the #1 rated prospect is banished from the league?",6,17027.0,1746811059.0,NBASpurs
mrgfkns,NoShape0,does that mean the Spurs have 300 combinations to land a top 4 pick?,8,17185.0,1746813235.0,NBASpurs
mrg4jxz,epsilon1856,![gif](giphy|j6uK36y32LxQs),10,36425.0,1746809928.0,NBASpurs
mrgx6c2,Axsh1boomba,All they need is one.,1,30668.0,1746818607.0,NBASpurs
mrh52l4,CommunityGlittering2,hopefully that's enough,1,126399.0,1746821058.0,NBASpurs
mrg480k,Stratys,"I think they post a video of the actual ping pong balls *after* the lottery is aired, I don't think they actually televise it live as it happens. But I could be wrong, I usually just watch the regular lottery broadcast.",11,152702.0,1746809829.0,NBASpurs
mrga7mr,Chance_Estimate2102,"Nope, they just pick another combination.",1,758.0,1746811638.0,NBASpurs
mrgpdf9,SBKSamurai,"Roughly, yes. They have a 29.7% chance of a top 4 pick (263 combos from themselves and 34 combos from the Hawks).",8,1294.0,1746816203.0,NBASpurs
mrgotlh,NoTaro3663,That’s all that matters,1,15496.0,1746816036.0,NBASpurs
mrg4j0i,Arodthagawd,Yeah but like years ago like 2000’s or maybe I just seen the commercial with the ping pong balls so many times. But I swear it used to be like David Stern would pull a ball a show the team,6,10433.0,1746809920.0,NBASpurs
mrgmj6c,lanman33,Haha yeah I was just joking lol,2,17027.0,1746815336.0,NBASpurs
mrg9c18,mdlspurs,"They used to have Stern pull envelopes out of a giant drum.  One envelope per team, equal odds for everyone.  The ping pong balls came later so that they could give more weighting to the worse teams.",5,25937.0,1746811374.0,NBASpurs
mrg81mb,TotallyAlex,Wish they would do it like the NHL and show each ball bring pulled and then give an update of each team's chances before the last ball is revealed.,1,148119.0,1746810985.0,NBASpurs
mrgsiwz,Fogger-3,"No you weren't, #SecretDesire",1,8148.0,1746817166.0,NBASpurs
mrg9vt4,GGTae,"they have to repeat few times who's at that spot and so on, because you can still pick the same team three, four times in a row, that's not fun to watch live",2,60479.0,1746811539.0,NBASpurs
mrgrr4i,bleh610,"5 really. 

The Iceman, The Admiral, The Big Fundamental, The Klaw, and The Alien.",14,86592.0,1746816928.0,NBASpurs
mrgou0c,Thugganae,He already is,4,10551.0,1746816039.0,NBASpurs
mrgz57n,999-tails,"6 actually. You’re missing the GOAT, Mamukelashvili",2,10751.0,1746819222.0,NBASpurs
mrdvr1j,Severe-Rope-3026,"would i pay a starter less that 20 mil a season


um yes",110,81230.0,1746777457.0,NBASpurs
mreiyjx,Elsie_E,I'm harder than most on Sochan but it's a cheap contract considering his contract starts 2 years later than Pat's. Pat's contract is awful but Sochan is already a better player than Pat.,10,779.0,1746790721.0,NBASpurs
mrf6f2d,Bonesawisready5,Imo yes 18-19M deal will be HYPER valuable to teams as second apron effects league even more over come years,5,104467.0,1746799439.0,NBASpurs
mrdz2f1,AfroHouseManiac,"No. .. That’s going to mess up the books instantly.  Look at Denver, they have no bench with 3 max dudes and AG making 103m over 3 years..

4/65 is a new cba buffer deal",13,35481.0,1746779592.0,NBASpurs
mrdyzp1,Thugganae,"Bit of an overpay if you ask me. He hasn’t progressed as a shooter and he has durability issues. I’d give him a 4-year, $60 million deal with a team option for the last year.",15,10551.0,1746779542.0,NBASpurs
mre0bgp,SBMVPJustinHerbert,I see that as a steal but I think I value Sochan higher than most,6,157513.0,1746780408.0,NBASpurs
mre2nmd,Flaky_Scar_8388,Way too much.,9,11054.0,1746781930.0,NBASpurs
mre8wdc,Simple-Ant7190,"No, sorry Jeremy.  Keep working on that shot.",8,2419.0,1746785743.0,NBASpurs
mre2fns,Y2K_Bug_99,I'll ask him if they pass me the mic during Q&A lol,3,2575.0,1746781788.0,NBASpurs
mreurg6,No_Amoeba_9272,"4 years 65M.  I'm not sure exactly what his role will be. Also, if this Mitch business doesn't work out, will the next coach be able to utilize him?",4,19266.0,1746795434.0,NBASpurs
mretzel,Signal-Share-6802,"Yea it is ok.. he just needs to be atleast NBA average in his outside shot.. plus he is syill so young he will turn 22 on May 20, almost 3 yrs younger than Dalton knecht.",2,734.0,1746795153.0,NBASpurs
mrf6cg1,Loose-handles,"I think if you're the Spurs front office you're aiming to have him in around the Lu Dort range of contract (17-20 mil) top defender/low offense. He's going to be a top 5 player on the team but he hasnt shown that over a significant stretch he's on the level of Draymond or AG. Now if you're buying his potential which alot of first contracts do. That's probably a serious underpay and you always have to be careful to not wait too long bc lets say he does breakout offensively this season, which he looked like he was going to before the injuries and now his value is $25-30 million (around Vassell's contract) rebuilding teams can throw serious cash on these lottery ticket type of players that we wont want to match. I dont want to develop players for other teams bc Sochan is going to be in this league for 15 years and is going to get way better being he's only 21 on coming into his 4th season.",2,113.0,1746799416.0,NBASpurs
mrf9274,Gabe-DaBabe,"Context is KEY with these high paying extensions. It's important to remember the cap is rising almost exponentially. An aav of 18m is only 11% of the current cap and by the end of his contract will be less because the cap will rise even more. In our 2014 championship year, our 4th highest paid player made a higher percentage of the cap. 

So if we can expect a prime Sochan to be our 4th or 5th best player, we will be doing great at that price point.",2,40785.0,1746800296.0,NBASpurs
mrg7sfp,Fun_Farm_8854,"We still don’t know what his ultimate role will be. For me, it’s more about years than dollars on an extension. I think the most likely outcome is that he is a useful player, but does not end up starting or closing games due to his lack of shooting and poor fit with Vic. I don’t want to be in the spot four years from now where he is getting paid $18M to be our 7th man playing ~20 minutes per game. I would rather move on and find the long term starter at the 4. Once our guys max contracts kick in, we are going to be scrounging for every penny. 

I’d be much more inclined to give him a short term extension, something like 2 for $40M. We pay a little more up front, but we secure flexibility on the backend in case he doesn’t work out.",1,246.0,1746810909.0,NBASpurs
mrdvzjc,Papa_Huggies,That's a fantastic deal. I'd do that in a heartbeat,0,130030.0,1746777608.0,NBASpurs
mrdzpzp,Full-Opportunity6538,"Too much, rather do 15 mil per year, and with the maxes increasing role players are gonna have to make lesser money",1,102.0,1746780021.0,NBASpurs
mrecuos,prfrnir,I'd pay him less and for a shorter amount. \~$18M is still a sizable contract. That's Duncan Robinson's current contract and that contract was constantly laughed at as an inclusion in deals because he was an overpay and negative value. And Sochan's impact has been extremely spotty.,1,8671.0,1746787856.0,NBASpurs
mrfihht,raiderrocker18,Too much for what he’s shown,1,49538.0,1746803207.0,NBASpurs
mrfl7e9,Dingo_Strong,Maybe… tbh when I watch him play I don’t see him as someone who fits very well next to Wemby. It might be a case where the correct thing is trade him or let him hit restricted free agency.,1,1031.0,1746804035.0,NBASpurs
mrg0efq,Intrepid_Ad1133,How much do you want to pay for a ticket to watch the team still sucking ?,1,11626.0,1746808674.0,NBASpurs
mreq2jz,Tough_Peach_6827,Plz god no. I don't like him on a rookie contract let alone a 5 year extention lmao,-2,9.0,1746793664.0,NBASpurs
mre2pvw,thematrix185,"Wild overpay, dude can't shoot. Stop comparing him to Patrick Williams, who is a career 39% 3 point shooter",-9,24224.0,1746781970.0,NBASpurs
mrfr0ye,Veggiedelite90,Drafting lottery picks with good potential but no jumper and then holding their contract value solely to their shooting deficiency seems beyond dumb. Idk if Jeremy and his agent will accept that kind of deal but if they are it’ll be a bargain of a contract.,0,93848.0,1746805798.0,NBASpurs
mrfxoqn,sports_are_neat,I think that would be fine if that's the end result but idk why we would offer that this offseason. I can't see him in a situation where he's commanding materially more on the open market in 2026 so might as well try to get him for less now. Every dollar counts under this new CBA,0,11175.0,1746807841.0,NBASpurs
mrfikm4,sp000ners,ppl won't want right hear it but this is a very reasonable extension for a guy of Sochan's caliber,-1,7448.0,1746803233.0,NBASpurs
mrfphxc,QuantumAvocadoPacket,"I think that’s a fair, not too risky contract. If he develops his shooting, this contract would be a steal. If he doesn’t, then you have a guy coming off the bench that gives big energy and defense/rebounding that wouldn’t be terribly hard to move.",-1,690.0,1746805340.0,NBASpurs
mrexprv,iro3,Assuming the lineup is sochan fox devin Barnes and wemby yes,-2,315350.0,1746796495.0,NBASpurs
mrdwhfz,KhornKT,"I mean I agree he's worth that contract. But not sure he's going to be guaranteed starter.

With Wemby, Fox, Castle core... you might want to surround them with capable 3-pt shooters.

Without new rookies or free agents in consideration, I think Vassell and Barnes have more chances to start than Sochan.",34,49988.0,1746777923.0,NBASpurs
mrfjuse,Imaginary-Cycle-1977,Unclear he’s a starter caliber player after 3 years,3,68225.0,1746803625.0,NBASpurs
mrdzdci,AfroHouseManiac,"Is Brian Wright deadset on making him the starter? His minutes have been all over the place this season. And from the way these former players talk about minutes, it’s usually the GM who dictates the minutes they play..",6,35481.0,1746779793.0,NBASpurs
mre4xnd,njuts88,"I mean 4/65 and 5/90 are pretty similar, (16m annual vs 18m annual) especially with expected cap rises.",36,18196.0,1746783383.0,NBASpurs
mrdzgqd,kasumi-sun,"Paying a starter 18 mil a year is a steal even if he becomes a 6 man or something that’s amazing, Derrick white for the Celtics is a 6 man making 30 mil a year starting next year",12,220.0,1746779854.0,NBASpurs
mrf9pra,Gabe-DaBabe,"If an NBA level coach can't get 25-30 minutes out of a big athletic forward who has a pretty good IQ, then how good is that coach?",2,40785.0,1746800507.0,NBASpurs
mrewxya,vfronda,"If Mitch is gone, sochan would’ve been long gone",-3,4771.0,1746796222.0,NBASpurs
mrfagt3,Gabe-DaBabe,"He doesn't even need to be average. Just good enough to hit a wide open look, make a defender close out. Theres so many other ways to create spacing than just being an average shooter",3,40785.0,1746800740.0,NBASpurs
