id,author,body,score,comment_karma,created_utc,subreddit
mq7vmgc,Wembanyanma,"I would much rather have Taylor Jenkins.

Malone was carried by the brilliance of Jokic and playoff Murray.  Jenkins got way better performances than anybody expected out of teams nobody gave any chance to (when Ja was hurt/suspended)",16,63443.0,1746202135.0,NBASpurs
mq7snw4,No_Amoeba_9272,"Agreed, he's 100% who I want",12,19266.0,1746201293.0,NBASpurs
mq7wuki,lowkeyslightlynerdy,I kinda prefer Taylor Jenkins personally,4,41302.0,1746202484.0,NBASpurs
mq84tdx,papertales84,"I’m in the Jenkins camp, or Bud. I’m not a fan of Malone but I’m okay with either of those 3.",2,17352.0,1746204755.0,NBASpurs
mq86lqf,RCA2CE,Mitch got the job,1,72387.0,1746205251.0,NBASpurs
mq7vv2c,Unusual-Tale-74,First coach that came to mind,0,9033.0,1746202204.0,NBASpurs
mq7xykv,FieryFiya,Is Dan Hurley still on the table? Him and Castle could reignite the UConn offense within the Spurs,-3,15573.0,1746202800.0,NBASpurs
mq7wn3w,Defiant-Tap7603,He'll find a way to get a T or 2 as President for old times' sake.,3,5080.0,1746202425.0,NBASpurs
mq84f72,JeppMills,My prediction is they will stick with Mitch next season,1,1227.0,1746204646.0,NBASpurs
mqazuz1,AnonymousNeedzHelp,Pope pop?,1,9030.0,1746237689.0,NBASpurs
mq9mw1r,xnoob69,"I get that Tim Duncan was the cornerstone of the Spurs dynasty, and there’s no denying his impact. But to say Pop couldn’t have won without him underestimates just how elite Popovich is as a coach.

Pop isn’t just a guy who lucked into a generational big man, he built a system that emphasized ball movement, defense, and team culture. That system made stars out of Parker, Ginóbili, and later Kawhi. Look at how he adapted over the years, from post-heavy sets around Duncan to positionless, three-heavy offenses in the 2010s. Few coaches evolve like that.

Also, Pop was instrumental in developing Duncan. Who’s to say he couldn’t have done the same with another high-level talent? You give Pop someone like Kevin Garnett or Dirk early on, and I’d bet he still ends up with rings. Maybe not five, maybe not as early, but championships? Absolutely still possible.

At the end of the day, great players and great coaches amplify each other. Pop without Duncan wouldn’t be the same, but to say he couldn’t have won at all? That’s selling him short.",2,3522.0,1746220551.0,NBASpurs
mqdusym,jo3pro,"No shit. lol 

Pop even said as such. He always gave the glory to the players.",1,24268.0,1746286073.0,NBASpurs
mq9bf0q,noturaverageangelino,Useless fact…,0,9030.0,1746217130.0,NBASpurs
mq8a4bc,These_One1186,He can still do it as President. He’s part of the Spurs club franchise.,1,19.0,1746206244.0,NBASpurs
mq9hyzl,AutoModerator,"Sorry, your comment has been automatically removed because your account has low karma or has not reached 1 week old.

*I am a bot, and this action was performed automatically. Please [contact the moderators of this subreddit](/message/compose/?to=/r/NBASpurs) if you have any questions or concerns.*",1,1000.0,1746219059.0,NBASpurs
mq7twsc,Joethetoolguy,He was always supposed to walk off with tim but he made a commitment to lamarcus and just stayed because why the fuck not,3,17273.0,1746201643.0,NBASpurs
mq7ts8l,Treewizard90,Zero. I don’t think he enjoyed that one year doing it…,8,2488.0,1746201608.0,NBASpurs
mq7us4i,MaccTHC,Why would you want that lol he definitely did not like coaching,3,1441.0,1746201895.0,NBASpurs
mq7u9up,Joethetoolguy,"Like none, usually great players don’t make great coaches.",2,17273.0,1746201748.0,NBASpurs
mq7t3v5,Davisworld21,"Still sad all my life as a little boy in pre school to a Grown Man 
I've onky known One Man as Head Coach of the Spurs
And it's Pop I wish he could've wnet out on his own terms
I don't care what anyone says he's the great basketball coach of all time 
Truly end of a era",140,148380.0,1746201417.0,NBASpurs
mq832tc,bread_1993,Not just the team but also himself he’s 76 and this was the second year in a row he suffered health problems right?,4,6078.0,1746204266.0,NBASpurs
mqb4zp2,GorillaEstefan,YES. 💔,1,13545.0,1746239694.0,NBASpurs
mqa1uj0,DryGeneral990,Just like Timmy.,5,36690.0,1746225486.0,NBASpurs
mqbob9n,cesgjo,"RC: *""Pop pls attend this home game where we honor your legacy""*

Pop: *""you know i hate that kind of stuff right?""*

RC: *""there will be wine after the game""*

Pop: *""dammit, fine""*",3,102651.0,1746248328.0,NBASpurs
mqa24uh,DryGeneral990,Not really. Phil only will with GOAT teams. Pop made the playoffs every year.,1,36690.0,1746225587.0,NBASpurs
mq8b8s4,Dudeasaurus2112,"Pop retires:  fire up the grill

Spurs win 1st game:  fire up the grill 

Spurs lose 2nd game: fire up the grill

National Holiday in new zeland:  fire up the grill


Pet fish dies: fire up the grill


Stubbed toe:   Guess what….. fire up the grill ",1,12978.0,1746206558.0,NBASpurs
mq8rr54,symmetra,Tissues,9,49965.0,1746211285.0,NBASpurs
mq81cnl,BBQLovingBastard,I’m not living in Texas RN unfortunately,1,13468.0,1746203773.0,NBASpurs
mq7v72j,jimmyrich,"Maybe he was a late bloomer, just a real small 10 year old.",20,29301.0,1746202014.0,NBASpurs
mq8ek47,donuttrackme,Or the Christiano Ronaldo guy.,2,30947.0,1746207487.0,NBASpurs
mq9k7x8,Voidling47,"They just decided to build Luol Deng a statue and invited Wade to watch the unvailing for some unknown reason, don't hate xD",2,2524.0,1746219724.0,NBASpurs
mq9fg2v,Significant_Slip_883,"I don't think Pop would want a statue of his own. In fact, I thought he would despise that.",1,2053.0,1746218318.0,NBASpurs
mq80a3a,DevelopmentJumpy5218,"5 for the rings
4 for Robinson + the big 3

54",0,56383.0,1746203467.0,NBASpurs
mq9kndc,Voidling47,"Has he, though ? Pop was still the head coach until this announcement and Mitch, imho, just isn't ready to be a head coach in the NBA just yet.

Once he gets a couple of years under his belt as a college coach, he should be fine, but we should not have a head coach learning on the job while we have Victor, Fox and Castle on the team, imho.

Edit: I only saw the post of OP initially, so if Mitch has truely already been named the new HC, then I'll obviously give him a chance (several comments mentioned it and I don't think they're lying, just didn't see a link or anything posted to confirm it and don't want to just google it instead I read some incorrect speculation instead).",0,2524.0,1746219857.0,NBASpurs
mq88dy1,Imaginary-Cycle-1977,Check the feed. They named Mitch HC already,3,68225.0,1746205758.0,NBASpurs
mq7ygkg,Datboy_98,"Can’t risk a college coach with 3rd year Vic. 

We need somebody who’s coached pros before.",6,84975.0,1746202942.0,NBASpurs
mq7u1bb,Worth_Ambition_8496,"Yea he does seem like he would prefer to stay off the grid. 

Maybe we can luck out and get Doc Rivers. 

Just kidding",2,24.0,1746201678.0,NBASpurs
mq8coqc,VixxenFoxx,Well his own terms were a couple seasons back when he had planned on finishing his contract and then traveling with his wife. Unfortunately his wife passed on and he renewed his contract afterwards.,24,23744.0,1746206957.0,NBASpurs
mq7xpus,FattySnacks,Seems like he did go out on his own terms?,16,106764.0,1746202733.0,NBASpurs
mq80oh8,jyee1050,Dejounte Murray is that you?,4,16358.0,1746203582.0,NBASpurs
mqaj03g,Raydog45,Phil literally never missed the playoffs in his entire coaching career.,1,1860.0,1746231475.0,NBASpurs
mq7y32w,smashed__,![gif](giphy|uCXkGJPU3yrOo),11,3295.0,1746202835.0,NBASpurs
mq7vnbf,Severe-Rope-3026,between 11 and 13 i grew like 14 inches so i have a different perspective on small i guess,8,81232.0,1746202142.0,NBASpurs
mq9moiq,Joethetoolguy,I think that was the same dood lol,1,17273.0,1746220486.0,NBASpurs
mq818ps,Bootarms,Put the names of every player he coached on it. I think that would mean far more to him than any number.,1,35127.0,1746203742.0,NBASpurs
mq8fys3,papertales84,"Yeah just saw that, thank you for the heads up!",1,17352.0,1746207885.0,NBASpurs
mq8g04p,papertales84,"Yeah just saw that, thank you for the heads up!",1,17352.0,1746207894.0,NBASpurs
mqb9bkd,Next-Introduction-25,That’s so sad when a spouse dies right as they’re planning a retirement together 💔 Can’t blame him for wanting to keep working after that.,9,61855.0,1746241444.0,NBASpurs
mq7ycvi,North_Maybe1998,I mean most likely he would’ve at least coached this past season if not for the health issues. But yea I’m sure he’s not being forced out of coaching it’s probably his decision,22,11638.0,1746202912.0,NBASpurs
mq95ede,aVHSofPointBreak,"Yeah. It seems like “I’m going to do this until I physically can’t anymore” were his new terms after this passing of his wife, and he certainly achieved that. I think if his wife was still alive, he would’ve retired awhile ago.",3,63110.0,1746215345.0,NBASpurs
mqajmpq,DryGeneral990,My bad.,1,36690.0,1746231707.0,NBASpurs
mq8knl1,digibox56,"That's crazy, it's as crazy as going from 5'11 to 6 flat",-2,7001.0,1746209211.0,NBASpurs
mpqvix9,Stratys,"LETS GO ROOK 👑👑👑

So proud of this kid, did so well despite the ups and downs of this season. Would love him as a forever Spur 🥺",304,152702.0,1745967954.0,NBASpurs
mpqw8sd,UTRAnoPunchline,"Robinson ⚓️

Duncan 🐐

Wembanyama 👽

Castle 🏰 

😳",255,166311.0,1745968194.0,NBASpurs
mpqvta8,Aggravating_Impact97,"Glad there wasn't any tomfoolery and our boy wasn't robbed. 

Well-deserved and this is only the beginning.  Dude is going to be a fucking stud for a long time.",110,24881.0,1745968050.0,NBASpurs
mpqvmek,sp000ners,YESSIRRRR!!! FUTURE HALL OF FAMER LFG STEPH,44,7448.0,1745967986.0,NBASpurs
mpqvocc,96Mute96,B2B LETS GO,37,90590.0,1745968003.0,NBASpurs
mpqvvsi,Dsarg_92,"Back to back ROTYs, baby 😎",35,209041.0,1745968073.0,NBASpurs
mprjy2f,sherlock-spreadsheet,"Spurs press announcement is 🔥

Castle's performance includes a smorgasbord of elite accolades. As well as Spurs organization also earning historical accolates... ""Most Rookie of the Year winners since the NBA-ABA merger in 1976"".

Let's go! 

> SAN ANTONIO (APRIL 29, 2025) - The NBA today announced that Stephon Castle has been named the 2024-25 Kia NBA Rookie of the Year. He is the fourth Spur to capture the award, Joining Victor Wembanyama, Tim Duncan and David Robinson. Following Wembanyama's recognition last season, San Antonio becomes the fifth team in NBA history to feature back-to-back honorees.
>
> In year one, Castle averaged a rookie-best 14.7 points, to go with 4.1 assists, 3.7 rebounds and 0.91 steals across 80 games (47 starts). The first Spurs rookie since Tim Duncan to rank top two on the team in both points and assists, Castle also led all rookies in total points (1,190). made field goals (423), total steals (74) and made 100+ more free throws (249) than any other first-year player.
>
> The 2025 Rising Stars MVP earned Western Conference Rookie of the Month honors in both January and March and was the only player in the 2024 draft class to surpass 1,000 points. He scored in double figures in a rookie-best 60 games, including 26 contests with 20+ points and two 30-point outings, while also recording five double-doubles and 18 games with multiple steals. After averaging 12.9 points, 2.8 rebounds and 3.5 assists in the first half of the season, Castle improved across the board to average 17.8 points, 5.1 rebounds, and 5.0 assists after the All-Star break.
>
> In addition, the 20-year-old is the only rookie since 2017-18 to record a game with 30+ points, a game with 15+ rebounds and a game with 14+ assists in the same season. On Feb. 7. he scored a season-high 33 points off the bench at Charlotte, the most by a rookie reserve in Spurs history and became just the seventh Spurs rookie to post a 30-point game. On March 21, Castle logged 17 points, 14 assists, 5 rebounds, 3 steals and 1 block in a win vs. Philadelphia. On April 2, he had a 15-point, 15-rebound and 9-assist game in a win at Denver followed by a near triple-double with 22 points, 11 assists and 9 rebounds in Cleveland on April 4.
>
> San Antonio selected Castle with the fourth overall pick of the 2024 NBA Draft. With this award, the Spurs have drafted the most Rookie of the Year winners since the NBA-ABA merger in 1976, and is the first team since the merger to select consecutive Rookie of the Year winners without having two No. 1 overall picks.",20,362.0,1745976176.0,NBASpurs
mpqx4kf,oceanfloors1,"LETS FUCKING GOOO! B2B 👽🏰

Shout out to Jared McCain, too. Hope he recovers well and kills it next year.",39,30945.0,1745968486.0,NBASpurs
mpqvdh4,Gone_a_Long_Time,Well deserved! GSG!,17,292.0,1745967904.0,NBASpurs
mpqy408,Lexi_413,I felt like watching Steph at UCONN he would be special… I knew it was just a matter time for the world to take notice! Hella of a job by our Front Office! It takes good scouting and luck to land back to back ROY! GSG!!!,17,234.0,1745968806.0,NBASpurs
mpqz8rn,callipygian11,"Genuinely surprised the salty fans over at r/NBA are finding ways to nitpick. Castle has been the clear cut favorite for months. If you didn't know that, you haven't been watching at all. Congrats Stephon. I believe there's greatness in your future",10,373.0,1745969182.0,NBASpurs
mpqvr97,Magnet_W,Yoooooo let’s go,7,36548.0,1745968030.0,NBASpurs
mpr0q4y,ilovejuice92,Ten years of Area 51 LFG!!,9,6704.0,1745969679.0,NBASpurs
mpqy4qd,Titronnica,"HELL FUCKING YEAH THATS OUR ROOKIE

Dude's future is bright as cam be, and what's so incredibpe is how mature he is for his age--fearless, never let a bad night stop him from contributing. He's got some good instincts already, and with more experience under his belt, he'll be an absolute monster of a PG.",14,208708.0,1745968812.0,NBASpurs
mpqxrcp,Chuggy_McChuggerson,Can we take bets on who was the 1 vote placing him in 3rd?,7,5344.0,1745968691.0,NBASpurs
mpqvvzo,Internal-Range-675,B2B!!! GSG!!,6,10654.0,1745968075.0,NBASpurs
mpqw3zs,Snowmann88,Well deserved. Way to go 🏰,6,61629.0,1745968149.0,NBASpurs
mpqx241,callmearookie,YESSIRSKIII CASTLEE,6,132175.0,1745968464.0,NBASpurs
mprfyf5,Huunze,![gif](giphy|Hi0ODLYPDChm8),4,2526.0,1745974804.0,NBASpurs
mpr4ua4,donuttrackme,![gif](giphy|gF1yJruGOyWXugxgKv),4,30947.0,1745971047.0,NBASpurs
mpqwqht,Harsh-Reality07,2 in a row GSG!!,4,85.0,1745968357.0,NBASpurs
mpqx4uy,FirstTribeElder,Back to back ROTY BABY!,3,7215.0,1745968488.0,NBASpurs
mpqxbjd,thepeatiest,Well earned! GSG!!!,5,1059.0,1745968548.0,NBASpurs
mpqxigi,baguette-1234,Woop woop!!!,4,1668.0,1745968611.0,NBASpurs
mpr1tye,Beaglebunker,"I’ve seen enough, retire the jersey",3,2811.0,1745970051.0,NBASpurs
mpr42vl,A-Rusty-Cow,B2B ROTY. Should have been B2B DPOTY on our team too but the future is very bright.,4,137261.0,1745970795.0,NBASpurs
mprmvkh,Einhander_pilot,#KING OF THE CASTLE!!! 👑,5,137024.0,1745977179.0,NBASpurs
mprmura,SpencerRattler,/r/nba won't even allow a post for ROTY anymore. Haters galore.,7,80640.0,1745977171.0,NBASpurs
mpqvwzc,FireBeeChin,W,3,24861.0,1745968084.0,NBASpurs
mpqvyrv,BigDickVicW,GSG,3,60538.0,1745968100.0,NBASpurs
mpqw4ln,krogue4,GSG!!!,3,233.0,1745968155.0,NBASpurs
mpqwz0f,tlpedro,King of the Rookie Castle. He did it!,3,72185.0,1745968435.0,NBASpurs
mpqx1o1,MrShonen,LET’S GOOO,3,11058.0,1745968460.0,NBASpurs
mpqx5qy,Holden_place,Yes he is!,3,189410.0,1745968497.0,NBASpurs
mpqxc7v,rattatatouille,🦀🦀Let's go!!!🦀🦀,3,1640530.0,1745968554.0,NBASpurs
mpqxv6l,suavekm,No surprise,3,953.0,1745968726.0,NBASpurs
mpqy3mz,aldrinalinee,GSG!!! 🏰,3,107.0,1745968802.0,NBASpurs
mpqydcd,lefts3at,well deserved…,3,363.0,1745968890.0,NBASpurs
mpqykon,Malemansam,"B2B baby woooo

Now for B2B2B!",3,203301.0,1745968959.0,NBASpurs
mpr0kbr,go10sai,"future ALL STAR, FUTURE DPOY OH YEAHHHH BABYYYYYY",3,5611.0,1745969625.0,NBASpurs
mpr15i0,jo3pro,"Love this dude


Please front office don’t trade him.",3,24268.0,1745969823.0,NBASpurs
mpr2mni,sh0wt1mederek,Couldn’t have been anyone else. GSG!,3,2312.0,1745970317.0,NBASpurs
mpr2w2i,maxiumwater123,LFG!!!!,3,343.0,1745970403.0,NBASpurs
mpr4hw2,SaveMeINeedIt,Heck yeahhh lessss go!,3,1151.0,1745970934.0,NBASpurs
mpranqv,zatchstar,Why is there no post about this yet on the main NBA sub?,3,70498.0,1745973028.0,NBASpurs
mprtf6y,MortysTrapHouse,"i live in ct and im a uconn fan and a spurs fan. been watching castle since high school

so proud of him and a truly great person",3,1525.0,1745979427.0,NBASpurs
mprvpww,neekog7,First ever Franchise ROTY 3-peat in any sport incoming.,3,1121.0,1745980239.0,NBASpurs
mps1x1n,u_uhtred,Castle is that guy let’s go,3,739.0,1745982532.0,NBASpurs
mpscaob,ProfessionalEntry744,"IMAGINE! 

We get cooper flagg and set a new record with a 3peat back to back to BACK ROTY",3,5546.0,1745986850.0,NBASpurs
mpran0b,EggplantBusiness,Back to back baby,2,482122.0,1745973021.0,NBASpurs
mprb67n,Huunze,Hell Yeah!!,2,2526.0,1745973203.0,NBASpurs
mprfk9m,Fancy_Ad_5522,yes,2,234.0,1745974676.0,NBASpurs
mprim73,jumpijehosaphat,congrats to stephon!  imagine the spurs potentially having b2b2b roys after the end of next season due to their high draft pick,2,39630.0,1745975715.0,NBASpurs
mprosuu,Axsh1boomba,Stephon Castle IS The Punisher.,2,30668.0,1745977829.0,NBASpurs
mps8mp5,DarkoDragicevic,"Back to back ROTY for Spurs, CASTLE back to back college titles. Dynasty after dynasty?",2,9271.0,1745985248.0,NBASpurs
mpsn2o2,Spirtuv,AS HE SHOULD,2,60.0,1745992136.0,NBASpurs
mpqwt9f,salmonbird,Back to back rookie of the years for the Spurs. Future is bright.,3,13504.0,1745968383.0,NBASpurs
mpr5gg7,Puzzleheaded_Ad_5115,Area 51.   👽x 🏰x🦊,2,361.0,1745971254.0,NBASpurs
mpr7g2t,RiceLord06,"As a Warriors fan, the transition of dynasties will be interesting to see in these next few years.",1,6.0,1745971930.0,NBASpurs
mprecxt,Chinbie,Hmmm…. Congrats to Spurs for back to back ROY….,1,23398.0,1745974274.0,NBASpurs
mprfpgg,Sluggy_McSlugface,What were the stats for the runner-up? I feel like stat-wise this years winner is lower than years past or has this been normal for a while?,1,54.0,1745974723.0,NBASpurs
mprtbsw,MortysTrapHouse,"lets go!!!!!!!!!!!!!!!

now trade for giannis

and we got a dynasty brewing with wemby and castle",1,1525.0,1745979393.0,NBASpurs
mpruflf,jxyscale,"Must be nice to be an early bettor during the season. 

Congrats to our boi and congrats to all bettor winners! It's a win win.",1,3985.0,1745979784.0,NBASpurs
mprv22e,yesdork,You don't have to put Kia in there. Wtf. ,1,2869.0,1745980002.0,NBASpurs
mpuf0uo,bobatgu,"Some good stuff. Congrats, young man!

People hating because he didn't average 20 points a game or that he's in a weak rookie class are so dumb. His PPG was already improving a lot towards the end of the season that I think next season it should be closer to 20 points. That would be a great step for someone only in his 2nd year. 

He also plays like a vet. Maybe he won't have the best game some nights but he doesn't seem timid or afraid of big moments. And while he's confident, he's not overtly cocky or obnoxious about himself.

There's a lot to be excited about. The backcourt is set with him and Fox for a couple of years.",1,7734.0,1746022906.0,NBASpurs
mpvu3ny,SpecialistAstronaut5,Lets go,1,4418.0,1746037724.0,NBASpurs
mpw9og8,MaliInternLoL,Genuinely much deserved,1,12834.0,1746042323.0,NBASpurs
mq0jkda,Consistent-Gazelle15,Future look bright for you guys im happy for you ( a french celtics fan),1,1472.0,1746105878.0,NBASpurs
mqaxpg9,Kaelanna,"Two consecutive ROTY's, a possible draft high draft pick or if it falls too low maybe to trade with

We're set for a huge season :)

  
Congrats Castle!",1,15514.0,1746236881.0,NBASpurs
mqcdhod,freedumb9566,back to back 2back!!??? wouldnt that be something,1,2192.0,1746263327.0,NBASpurs
mpqx62z,Odd_Valuable1748,"Good news, now it's time to trade him to get flagg",-11,-10.0,1745968499.0,NBASpurs
mpqx45t,DriveForFive219,I sure hope he is. He’s my second fave current player for sure. Dudes a fucking dawggg,57,24191.0,1745968482.0,NBASpurs
mpqyena,scarlettsatt,I’m so proud of him 🥹 I hope he’s a Spur for life,15,4316.0,1745968902.0,NBASpurs
mpr0v26,YourNonExistentGirl,Spoilers for next season: >!🇺🇸!<,91,16187.0,1745969726.0,NBASpurs
mpriy1q,GGTae,"fun fact, the spurs are the only franchise since the ABA merger to have more than 3 roty",19,60479.0,1745975832.0,NBASpurs
mprqac5,Ishmael203,That’s impressive,5,21651.0,1745978336.0,NBASpurs
mpqxrgr,Internal-Range-675,I’m looking forward to them finally playing against each other,12,10654.0,1745968692.0,NBASpurs
mprowef,YungManJones,Where’s the ROTY thread on r/NBA ? I don’t see one,9,3916.0,1745977862.0,NBASpurs
mprarjz,v4nsuarez,Bontemps,7,5961.0,1745973064.0,NBASpurs
mpr3zqr,raceforseis21,"![gif](giphy|xUNd9IMywss6NTIghO)

Don’t ever say that again",5,77250.0,1745970766.0,NBASpurs
mpr0o23,SlyLipsKaitlyn,He made me proud.Fucking love him.,12,45.0,1745969659.0,NBASpurs
mprj8xp,Drisurk,I had no idea you put the flag behind a spoiler and I thought it was a soap bar on my phone 😂,43,47718.0,1745975938.0,NBASpurs
mpren1u,NotSerbian,Barron Trump?,-11,11372.0,1745974371.0,NBASpurs
mptndr6,jimmyrich,"The Spurs haven’t drafted high very often, but they’ve made it count.",6,29301.0,1746013171.0,NBASpurs
mprspx8,callipygian11,Bro I don't understand. It was there for a while earlier but it seems like it has been completely removed.,4,373.0,1745979183.0,NBASpurs
mprej4i,Chuggy_McChuggerson,I'd be incredibly shocked if it's not that chucklehead.,5,5344.0,1745974333.0,NBASpurs
mprk83c,Luc9By,I thought it was the white flag at first and I was concerned about the implications...,16,3321.0,1745976272.0,NBASpurs
mprv3ke,malvim,I saw it all white and hoped we were getting DWhite back 🥺,6,29264.0,1745980018.0,NBASpurs
mpwttxz,TheRealTofuey,That was the painful part before Wemby. It always felt like we could have drafted high any of the Derozan years if we just went in on the tank. It ended up working out getting Wemby. Almost to perfectly.,1,223268.0,1746048198.0,NBASpurs
mps7uxq,YourNonExistentGirl,How about >!🍼!<?,5,16187.0,1745984923.0,NBASpurs
mrftxe9,Titronnica,That's awesome! Where was this?,61,208709.0,1746806681.0,NBASpurs
mrfugk8,kunjacob,Hell yea. All my homies love Jeremy.,36,36489.0,1746806845.0,NBASpurs
mrftzd5,WormLetoII,"Damn, how I envy you",21,4428.0,1746806698.0,NBASpurs
mrfzslx,severalmountains,"I met him in Austin, the coolest dude. Everyone was taking pics with him and as he walked away I just brushed into him - told him his music taste is dope and I’m a fan. He was chill and we exchanged a few words!",8,1481.0,1746808491.0,NBASpurs
mrfyaow,YungJae,So cool! Congrats to Jeremy and yourself :),4,13139.0,1746808028.0,NBASpurs
mrfzs9q,Leafman1996,A man of the people,3,12199.0,1746808488.0,NBASpurs
mrfyqmn,VegasBass,Congrats!,2,6657.0,1746808165.0,NBASpurs
mrg00h2,sarmo215,Wow I know he’s tall obviously but next to a normal sized person he looks so long and lean! He seems more thick on the court. Guess perspective is everything. Kinda like how Wemby made Timmy look small. Haha,2,3963.0,1746808558.0,NBASpurs
mrg8tq6,Designer-Action3573,Omg I'm so jealous 😭😭,2,18704.0,1746811221.0,NBASpurs
mrg5h2m,NoShape0,"While wearing a Wemby jersey, the betrayal lol",3,17185.0,1746810206.0,NBASpurs
mrg9vja,Chance_Estimate2102,"How much time did you had with Sochan? 
Wonder if there’s any redditors that got the chance via Vivo event instead 🤔",1,758.0,1746811537.0,NBASpurs
mrgbkfk,CookOk7281,That’s awesome I’m sure that made your day!,1,85.0,1746812045.0,NBASpurs
mrgei5i,clbom,That's so exciting!! Lucky you!,1,866.0,1746812920.0,NBASpurs
mrgej90,This-Unit-1954,I like that they gave him a cushy chair like he’s Santa Claus.,1,9251.0,1746812929.0,NBASpurs
mrgwyvp,Einhander_pilot,"Congrats!!! 🎉

Was this at the Mall of Asia?",1,137024.0,1746818542.0,NBASpurs
mrh1kam,patar35,My favorite player since his year at Baylor.  Highest bball IQ and such a glue guy.  I hope we hold onto him for his entire NBA career,1,1567.0,1746819979.0,NBASpurs
mrh2ikg,Scared_Intention3057, Nice,1,9039.0,1746820271.0,NBASpurs
mrh2w52,Genji4Lyfe,This is quite possibly the cutest thing!! Great picture. Also love the leg art connection between you two,1,142936.0,1746820388.0,NBASpurs
mrgivds,Party-Ad4441,Did you meet him … or did he have the pleasure to meet YOU? 😏,-3,2082.0,1746814226.0,NBASpurs
mrfuov5,xlixri,"In Manila, Philippines. There was a raffle for a meet and greet with him and somehow I got lucky!",89,1170.0,1746806916.0,NBASpurs
mrfuwp1,xlixri,"I was fucking shaking man, first time I ever met any NBA player, let alone one of my favorites",32,1170.0,1746806985.0,NBASpurs
mrfutqi,xlixri,Hope you get to see him (or any of the other players) in the future man!,11,1170.0,1746806959.0,NBASpurs
mrg5zy5,xlixri,"They're not selling his jerseys locally, nothing I can do about that",11,1170.0,1746810366.0,NBASpurs
mrfuy2j,Titronnica,"Congrats!! That's some seriously incredible luck! 

Even more wonderful is that he took the time to visit Manila, he seems like such a cool dude.",17,208709.0,1746806997.0,NBASpurs
mrgb4hc,shinbreaker,That was about as random of a place to have a meet and greet with a Spur. Glad you had fun.,5,425494.0,1746811912.0,NBASpurs
mrfzrtj,sneakylumpia,where was this? is this the NBA Store in MOA or Megamall?,2,139769.0,1746808484.0,NBASpurs
mrfvl5a,kunjacob,Good for you! Happy to see our Philippine Spurs fam getting some love considering there’s a large number of you guys over there.,12,36489.0,1746807196.0,NBASpurs
mrg62vv,xlixri,MOA :),4,1170.0,1746810392.0,NBASpurs
mrf9v31,Moviereference210,Manu > harden and it’s not even close,14,150156.0,1746800552.0,NBASpurs
mrfcohx,R3l3AD3R,The finisher!  Watches us run the same play w 2 minute to go in a close game for years. Timmy w the high screen and roll for Manu. Ran it thousands of times. How in the the corner!  LFG,3,4.0,1746801435.0,NBASpurs
