id,author,body,score,comment_karma,created_utc,subreddit
mq80q76,Titronnica,"This was honestly what I was expecting.

I am glad to see he will still be involved in the organization, but it still hurts like a motherfucker all the same. 

Hope we find a worthy successor, but that's going to be one monumental task.",2,208707.0,1746203596.0,NBASpurs
mq80r5o,Dangerous_Skin_7805,At least he’ll be involved in selecting the new coach.,2,8951.0,1746203604.0,NBASpurs
mq81cel,agentb719,"I hated it had to end with an illness, but am happy he is still staying within the organization. Thank you Pop!",2,126404.0,1746203771.0,NBASpurs
mq81gjv,TheFashionCoach,I fell to my knees in the HEB parking lot upon hearing this news.,2,266.0,1746203804.0,NBASpurs
mq837au,Routine-Barnacle-660,"
I arrived in time to see this legend commanding Spurs (I've been a fan since January 2023)😥",2,702.0,1746204302.0,NBASpurs
mq840ds,Blank_Canvas21,"I know he’s still with the team and there will be his finger prints on the DNA of this team, it truly feels like the end of an era. I mean it sort of felt that way a decade ago as we were looking at the reality of saying goodbye to our big 3.",2,36027.0,1746204530.0,NBASpurs
mq8572d,papertales84,"Thank you for everything Pop. Your Beautiful Spurs showed the world that basketball is way more than just a bunch of stars, that team first and camaraderie and family spirit are the foundations to everything. We’ll miss you.",2,17352.0,1746204861.0,NBASpurs
mq877gl,chisports1fan,Spurs always been my favorite team in the west because of this man (and I’m sure for many others) 🫡 goat coach,2,13351.0,1746205421.0,NBASpurs
mq87kng,didymus_fng,Going to need a ‘Coach Pop’ jersey up in the rafters now.,2,107021.0,1746205527.0,NBASpurs
mq8azaz,angus0328,"Unfortunately, it was something we saw coming, we didn't know when, but it was going to happen, and even more so given the recent health problems we're all aware of. Anyway, and sadly, it's the end of an era. I started watching Spurs because of Manu back in 2003/2004, and Pop has always been there. It will be really strange not seeing him on the sidelines making his tricks.

It's a shame he didn't get to be Wembley's HC at his peak... I would have loved to see that. I honestly don't have many words. I wish you the best, Pop, and a long, healthy life. Warm greetings from Argentina.",2,2816.0,1746206483.0,NBASpurs
mq8d0l8,donuttrackme,![gif](giphy|3ohhwCv9Xn34EhoqEo|downsized),2,30947.0,1746207050.0,NBASpurs
mq8eypk,Lostheghost,![gif](giphy|YTK4TRYpsYP3Qv5P1J),2,40905.0,1746207602.0,NBASpurs
mq8l3jm,BwoyFredo,End of an Era 😭 thanks Pop for building the Spurs Franchise and giving us Dynasties. Forever the 🐐,2,357.0,1746209336.0,NBASpurs
mq907ak,HexagonStorms,I sincerely hope we get Becky Hammon has head coach.,2,41656.0,1746213793.0,NBASpurs
mqa5gst,Outside_Succotash279,"At my job, HC is short for head cashier, so I had a different reaction to this post initially",2,352.0,1746226735.0,NBASpurs
mqa7i3s,Atomic_Nexus,"https://preview.redd.it/mxxekwxoagye1.png?width=624&format=png&auto=webp&s=e1ee1c99bb4517f19c89873bbfbf75d4161cf0b5

I mean I get it, and I know it had to happen, but...",2,17357.0,1746227430.0,NBASpurs
mqalyuj,3-Ballin,President Popovich sounds badass,2,4060.0,1746232559.0,NBASpurs
mqap73r,jxyscale,"It sucks, revenge season of Wemby without Pop is hard. 😭 but good thing, they put him president of op. 👏🏽",2,3985.0,1746233727.0,NBASpurs
mqazf9m,nigagu,Is he going to run for pope?,2,578.0,1746237523.0,NBASpurs
mq90xbl,Small-Task1586,"This won't be popular... but Tim Duncan led the spurs to 5 titles. Pop is great, but didn't do a thing without Timmy.",2,579.0,1746214006.0,NBASpurs
mq7t1rk,SeeThisThrough,End of an era,1,2897.0,1746201400.0,NBASpurs
mq7tuy7,CapitalG888,"Best scenario. He can take care of himself and still contribute. 

Are we looking for a new coach for next season?",1,111122.0,1746201629.0,NBASpurs
mq7urcz,trentjpruitt97,"Thanks for everything, Pop. Hell of a run that’ll never be touched. So…who’s in line to take over? This could be very interesting this summer.

EDIT: oh, never mind then.",1,65916.0,1746201889.0,NBASpurs
mq7vxmx,ModsEmbezzleMoney,Please don't promote from within or hire one of the good ole boys.,1,164012.0,1746202225.0,NBASpurs
mq7wd4d,chameleonchild8,Pop has always had a keen eye for scouting talent. We still need that. Glad he’s staying with the org but I also think it’s time for a new coach,1,11204.0,1746202346.0,NBASpurs
mq7wj2y,Empty_Occasion_963,Who's gonna be the next HC.,1,860.0,1746202394.0,NBASpurs
mq7xjeo,balla_mang,I feel the same as the 1st time I listened to Blond for the 1st time 😭,1,7475.0,1746202682.0,NBASpurs
mq7xsif,TDB4421,Rest easy.,1,6466.0,1746202753.0,NBASpurs
mq7y539,WoweeZoweeDeluxe,"Love this for Pop to still be with the franchise, can’t wait for our next new coach",1,15202.0,1746202850.0,NBASpurs
mq7z1kh,Y_iseverynametaken_,"I will miss Pop on the sideline, like many of you I grew up with him as our coach. But I also want to see a new Spurs. Let’s get a good coach and win some games!",1,3169.0,1746203112.0,NBASpurs
mq7zmn2,scarykicks,This is the right move no matter how much we love Pop.,1,85610.0,1746203280.0,NBASpurs
mq7zsnw,GabiCoolLager,"Thank you, old man. You are the goat.",1,45214.0,1746203328.0,NBASpurs
mq801pq,ohyeah_mamaman,"Damn. I really wanted to see him get rings in four decades. Love you Pop, glad you’re sticking around.",1,27269.0,1746203401.0,NBASpurs
mq819bk,Jimmysmo27,Damn he’s been the spurs head coach for my entire lifetime.,1,4921.0,1746203747.0,NBASpurs
mq81qy0,tjvick,Fade me fam,1,13704.0,1746203887.0,NBASpurs
mq823tz,TrainingMarsupial521,We need to try and get Malone.,1,43942.0,1746203988.0,NBASpurs
mq82iij,No_Consideration3887,thank you for everything pop! Once a Spur always a Spur.,1,64587.0,1746204106.0,NBASpurs
mq82mw2,Waves0fStoke,We love ya Pop!,1,7022.0,1746204140.0,NBASpurs
mq834ek,chuck_ATX,"Love ya pop

Been with you the whole ride my friend",1,5910.0,1746204279.0,NBASpurs
mq84ryg,IMT_Justice,I am heartbroken but I hope this is best for Pop.,1,62073.0,1746204745.0,NBASpurs
mq84wdc,Traditional-Cat2570,This was not a very fiesta friday headline to read,1,9372.0,1746204780.0,NBASpurs
mq8605d,Common_Comedian2242,End of an era,1,4819.0,1746205086.0,NBASpurs
mq86m33,Rough-Cover1225,Man I thought they fired pop and was about to riot,1,11858.0,1746205254.0,NBASpurs
mq86oh3,Str8OutArgentinianML,And sadly our 2025/2026 is over with the Spurs confirming that idiot we have as HC.,1,19.0,1746205272.0,NBASpurs
mq87iu7,Yassoox99,"So, it's really over uh. Really, really weird feeling. I always thought we would get to see him atleast one more time on that bench ... I hope he will atleast be able to decide when to leave the basketball world, on his own terms",1,3048.0,1746205512.0,NBASpurs
mq88mdt,LaDainianTomIinson,End of an era,1,13815.0,1746205825.0,NBASpurs
mq88pfm,HoneyWildLocust,![gif](giphy|65zUoOU09HL3uUKokQ),1,608.0,1746205848.0,NBASpurs
mq892zq,natsucule,"I know it’s cheesy, but I can’t help but think of this quote from Dr Seuss:

“Don't cry because it's over. Smile because it happened.”",1,89992.0,1746205954.0,NBASpurs
mq89f1f,lanfordr,"Hoping he can hold on to the winningest coach title for a long time. Only current head coaches with a chance of passing him is Doc Rivers and Eric Spoelstra. If it happens, I really hope it isn't Rivers.",1,15943.0,1746206046.0,NBASpurs
mq89is4,These_One1186,"No one better than the free spirited, foul-mouthed, sarcastic, “POP”, (Saying it only like Tony Parker always said). I love Pop we’ve been through it all with him & I’ve never met or been in the same room with him. We had season tickets when we first started watching him assist. I’ve always liked the man. Been married, 1 year less, almost as long as Pop’s been the Spurs coach & we three, including Pop are all still going strong 💪. Pop por vida forever and always, we love you!🥰 ✌🏼❤️‍🔥",1,19.0,1746206075.0,NBASpurs
mq8aj8m,Chilipatily,Well shit.,1,76952.0,1746206360.0,NBASpurs
mq8anqk,dantrevino,![gif](giphy|3o6wrebnKWmvx4ZBio),1,105.0,1746206394.0,NBASpurs
mq8b2mw,TheNFSIdentity,"He deserves it. Pop joined this team at a time when its future was still in the works with David.. but the rest is history. And now he's leaving this team in the works again, but in the best position they've ever been in years; I can't even imagine what it would've been like if we never had him to rely on.


Pop gave this team more than championships and trophies; he gave it an identity. He turned the Spurs into a team that is respected, reliable, and plays clean basketball. A team that never gets too cocky, learns from its mistakes, and made it a principle to ball out every time.


One of the biggest reasons I love this team is because of this man right here and what he made it into. But I'm glad that he's putting his health first no matter what. Gregg Popovich will always be the San Antonio Spurs to me even if he's no longer leading them...so thank you Coach Pop. Forever.",1,3990.0,1746206509.0,NBASpurs
mq8blwp,Bballdak12,"I really hope he ceremoniously coaches the home opener 

Would be good to have a game for closure for him and the city",1,1810.0,1746206659.0,NBASpurs
mq8cmuy,zazenpan,Mr. President.,1,6919.0,1746206944.0,NBASpurs
mq8e5i0,fictionalreality08,"Thank you, Gregg!",1,29748.0,1746207371.0,NBASpurs
mq8ej4c,HumorMaleficent3719,"let's be real, we all saw this coming. the great thing is that he still has a role within the organization. but man, talk about the end of an era!",1,2347.0,1746207479.0,NBASpurs
mq8eman,FirebatM3,A great coach and a greater man. Will miss him greatly,1,6320.0,1746207504.0,NBASpurs
mq8fewg,Thebarakz21,"Pop started coaching the Spurs in 96, before I became a Spurs fan. Didn’t become one until 2002, and now I’m 36. Truly speaks to his longevity. It’s TRULY the end of an era, wherein we’ll never see the big three AND NOW Pop on the court. Thanks for the memories, GOAT. Now time for you to sit back and enjoy doing what you love: drinking wine and scheming for our next titles!",1,28264.0,1746207728.0,NBASpurs
mq8ghy6,Moviereference210,Truly goated,1,150155.0,1746208034.0,NBASpurs
mq8i3sa,DckThik,This has got to be part of the project marvel,1,4892.0,1746208486.0,NBASpurs
mq8kwxx,geekstone,Hopefully the new area will have some way to honor him in naming something or putting a statue in front.,1,56520.0,1746209283.0,NBASpurs
mq8obug,DreGotDaSauce,"sucks we couldnt give him the farewell he deserves, but glad he can remain apart of the team. hopefully hes not working too hard with this new position haha. love you pop",1,7469.0,1746210271.0,NBASpurs
mq8oxmg,FunnyScreenName,"Man, pop is the only coach I’ve ever known. ☹️",1,69201.0,1746210450.0,NBASpurs
mq8qafz,Castreal7,"Coach Bud, you know what to do",1,12916.0,1746210851.0,NBASpurs
mq8s9mb,user6517,"Thank you, Pop ❤️",1,224.0,1746211436.0,NBASpurs
mq8satj,Dagen68,Absolute NBA Legend and great human being,1,1923.0,1746211446.0,NBASpurs
mq8tnq9,JNorJT,end of an era,1,80639.0,1746211848.0,NBASpurs
mq8uw8j,Quake1028,The GOAT,1,28342.0,1746212214.0,NBASpurs
mq8uyvo,pixelgeekgirl,The end of an era,1,33613.0,1746212237.0,NBASpurs
mq8zl7i,concerneduck,Wow… an end of an era,1,988.0,1746213610.0,NBASpurs
mq92e2s,gauss05,Damn. He has been the only Spurs coach I have ever known.,1,1647.0,1746214447.0,NBASpurs
mq93jqk,billymcbobjr,"As a celtics fan, i would like to thank and congratulate Greg for maybe the best coaching career of all time.",1,10240.0,1746214791.0,NBASpurs
mq98rc2,SuccotashConfident97,"Thank you for everything Pop, but for your own healths sake, I'm glad.",1,97816.0,1746216342.0,NBASpurs
mq99ifs,Titansfan9200,My childhood man. :'(,1,48571.0,1746216567.0,NBASpurs
mq9c66w,Alone_Butterfly8582,"Wow, finally, at least he got a year with future",1,410.0,1746217353.0,NBASpurs
mq9di18,ericbee99,Don’t be sad it’s over. Be happy you got to see it all happen.,1,1176.0,1746217745.0,NBASpurs
mq9drgm,tombombman,He can still be the father figure that our players need without the stress of being on the court. I hope he is able to be there during practices though.,1,1086.0,1746217821.0,NBASpurs
mq9e5ay,No_Ad1198,"As an ardent Laker fan, Pop and the Spurs have always been a threat, and I disliked them. But Pop, as a standalone has never ceased to amaze and impress me with his stance on social causes and justices. The man is outright a beacon humanity in the sports realm. He’s a real one.",1,2274.0,1746217934.0,NBASpurs
mq9gcps,smiles__,"I'm only a very light casual basketball fan, but I've appreciated his voice on non-basketball matters when he get asked about things (or brings them up himself). He's always seemed like a thoughtful and kind guy, which is nice.",1,20817.0,1746218584.0,NBASpurs
mq9h4u8,Significant_Slip_883,"I really wished he could coach Wemby to his first title. Damn I bet he really wanna do that too. I feel so sorry for him.

On the other hand his health seems not to be up for it. And I am glad he make this decision now instead of risking. If shit happens I don't think I will ever get over seeing him collapsing on court. Even typing this sentence out give me chills.",1,2053.0,1746218813.0,NBASpurs
mq9hk5t,TonyPerkis13,He should make Tim Duncan speak to reporters on his behalf regarding his coaching retirement. Since Pop had to do that for Tim's retirement 😂,1,136.0,1746218937.0,NBASpurs
mq9hyxh,None,[removed],1,,1746219058.0,NBASpurs
mq9lnlw,Putrid-Impact8999,What a career.  Delighted he is going to be president of the Spurs.,1,48123.0,1746220167.0,NBASpurs
mq9lxeb,DatBoyBlue91,This isn’t shocking but I knew he wasn’t the coach after the health failure. I love Pop to this day. I want him healthy not dying on the sidelines.,1,2619.0,1746220251.0,NBASpurs
mq9m84b,xnoob69,"End of an era, greatest coach ever!",1,3522.0,1746220345.0,NBASpurs
mq9ntc1,Viniximkriok,I Will miss him too much,1,15.0,1746220836.0,NBASpurs
mq9o65e,coolcoolnodoubt,"I hope his health gets better. Thank you, Pop 🥺",1,86614.0,1746220948.0,NBASpurs
mq9po11,Kind_Significance_60,"It's disappointing but it's time. 
Thanks Coach Popovich for all the great memories.",1,14209.0,1746221421.0,NBASpurs
mq9pos9,shantysun,I love this man!!!,1,17896.0,1746221427.0,NBASpurs
mq9rhnr,D3VOUR3DD,Congratulations pop on a stellar career. I think the writing was on the wall when he collapsed at the restaurant. Spurs had to make an early decision here to get started for next season,1,20202.0,1746222006.0,NBASpurs
mq9t64f,Training-Run-1307,The 🐐,1,12782.0,1746222550.0,NBASpurs
mq9tsfm,Snowmann88,GOAT.,1,61629.0,1746222746.0,NBASpurs
mq9v0d6,radicalcamel,"The greatest to ever do it, lucky for us he will still be around the organisation",1,33272.0,1746223145.0,NBASpurs
mq9vf55,MiNaMonator,o7 pops,1,4217.0,1746223281.0,NBASpurs
mq9w0xt,guitarmaestro1,"Sad that he is not a head coach but can I understand the reasons. I remember when I used to watch his Spurs play the Lakers back in the Kobe/Shaq/fischer/gasol days , and even though I was a Laker fan he had my respect as a coach. He was pretty good. I wish him well.",1,1049.0,1746223484.0,NBASpurs
mqa8wa1,VirtualRamen,GREAT CAREER GOAT,1,1381.0,1746227905.0,NBASpurs
mqab720,mikessis,Oh gosh darn.  Love him!,1,7.0,1746228693.0,NBASpurs
mqafeaa,Don-Goyo-lab-freak,Love Pop,1,161.0,1746230161.0,NBASpurs
mqag636,outer_bongolia,"Thank you Pops. 

I am thankful for everything you did - not just for Spurs and basketball but for humanity.",1,498.0,1746230435.0,NBASpurs
mqaui9g,throaway3769157,o7,1,20223.0,1746235690.0,NBASpurs
mqb0ggv,DWN_WTH_VWLz,Thank you for everything Big Dawg. The GOAT of coaches,1,4182.0,1746237916.0,NBASpurs
mqb8emx,gringosam,Bring back Becky!,1,575.0,1746241065.0,NBASpurs
mqba1ov,TheGavinC,End of an era 🥲,1,250.0,1746241748.0,NBASpurs
mqbaws6,JohnnyBravo011,I just watched a doc on him last night...sorry guys,1,2326.0,1746242112.0,NBASpurs
mqbkxh2,Lazydissident,Run for fucking President.,1,1908.0,1746246614.0,NBASpurs
mqbky61,SpecialistAstronaut5,Good for him. I hope he stays healthy and happy.,1,4418.0,1746246623.0,NBASpurs
mqbmmbn,Malemansam,"I hope we get to see him sitting in the stands like Red used to for the Celts. Up there with Manu and Tony/Timmy when they're around, or maybe down on the sideline with Admiral hahaha. 

Never in my dreams did I think he would coach for as long as he did back when he took over but he just kept winning and setting a standard and he's one of the biggest reasons why I've enjoyed my life so far, I can't thank him enough for the joy this team has given me and I hope that standard will continue on while he's with us.",1,203301.0,1746247458.0,NBASpurs
mqbnrp9,funkolicious,"Been reading Pop articles and tributes all day—the more u read about him, the more u realize what a steaming piece of crap Trump is—polar opposites—sorry—just a fact",1,760.0,1746248049.0,NBASpurs
mqbo9tl,9thst_worker,"I have been a Spurs fan since I was 11 years old. I only know one coach for the San Antonio Spurs: that's Pop. No matter who steps in for Pop, whether it's Tim, Becky, Brett, or anyone else, Pop is always and will be the only Spurs coach in my heart. Pop demonstrated not only toughness in terms of coaching but also shared so much love and humanity with the players. I guess that's why so many people love him. Thank you, Pop. 

  
In term of the new coach, I really do not understand the decision. There are so many great coaches we can choose from. Taylor Jenkin, Miky Malone, Mike Brown, Mike Budenholzer... the list can keep going. Many of the coaches I mentioned earlier had relationship with the Spurs organization. Yes! Promoting Johnson is the easiest move, but is it the best move? In my opinion, Wendy, Fox, CP3, or even Castle is on a pretty tight timeline, in order for this group of great players to thrive, we need a better coach than Johnson. 

#",1,24.0,1746248308.0,NBASpurs
mqbqequ,Echo_Origami,"Pop is the last great coach from the old era.  It truly is the end of an era. He was the last of his kind.   

I always look at who is coaching and there are so many new faces.    Phil Jackson is around no more.  He and Phil Jackson were extraordinary coaches.",1,12301.0,1746249435.0,NBASpurs
mqbsa4t,Megumi-Noda,Good fucking riddance.,1,25843.0,1746250453.0,NBASpurs
mqbt1jq,SlightCartoonist8144,End of an era. Sorry Spurs bros. Thanks for the memories Pop. From a 2000s era Laker fan.,1,970.0,1746250873.0,NBASpurs
mqc0f1f,yesimforeign,"So long, partner 😞",1,95054.0,1746255167.0,NBASpurs
mqc2fs1,Emotional_Photo9268,"Pop served them well but he went about 5 years past his expiration date. He should have left with Timmy.   
The new coach will be there a year or less then get fired after not making the playoffs for 6 straight years.",1,282.0,1746256374.0,NBASpurs
mqc4rel,benglynstone97,End of an era. Spurs won’t be the same without him at the helm.,1,1512.0,1746257814.0,NBASpurs
mqcggza,Leormas,"End of an era. Pop changed the game - thank you for the legacy, Coach.",1,1155.0,1746265263.0,NBASpurs
mqcygrr,ShikasC,End of a legendary era. Spurs won’t be the same without him on the sidelines.,1,788.0,1746274691.0,NBASpurs
mqdab1p,Sensitive-Passage-87,Retire and enjoy. Stop being a leech,1,199.0,1746279351.0,NBASpurs
mqdaic9,luckycharmsyo,End of an era. Pop's legacy will live on in the Spurs' culture and every game he influenced.,1,1442.0,1746279424.0,NBASpurs
mqdt6a1,T2Runner,"Lakers fan but here to salute an absolute mother fucking legend that is Coach Pop.  


✊🏽✊🏽✊🏽",1,12079.0,1746285561.0,NBASpurs
mqdul68,jo3pro,"He will be missed on the sidelines, but honestly this is the best decision. 

His health is declining and he isn’t getting any younger. I hope he attends some games and let the fans show him love. I hope I’m there when this happens. 

I have so much respect for coach Pop. I’m a black veteran who consistently appreciated him voicing his thoughts on our country’s problems even when he got backlash for it. I know many will think he didn’t, but in Texas as a whole a lot of folks were turned off by him being so outspoken. 

It will be a sad day in San Antonio when he isn’t around anymore.",1,24268.0,1746286007.0,NBASpurs
mqh1497,Nadecha28,Lebron is gona be the same age when he decides to retire,1,1438.0,1746325169.0,NBASpurs
mqhlhu6,Asaenz76,Who's going to coach now tim Duncan or the ex head coach of nuggets,1,1248.0,1746334243.0,NBASpurs
mqma4in,NorahCeCe,"Bonne chance, mon cher leader!",1,12481.0,1746400717.0,NBASpurs
mqp5nif,Cyclist83,"I am 41 years old and German.
There used to be no League Pass here and very little NBA on TV. We are a football country and this sport dominates everything here. So I only started watching the NBA when I was about 12/13 years old because there was a proper NBA TV show in German at the time. (Inside NBA with Frank Buschmann) 
So I don't even know the nba without pop.",1,11951.0,1746449214.0,NBASpurs
mqtq9di,hunterxdr,"I'm a Phoenix Suns fan and the Spurs have broken my heart many times, but you guys have had the greatest coach of all time. I've always admired his unshakable character. The Spurs basketball culture is unique in the NBA and it all starts with this man.",1,686.0,1746501480.0,NBASpurs
mqtq9ob,UnderstandingWeary79,I thought he died like a year ago.,1,202.0,1746501483.0,NBASpurs
mq7tdz0,sherlock-spreadsheet,"So... Popovich will still be a great asset to the Spurs! Honestly, at is age, is this not better? Don't we need someone with some ENERGY, with some NASTY? He was 50 at our first championship and he is now 76. 



Core Duties of an NBA Team President, as I understand it:

Sets the overall vision and direction of the team.

Works closely with ownership to align business and basketball goals.

May help develop long-term plans for winning championships, growing revenue, or expanding brand presence.

Supervises the general manager (GM) and supports major decisions like: Trades, free agency, and draft picks, Coaches, Player development

Not always involved in day-to-day player evaluations, but may weigh in on high-level roster construction.

Bridges ownership, basketball ops, and business ops (marketing, ticket sales, etc.).

Helps set and maintain the team’s culture and identity.

Involved in hiring senior staff and setting department goals.",1,362.0,1746201496.0,NBASpurs
mq7t0ry,Worth_Ambition_8496,What do we think the chances of Duncan taking over are?,0,24.0,1746201392.0,NBASpurs
mq88qo9,Acrobatic_Channel_74,Without Tim Duncan he wasn’t a good coach…,-7,69.0,1746205858.0,NBASpurs
mq7rsqd,AnonymousNeedzHelp,Likely the best thing for the team at this point,227,9030.0,1746201049.0,NBASpurs
mq7uqpv,Dsarg_92,"Agreed. While it is sadly understandable of him to step down as a head coach, I am ready to embrace a new era. I wish Pop the very best.",11,209041.0,1746201883.0,NBASpurs
mq9zv9l,BigMatch_JohnCena,"Most times people leave a position and team, honestly fans in general gotta be grateful he’s still with the organization, it’s not a complete loss it could be much worse",1,32666.0,1746224794.0,NBASpurs
mq8jf33,vickyd04,Can I just wait in silence next to you. 😔,11,1203.0,1746208857.0,NBASpurs
mq8hq0j,Background_Touchdown,"And knowing Pop, he would hate every minute of it.  Never was a spotlight kind of guy, to his credit.",34,60526.0,1746208379.0,NBASpurs
mqbqi9d,Echo_Origami,"Pop is the last great coach from the old era.   Sad to see him go.  I knew he was going to go.   Kind of amazed he was still hanging around this long.

But heading to team President was always something Pop had going for him.   It is about time now.  He deserved all the success.

Just wish he could have gotten one more championship with Wemba.

That would be   David Robinson, Tim Duncan and Wemba.   The big three.",1,12301.0,1746249485.0,NBASpurs
mq88ol9,fisheggsoup,"I got ya', fam. 🫂",2,39189.0,1746205843.0,NBASpurs
mq9zsw9,BigMatch_JohnCena,"Most times people leave a position and team, honestly fans in general gotta be grateful he’s still with the organization, it’s not a complete loss it could be much worse",1,32667.0,1746224771.0,NBASpurs
mq7soux,DriveForFive219,Def a where were u moment. It is truly the end of an era,16,24191.0,1746201301.0,NBASpurs
mqbqv8q,Echo_Origami,Wish he could have gotten one last championship with Wemba.      That would be the big three  from Robinson to Duncan to Wemba.,2,12301.0,1746249684.0,NBASpurs
mq8aath,valhamag,![gif](giphy|l3q2XhfQ8oCkm1Ts4|downsized),21,342.0,1746206295.0,NBASpurs
mq9f52f,Significant_Slip_883,Take a lot for a Lakers fan to say that. Respect.,6,2053.0,1746218227.0,NBASpurs
mqbr4rk,Echo_Origami,"As far as being a better man and coach, I would agree.  Phil Jackson and Kobe Bryant got into it.    You never hear anything about Coach Pop going into it with his players.    Duncan.   Parker.  Robinson.  Manu.  They all respected him.",2,12301.0,1746249827.0,NBASpurs
mq7vnaa,androidrhyme,Username checks out,17,19812.0,1746202142.0,NBASpurs
mq7zbfo,octavish_,Joining you brother. Going to HEB need anything?,2,14270.0,1746203191.0,NBASpurs
mq7u0jw,Joethetoolguy,I got something in my eye…,5,17273.0,1746201672.0,NBASpurs
mq7uvup,No_Amoeba_9272,Your math doesn't math,12,19266.0,1746201925.0,NBASpurs
mq8pqfq,Bigdizzofoshizzo,You are OLDER than Pop?,-1,13279.0,1746210686.0,NBASpurs
mq7ucd7,Joethetoolguy,Statue is better just dont hire the dwade guy,23,17273.0,1746201768.0,NBASpurs
mq7vpyp,Nick-Pickle831,Put the career wins on the banner.,10,4462.0,1746202164.0,NBASpurs
mq7xaza,bleu_waffl3s,It was almost 30 years,2,56855.0,1746202616.0,NBASpurs
mq83nj1,homeycuz,Mitch has already been named head coach?,8,26606.0,1746204430.0,NBASpurs
